Affiliation Number,Name,Head/Principal Name,Status,Affiliated unto,Address,Phone no.,Email,Website
740008 ,JAWAHAR NAVODAYA VIDYALAYA,SOM NATH,Senior Secondary,31/03/2022,"BASOHLI DISTT. KATHUA JAMMU & KASHMIR ,184201","0192 ,1251670",snbhagat1963@gmail.com,
740009 ,JAWAHAR NAVODAYA VIDYALAYA,ZAFFAR IQBAL QURESHI,Senior Secondary,31/03/2025,"SURANKOT DISTT. POONCH JAMMU & KASHMIR ,185121","1965 ,230084",jnvsurankote1986@gmail.com,
740010 ,JAWAHAR NAVODAYA VIDYALAYA,SUKHRAJ KAUR,Senior Secondary,31/03/2024,"N U D P W D RENTAL HOUSING COLONY SAMBA DISTT JAMMU JAMMU & KASHMIR ,184121","1923 ,219097",jnv_nud_samba@yahoo.com,
1640003,JAWAHAR NAVODAYA VIDYALAYA,JAIPAL SINGH JAMWAL,Senior Secondary,31/03/2022,"VILL & PO BRING KHERA DISTT MUKTSAR PUNJAB ,151211","1637 ,271624",JPSINGHJAMWAL@GMAIL.COM,
740011 ,JAWAHAR NAVODAYA VIDYALAYA,EKRAMUDDEEN,Senior Secondary,31/03/2025,"AISHMUQAM DISTT ANANTNAG JAMMU & KASHMIR ,192129","1936 ,210514",dr.ekramsiddiqui@gmail.com,
740014 ,JAWAHAR NAVODAYA VIDYALAYA,ZAHOOR AHMED BHAT,Senior Secondary,31/03/2021,"GANDER BAL DISTT. SRINAGAR HATABARA JAMMU & KASHMIR ,192101","0194 ,2102039",zahoor010@gmail.com,
740001 ,JAWAHAR NAVODAYA VIDYALAYA,ABDUL HAMID,Senior Secondary,31/03/2021,"AGLAR PULWAMA JAMMU & KASHMIR ,192305","0193 ,264566",a.hamidjnvt@gmail.com,
740016 ,JAWAHAR NAVODAYA VIDYALAYA,MOHAMMAD ASHRAF WANI,Secondary School,31/03/2020,"MIRHAMA, DISTT. KULGAM, J & K ,192231","1931 ,260077",ASHRAFWANI45@GMAIL.COM,
1640018,JAWAHAR NAVODAYA VIDYALAYA,PARAMJIT SINGH,Senior Secondary,31/03/2025,"AWAN, P.O. RAMDAS, DISTT. AMRITSAR, PUNJAB ,143603","0185 ,232008",PARAMJITPPLS@GMAIL.COM,
740005 ,JAWAHAR NAVODAYA VIDYALAYA,RAMKESH MEENA,Senior Secondary,31/03/2023,"KOTRANKA DISTT RAJOURI JAMMU & KASHMIR ,185136","0000 ,0000000",mramkesh564@gmail.com,
2640001,JAWAHAR NAVODAYA VIDYALAYA,Santosh Sharma,Senior Secondary,31/03/2022,"SECT 25 (W) CHANDIGARH ,160047","0172 ,2710236",sharmasantosh1611@gmail.com,
1640001,JAWAHAR NAVODAYA VIDYALAYA,RAJAN KUMAR,Senior Secondary,31/03/2025,"V P O FAROUR NEAR KHOMAN KALAN DISTT FATEHGARH SAHIB PUNJAB ,140801","1628 ,268281",kumarrejen1@rediffmail.com,
740012 ,JAWAHAR NAVODAYA VIDYALAYA,MPS SOLANKI,Senior Secondary,31/03/2023,"LALAB PUTUSHAI KUPWARA JAMMU & KASHMIR ,193223","0195 ,00000000000",jnvkup@yahoo.in,
1640022,"JAWAHAR NAVODAYA VIDYALAYA , DABURI",MR. PARAMJIT SINGH,Senior Secondary,31/03/2022,"VILL. DABURI HADBAST NO. 198,TRIMO ROAD PO. MAGAR MUDIAN DISTT. GURDASPUR (PUNJAB) ,143521",",01858232008",jnvgurdaspurnew20@gmail.com,
740100 ,JAWAHAR NAVODAYA VIDYALAYA KISHTWAR,MR. ROSHAN LAL,Secondary School,31/03/2024,"JAWAHAR NAVODAYA VIDYALAYA, N.H.P.C COLONY SHALIMAR, CITY & DISTT. KISHTWAR (J&K)-182204 ,182204",",01995261455",jnvkishtwar@gmail.com,www.jnvkishtwar.in
3740002,JAWAHAR NAVODAYA VIDYALAYA SANKOO,BALOO RAM MEENA,Senior Secondary,31/03/2022,"KARGIL V P O SANKOO TEH &DISTT KARGIL ,194105","1985 ,278041",balurammeena10@gmail.com,
740018 ,"JAWAHAR NAVODAYA VIDYALAYA, DISTT. RAMBAN J&K",MR. AMAN CHAND,Secondary School,31/03/2022,"JAWAHAR NAVODAYA VIDYALAYA, WARD NO. 03, BATOTE, DISTRICT- RAMBAN, J&K - 182143 ,182143","1476 ,9149886280",jnvramban@gmail.com,https://navodaya.gov.in/nvs/nvs-school/RAMBAN/en/h
1630710,"JEEVAN JYOTI PUBLIC SCHOOL,",MR. ANUJ CHHABRA,Senior Secondary,31/03/2025,"V- BHAINI MIAN KHAN,DIST. GURDASPUR, PUNJAB DISTRICT - GURDSPUR ,143517","1872 ,01872243690",jjmhsprincipal@yahoo.co.in,www.jeevanjyotipublicschool.org
1630435,JESUS SACRED HEART SCHOOL,Kirti Sharma,Senior Secondary,31/03/2023,"DX-1 SOUTH CITY LUDHIANA PUNJAB ,141004","0161 ,9216000465",kirtisharma.283@gmail.com,
1630563,JESUS SAVIOUR'S SCHOOL,PRAMOD JOSEPH,Senior Secondary,31/03/2026,"NEAR TEHSIL COMPLEX ,141127","1628 ,268244",indpramod@yahoo.com,http://www.gmail.com
1630170,JESUS SAVIOURS SCHOOL,LEJU SABU,Senior Secondary,31/03/2022,"SHAMSHER NAGAR SARHIND DISTT FATEGHGARH SAHIB PUNJAB ,140406","1763 ,222644",LEJUSABU@YAHOO.COM,
1630363,JESUS SAVIOURS SCHOOL,S MERLIN JOHNS,Senior Secondary,31/03/2026,"MARULI KALAN MORIENDA DISTT ROPAR PUNJAB ,140101","0160 ,2627248",jebajayakumar115@gmail.com,
1630144,JHAMKU DEVI GIRLS SCHOOL,DEVARAJ V,Senior Secondary,31/03/2023,"DHORA MEHRAJPUR ABOHAR DISTT. FEROZEPUR PUNJAB ,152116","91 ,9257412221",DRGNARACKAL@GMAIL.COM,
1631282,JITENDER VEER SARVHITKARI MODEL SR. SEC. SCHOOL,MRS. KAVITA ATRI,Senior Secondary,31/03/2023,"SITE NO-2,SEC-71 ,160071",",160071",jvssec71@rediffmail.com,
1630562,JIYA LAL MITTAL D.A.V. PUBLIC SCHOOL,Rajiv Bharti,Senior Secondary,31/03/2025,"V.P.O. HAYAT NAGAR, KALANAUR ROAD ,143521","0 ,9417700374",rbharti2008@gmail.com,www.jlmdav.com
740019 ,JNV PULWAMA,MR. MOHAMMED AKRAM GANIEE,Secondary School,31/03/2024,"VILLAGE NOWNAGRI TAHAB ,192301",",6005388983",jnvpulwama2020@gmail.com,www.jnvpulwama.org.in
730038 ,JODHA MAL PUBLIC SCHOOL,Mr.Deep Khare,Senior Secondary,31/03/2023,"CHANNI HIMMAT, JAMMU BYE PASS ROAD JAMMU (J&K) ,180011","0191 ,2466092",principaljodhamal@gmail.com,
730049 ,"K C GURUKUL PUBLIC SCHOOL,",Sagar Banerjee,Senior Secondary,31/03/2024,"JAKHAR , UDHAMPUR ,185203","0199 ,9622922177",omsaisagar909@gmail.com,http://www.yahoo.com
730043 ,K C INTERNATIONAL SCHOOL,MAYA MISHRA,Senior Secondary,31/03/2023,"AKHNOOR ROAD PALOURA JAMMU J & K ,180002","0191 ,2506230",principal.kcinternationalschool@gmail.com,
1630319,K C M MEMORIAL SCHOOL,DEEPA BAGAL,Senior Secondary,31/03/2026,"RATTAN GARH TEH PATHAN KOT DISTT GURDASPUR PUNJAB ,143534","1875 ,255339",kcmrtg@gmail.com,
1630305,K C PUBLIC SCHOOL,SURENDER KAUR,Secondary School,31/03/2007,"LADOWALI ROAD BSF CHOWK, JALANDHAR PUNJAB ,144001","0181 ,2222155",,
1630264,K C PUBLIC SCHOOL,Dr Madhu Chopra,Senior Secondary,31/03/2023,"KARYAM ROAD NAWANSHAHAR PUNJAB ,144514","1823 ,504218",kcpian@rediffmail.com,
730026 ,K C PUBLIC SCHOOL,MR. AMARENDRA KUMAR MISHRA,Senior Secondary,31/03/2025,"AKHNOOR ROAD JAMMU JAMMU & KASHMIR ,181205","0191 ,01912552204",principal@kcpublicschool.org,www.kcpublicschool.org
1630183,K L M INTERNATIONAL SCHOOL,Ms. Sunaina Sambyal,Senior Secondary,31/03/2025,"DEFENCE ROAD SIUNTI PATHANKOT PUNJAB ,145001","0186 ,2347186",munishsrivastava@live.com,www.klminternationalschool.in
1631084,K.D PUBLIC SCHOOL,Krishan Sharma,Secondary School,31/03/2025,"VILLAGE TARE WALA, P.O CHAK VAROKE ,152024","1638 ,251034",Sharma.Krishan61@gmail.com,http://kdpublicschool.com
1631102,K.D.INTERNATIONAL SCHOOL,MRS. PARAMJIT KAUR,Senior Secondary,31/03/2024,"CHABAL BYE PASS TARN TARAN ,143401",",8727030011",kdintschool@gmail.com,www.kdistt.com
1630590,K.D.INTERNATIONAL SCHOOL,NARESH JAMWAL,Senior Secondary,31/03/2026,"NEAR PETROL PUMP, CHANDIGARH HIGHWAY, LANGERI ROAD- ,146105","1882 ,247851",jamwal09@yahoo.com,http://www.kdgroupofinstitutes.com
2630046,KAILASH BAHL D A V CENTENARY PUBLIC SCHOOL,POOJA PRAKASH,Senior Secondary,31/03/2023,"SECTOR 7 B CHANDIGARH ,160019","0172 ,2791496",kbdav7@gmail.com,
1631043,KALGIDHAR ACADEMY SENIOR SECONDARY SCHOOL DUGRI,MRS. GAGANDEEP KATOCH,Senior Secondary,31/03/2024,"VILL. DUGRI, TEH. PAYAL, PO RAJGARH, DISTT. LUDHIANA-141421 (PUNJAB), INDIA ,141421","0161 ,1612847777",kalgidharacademy@gmail.com,http://www.kalgidharacademy.com
1630509,KALGIDHAR INTERNATIONAL SCHOOL,PANKAJ RANA,Senior Secondary,31/03/2025,"VILL. PURANA SHALLA ,143530","1874 ,7508805251",principal25273@gmail.com,
1631101,KALGIDHAR NATIONAL SR. SEC. SCHOOL MUNGO,MRS. GURDEEP KAUR,Senior Secondary,31/03/2025,"VILL. MUNGO, P.O.FATEHPUR,TEH. NABHA, DISTT. PATIALA ,147202","1765 ,01765237050",knsssmungo@gmail.com,www.knsmungo.com
1630432,KALGIDHAR PUBLIC SCHOOL,NEERU,Secondary School,31/03/2025,"PANNI WALA FATTA MUKTSAR, PANNIWALA FATTA VILLAGE, MUKTSAR, PUNJAB ,152101","1637 ,242072",kalgidharpublicschool@gmail.com,kalgidharmks.in
1630445,KAMLA NEHRU PUBLIC SCHOOL,PARAMJEET KAUR DHILLON,Senior Secondary,31/03/2022,"CHAK HAKIM, PHAGWARA, DISTT KAPURTHALA, PUNJAB 144402 ,144402","1824 ,229583",pkdhillon_08@yahoo.com,
1631155,KAPILA MODEL SCHOOL,MRS. MOHINDER KAUR,Secondary School,31/03/2025,"VPO SANDAUR - 148020 ,148020","1675 ,9914422444",kapilamodelschool@gmail.com,kapilamodelschool.in
730064 ,KARTAR PUBLIC SCHOOL,Manjula Dogra,Senior Secondary,31/03/2026,"NH-1A, BARNOTI, DISTT KATHUA, JAMMU & KASHMIR ,184341","1922 ,231039",kpskathua@yahoo.com,
1631027,KAY JAY INTERNATIONAL PUBLIC SCHOOL,MR.NIRBHAI SINGH,Senior Secondary,31/03/2022,"VILLAGE RASULPUR P.O. CHAPPER, SEAL ROAD, PATIALA ,147021","1762 ,01762-238698,",kjinstitutes@gmail.com,http://www.kjipspatiala.com
1631052,KAY JAY MODEL HIGH SCHOOL,MRS. RUPINDER KAUR,Senior Secondary,31/03/2024,"KJMPS, GATE 1, URBAN ESTATE PHASE 3, PATIALA ,147002","0175 ,1752284004",kjmpublicschool@gmail.com,www.kjmhspatiala.com
730056 ,"KC GURUKUL PUBLIC SCHOOL PALOURA, JAMMU",Banashrii Bijoli Barman,Senior Secondary,31/03/2021,"KC GURUKUL PUBLIC SCHOOL HO 1B.C. ROAD JAMMU ,180002","0191 ,2501509",kcgurukuljmu@gmail.com,
700020 ,KENDRIYA VIDYALAYA,C R BHAGAT,Secondary School,31/03/2022,"DAMANA LALE DE BAGH P.O. VILLAGE SANGRAMPUR TEH. & DISTT.- JAMMU, JAMMU & KASHMIR ,180002","0191 ,2605970",crbhagat8@gmail.com,
700022 ,KENDRIYA VIDYALAYA,ISHPAL SINGH,Senior Secondary,31/03/2022,"JINDRAH P.O. KANYALAYA DISTT. JAMMU, JAMMU & KASHMIR ,180003","0191 ,2661141",kvjindrah@gmail.com,www.kvjindrah.com
700023 ,KENDRIYA VIDYALAYA,MANISH TULI,Senior Secondary,31/03/2014,"KALUCHAK AT SUNJUWAN, JAMMU P O. SAINIK COLONY JAMMU & KASHMIR ,180010","0191 ,2462357",manishtulijnv@gmail.com,www.kvjindrah.com
700032 ,KENDRIYA VIDYALAYA,B R Kishor,Secondary School,31/03/2010,"PAHALGAM DISTT ANANTANAG J&K ,192126","0193 ,243156",brkishorkv@gmail.com,
700029 ,KENDRIYA VIDYALAYA,ANISH AHMAD IC,Senior Secondary,31/03/2014,"BHADARWAH, DISTT DODA, J&K ,182221","1997 ,245187",kvbhadarwah@gmail.com,
500008 ,KENDRIYA VIDYALAYA,MR S P SHARMA,Secondary School,31/03/2000,"HMT PINJORE PANCHKULA DISTT HARYANA ,134101",",29336",littleangels_tohana@rediffmail.com,
500025 ,KENDRIYA VIDYALAYA,K C SHARMA,Secondary School,31/03/2008,"AFS MOHD PUR AHIR GURGAON HARYANA ,122105",",29336",littleangels_tohana@rediffmail.com,
700031 ,KENDRIYA VIDYALAYA,NITIN DEV,Senior Secondary,31/03/2022,"HIRA NAGAR RAWI TAWI COMPLEX HIRA NAGAR DISTT KATHUA J&K ,184142","1922 ,2275192",principalkvhgr@gmail.com,
700030 ,KENDRIYA VIDYALAYA,BALA RAM PARMAR,Senior Secondary,31/03/2022,"CHENANI AT KUD DISTT UDHAMPUR J&K ,182141","1992 ,210289",kvchenani@gmail.com,
1600013,KENDRIYA VIDYALAYA,HARJINDER KAUR,Senior Secondary,31/03/2021,"FARIDKOT CANTT PUNJAB ,151203","1639 ,251226",hkdevgan@rediffmail.com,
1600027,KENDRIYA VIDYALAYA,SURENDRA KUMAR LOTH,Senior Secondary,31/03/2022,"MULLANPUR GARIBDAS DISTT SAS NAGAR (MOHALI) PUNJAB ,140901","0160 ,2255918",sklothchd@gmail.com,
1600041,KENDRIYA VIDYALAYA,SUDHA GUPTA,Senior Secondary,31/03/2024,"CRPF, SARAI KHAS, JALANDHAR, PUNJAB ,144801","0181 ,2780090",GUPTA.SUDHA.PGT@GMAIL.COM,
700008 ,KENDRIYA VIDYALAYA,V SANTHOSH KUMAR,Senior Secondary,31/03/2022,"BANTALAB C R P F CAMPUS JAMMU JAMMU & KASHMIR ,181123","0191 ,2592007",vsanphy@gmail.com,http://www.kvbantalab.org
3700003,KENDRIYA VIDYALAYA,Sunil Kumar,Secondary School,31/03/2011,"NUBRA (DISKIT) DISTT LEH(LADAKH) ,194401","1980 ,220331",sunil.96123@gmail.com,
700021 ,KENDRIYA VIDYALAYA,RAM KUMAR DHANAK,Secondary School,31/03/2020,"AFS, AWANTIPUR, C/O 56 APO, DISTT PULWAMA, J&K ,192122","1933 ,286909",ramkdhanak@gmail.com,
700036 ,KENDRIYA VIDYALAYA,DEEP KUMAR,Secondary School,31/03/2021,"AMINOO, KULGAM JAMMU & KASHMIR ,400088","1931 ,260104",kdeep0195@gmail.com,
700038 ,KENDRIYA VIDYALAYA,.,Secondary School,31/03/2021,"JOURIAN, JAMMU & KASHMIR-181 202 ,798601","0124 ,2015927",,
1600048,KENDRIYA VIDYALAYA,Amrik Singh Sandhu,Secondary School,31/03/2021,"BSF CAMPUS, BHILHIWIND, DISTT. TARN TARAN, PUNJAB ,143303","1851 ,272088",amriksinghkvs@gmail.com,
1600044,KENDRIYA VIDYALAYA,Vikas Gupta,Secondary School,31/03/2021,"UBHAWAL, DISTT. SANGRUR, PUNJAB ,148001","0167 ,2264005",vgrgvansh@gmail.com,
1600047,KENDRIYA VIDYALAYA,Sushila Rani,Secondary School,31/03/2022,"K.M.S. WALA, B.S.F., FEROZEPUR, PUNJAB ,152003","0163 ,2275044",kvkmswala@gmail.com,
1600042,KENDRIYA VIDYALAYA,SANJAY,Senior Secondary,31/03/2024,"S.L.I.E.T. LONGOWAL, DISTT. SANGRUR, PUNJAB ,148106","1672 ,280050",kvslietlongowal@gmail.com,
1600043,KENDRIYA VIDYALAYA,PARAMJEET KAUR,Senior Secondary,31/03/2023,"NEAR BABA MOTI RAM MEHRA COMMEMRATIVE GATE, REONA UCHA, PO TALANIA, FATEHGARH SAHIB, PUNJAB ,140406","1763 ,232020",kaurparamjeet63@gmail.com,
1600045,KENDRIYA VIDYALAYA,RAKESH KUMAR,Secondary School,31/03/2022,"BSF CAMPUS, AMARKOT, TEH. PATTI, DISTT. TARN TARAN, PUNJAB ,143419","1851 ,233462",KVAMARKOT@GMAIL.COM,
1600049,KENDRIYA VIDYALAYA,KRISHAN KUMAR,Secondary School,31/03/2022,"B.S.F. RAMPURA, FAZILKA, DISTT. FAZILKA, PUNJAB ,152123","1638 ,210239",kkumar009@gmail.com,
1600046,KENDRIYA VIDYALAYA,ASHOK KUMAR MAURYA,Senior Secondary,31/03/2022,"SECTOR-80, SAS NAGAR MOHALI, PUNJAB- 140 308. ,160059","0172 ,2274889",NANUASHOK@YAHOO.CO.IN,
1600050,KENDRIYA VIDYALAYA,Jasvir Singh,Senior Secondary,31/03/2022,"GAJJ BLOCK BHUNGA, DISTT- HOSHIARPUR, PUNJAB ,144210","1886 ,292631",gldhrs@gmail.com,
700033 ,KENDRIYA VIDYALAYA,SH AMIT RAIZADA,Secondary School,31/03/2010,"GULMARG, (AT TANGMARG), DISTT. BARAMULLA, J & K ,193402","01954 ,211687",saitours@satyam.net.in,
700007 ,KENDRIYA VIDYALAYA,KARRA NANI PRASAD,Senior Secondary,31/03/2021,"SAMBA JAMMU & KASHMIR ,184121","1923 ,243380",knaniprasad@gmail.com,
2600001,KENDRIYA VIDYALAYA,AMITA SHARMA,Senior Secondary,31/03/2027,"SECTOR-47 CHANDIGARH ,160031","0172 ,2633404",amitasharma28@ymail.com,
700016 ,KENDRIYA VIDYALAYA,AGIMON A CHELLAMCOTT,Senior Secondary,31/03/2022,"MIRAN SAHIB JAMMU DISTT, JAMMU & KASHMIR ,181101","1923 ,263260",agimonalex@yahoo.co.in,
1600025,KENDRIYA VIDYALAYA,Kulwinder Singh Gherra,Senior Secondary,31/03/2025,"NANGAL BHUR DISTT PATHANKOT, PUNJAB ,145101","0186 ,2268098",kvnangalbhur@gmail.com,http://www.kvvidyanagar.o
1600028,KENDRIYA VIDYALAYA,SURINDER KUMAR YADAV,Senior Secondary,31/03/2023,"MILITARY STATION, FAZILKA ROAD ABOHAR PUNJAB ,152116","1634 ,220123",syadav133@yahoo.com,http://www.kvnehu.g
1600030,KENDRIYA VIDYALAYA,VISHAL GUPTA,Senior Secondary,31/03/2010,"NABHA CANTT DISTT PATIALA PUNJAB ,147201","1765 ,220226",PRINCIPALNABHA2016@GMAIL.COM,
1600032,KENDRIYA VIDYALAYA,RAKESH KUMAR,Senior Secondary,31/03/2020,"KAPURTHALA CANTT PUNJAB ,144601","1822 ,279018",closetorakesh@gmail.com,
1600035,KENDRIYA VIDYALAYA,S K BHATIA,Senior Secondary,31/03/2023,"AMMUNITION DEPOT DAPPAR DISTT MOHALI PUNJAB ,140506","1762 ,248831",dapparkv@yahoo.co.in,http://www.kvnehu.g
1600037,KENDRIYA VIDYALAYA,KARAMBIR SINGH,Senior Secondary,31/03/2022,"DERA BABA NANAK SHIKAR DISTT GURDASPUR PUNJAB ,143604","1871 ,267650",kgill9907@gmail.com,
1600039,KENDRIYA VIDYALAYA,Charanjit Kumar Mittal,Senior Secondary,31/03/2022,"BSF FALIYN WALA MUKTSAR ROAD JALALABAD (W) DISTT FEROZPUR PUNJAB ,152024","1638 ,252869",kvbsfjbd@yahoo.co.in,http://www.kv2kota.g
1600008,KENDRIYA VIDYALAYA,KAMLESH MITTAL,Senior Secondary,31/03/2014,"AIR FORCE STATION BARNALA SANGRUR DISTT PUNJAB ,148101","1679 ,222617",kvbnl2013@gmail.com,
1600011,KENDRIYA VIDYALAYA,AMARJEET,Senior Secondary,31/03/2023,"TIBRI GURDASPUR CANTT PUNJAB ,143530","0187 ,258785",kvtibri@gmail.com,
1600014,KENDRIYA VIDYALAYA,MEENAKSHI JAIN,Senior Secondary,01/04/2022,"SURANUSSI JALANDHAR PUNJAB ,144027","0181 ,2670800",kvsura_jal@yahoo.com,
1600019,KENDRIYA VIDYALAYA,MANINDER KAUR,Senior Secondary,31/03/2023,"BADDOWAL CANTT LUDHIANA DISTT PUNJAB ,142021","0161 ,2805551",mkwalia59@gmail.com,http://www.kvvidyanagar.o
700006 ,KENDRIYA VIDYALAYA,B R KISHOR,Senior Secondary,31/03/2026,"SALAL H E PROJECT JYOTIPURAM UDHAMPUR DISTT JAMMU & KASHMIR ,182312","1991 ,01991255690",principalkvjyt@gmail.com,
700035 ,KENDRIYA VIDYALAYA,S PANDEY,Senior Secondary,31/03/2022,"B.S.F. CAMPUS, SUNDERBANI, DISTT RAJOURI, J & K ,185153","1960 ,233268",spandey2001@gmail.com,
2600003,KENDRIYA VIDYALAYA,SHAM CHAWLA,Senior Secondary,31/03/2023,"AIR FORCE STATION HIGH GROUND CHANDIGARH ,160003","0176 ,288044",shamchawla2003@yahoo.co.in,http://kvsecljamuna.com
700015 ,KENDRIYA VIDYALAYA,KEWAL SINGH,Senior Secondary,31/03/2022,"DUL-HASTI PROJECT KISHTWAR JAMMU DISTT., JAMMU & KASHMIR ,182204","1995 ,259846",kwlsng57@gmail.com,www.kvkishtwar.com
2600002,KENDRIYA VIDYALAYA, DR SANDHYA SHARMA,Senior Secondary,31/03/2025,"SECT-31 CHANDIGARH ,160030","0172 ,2638953",sandhyasharma.kvs@gmail.com,
700013 ,KENDRIYA VIDYALAYA,K K KHERRA,Secondary School,31/03/2021,"BORDER SECURITY FORCE BANDIPUR BARAMULLA DISTT JAMMU & KASHMIR ,193502","1957 ,225540",bandipurkv@gmail.com,
700012 ,KENDRIYA VIDYALAYA,AJIT SINGH MEENA,Senior Secondary,31/03/2017,"B S F CAMPUS RAJOURI JAMMU & KASHMIR ,185131","1962 ,263228",KVRajouri09@gmail.com,www.kvrajouri.in
700011 ,KENDRIYA VIDYALAYA,D R PATEL,Senior Secondary,31/01/2013,"LAKHANPUR DISTT KATHUA JAMMU & KASHMIR ,184152","1922 ,285123",kvlakhanpur@yahoo.co.in,
3700001,KENDRIYA VIDYALAYA,PHUNTSOG WANGIAL,Senior Secondary,31/03/2022,"LEH (LADAKH) ,194101","1982 ,264698",phuwan4u@gmail.com,
700027 ,KENDRIYA VIDYALAYA,SHYAM LAL YADAV,Secondary School,31/03/2021,"BRAKPARA ANANTNAG JAMMU & KASHMIR ,192101","0193 ,214489",kv_ang@rediffmail.com,
700025 ,KENDRIYA VIDYALAYA,SARDAR SINGH TAKKAR,Senior Secondary,31/03/2022,"NHPC GINGAL (URI) PO MOHRA BARAMULLA JAMMU & KASHMIR ,193122","1956 ,253224",sstakkar1957@gmail.com,
3700002,KENDRIYA VIDYALAYA,K S PATHANIA,Senior Secondary,31/03/2022,"LEH (LADAKH) ,194103","1985 ,257048",kspathania76@gmail.com,
2600006,KENDRIYA VIDYALAYA,SMT S K BHATIA,Senior Secondary,31/03/2021,"'K' AREA ZIRAKPUR VIA AERODROME CHANDIGARH ,160003","01762 ,270844",kram_kvs@hotmail.com,http://www.kv1chakeri.org
2600005,KENDRIYA VIDYALAYA,JUGAL KISHORE,Senior Secondary,31/03/2023,"O C F SECTOR 29-B CHANDIGARH ,160020","0172 ,2658645",KISHOREJJ67@GMAIL.COM,
700010 ,KENDRIYA VIDYALAYA,ANUJ KUMAR,Senior Secondary,31/03/2023,"NAGROTA, DISTT JAMMU, JAMMU & KASHMIR ,181221","0191 ,2673837",anuj8709@gmail.com,
700039 ,KENDRIYA VIDYALAYA CENTRAL UNIVERSITY OF JAMMU RAHYA SUCHANI,MR. LEELA DHARI,Senior Secondary,31/03/2024,"KENDRIYA VIDYALAYA CENTRAL UNIVERSITY OF JAMMU RAHYA SUCHANI DISTT. SAMBA PINCODE-181143 ,181143",",01923249500",kendriyavidyalayacuj@gmail.com,https://curahyasuchani.kvs.ac.in
700026 ,KENDRIYA VIDYALAYA KATHUA,MR. GURNAM SINGH,Senior Secondary,31/03/2021,"JANGLOTE ROAD,NEAR ARMY CANTT AREA, KATHUA ,184104","1922 ,9592646221",kvkathua2003@gmail.com,kvkathua.edu.in
700024 ,KENDRIYA VIDYALAYA NO - 3,KANWAR SINGH,Senior Secondary,31/03/2022,"BSF CAMPUS PANTHA CHOWK P O SRINAGAR JAMMU & KASHMIR ,191101","0193 ,223329",singhkanwar1976@gmail.com,http://www.kvsvdelhi.com
1600004,KENDRIYA VIDYALAYA NO 1,SOM DUTT,Senior Secondary,31/03/2024,"HARDYAL ROAD OPP G E EAST JALANDHAR CANTT PUNJAB ,144005","0181 ,2262233",somduttprl@gmail.com,
1600003,KENDRIYA VIDYALAYA NO 1,ANJANA RAMPAL,Senior Secondary,31/03/2022,"AIR FORCE STATION HALWARA PUNJAB ,141106","1624 ,275095",kvno1halwara@yahoo.co.in,http://kvsrikakulam.ap.ni
1600002,KENDRIYA VIDYALAYA NO 1,HARI SINGH,Senior Secondary,31/03/2012,"FEROZEPUR CANTT PUNJAB ,152001","1632 ,242078",princilok@yahoo.co.in,
1600001,KENDRIYA VIDYALAYA NO 1,PARAMJIT,Senior Secondary,31/03/2020,"AIR FORCE STATION ADAMPUR DOABA JALANDHAR PUNJAB ,144103","0181 ,2751095",paramjit.delar26@gmail.com,
1600006,KENDRIYA VIDYALAYA NO 1,ASHOK KUMAR,Senior Secondary,31/03/2023,"AIR FORCE PATHANKOT PUNJAB ,145001","0186 ,2340579",KV1PATHANKOT@GMAIL.COM,
700005 ,KENDRIYA VIDYALAYA NO 1,RAJESH PANDEY,Senior Secondary,31/03/2022,"NEAR CHINAR CINEMA P.O GARHI UDHAMPUR JAMMU & KASHMIR ,182121","1992 ,242079",pandeyrajesh5130@gmail.com,http://www.kv1udhampur.
1600012,KENDRIYA VIDYALAYA NO 1,SUSHILA SEHRAWAT,Senior Secondary,31/03/2023,"THIMAYYA MARG BHATINDA CANTT PUNJAB ,151004","0164 ,2290788",sushilasehrawat8@gmail.com,http://www.kvnhpclok.org
700003 ,KENDRIYA VIDYALAYA NO 1,SHAMSUD DUHA,Senior Secondary,31/03/2022,"BADAMI BAGH CANTT SRINAGAR JAMMU & KASHMIR ,190004","0194 ,2465093",ssduha@gmail.com,
700001 ,KENDRIYA VIDYALAYA NO 1,TILAK RAJ CHOUDHARY ,Senior Secondary,31/03/2025,"NEAR GOAL MARKET, GANDHI NAGAR JAMMU JAMMU & KASHMIR ,180004","0191 ,2430137",trc.agt@rediffmail.com,
700009 ,KENDRIYA VIDYALAYA NO 1,SURJEET SINGH,Senior Secondary,31/03/2024,"AKHNOOR, DISTT JAMMU, JAMMU & KASHMIR ,181201","1924 ,253250",SSINGH120@GMAIL.COM,
1600009,KENDRIYA VIDYALAYA NO 1,KUSAM MALHOTRA,Senior Secondary,31/03/2024,"AMRITSAR CANTT PUNJAB ,143001","183 ,2560677",kusammalhotra@yahoo.com,
700004 ,KENDRIYA VIDYALAYA NO 2,PRADEEP KUMAR,Senior Secondary,31/03/2022,"AIR FORCE STATION NEW AIR PT SRINAGAR JAMMU & KASHMIR ,190007","0194 ,2303617",principalkvno2sgr@gmail.com,
700019 ,KENDRIYA VIDYALAYA NO 2,DIDAR SINGH,Senior Secondary,31/03/2025,"AKHNOOR JAMMU & KASHMIR ,181201","1924 ,252052",principalkv2akhnoor@gmail.com,
2600004,KENDRIYA VIDYALAYA NO 2,SANJAY KUMAR MISRA,Senior Secondary,31/03/2023,"3 B R D A F S CHANDIGARH ,160003","0172 ,2655097",misra.sanjay64@gmail.com,http://kvsecljamuna.com
1600023,KENDRIYA VIDYALAYA NO 2,DR LALIT KISHORE,Senior Secondary,31/03/2007,"N F L TOWNSHIP BHATINDA PUNJAB ,151003",",",hkv@nflkht.chd.nic.in,
1600022,KENDRIYA VIDYALAYA NO 2,KUMUD OMVEER SINGH,Senior Secondary,31/03/2011,"D M W PATIALA PUNJAB ,147001","0175 ,2226004",kmd.veer@gmail.com,
1600017,KENDRIYA VIDYALAYA NO 2,H K NIRMAL,Senior Secondary,31/03/2022,"AIR FORCE STATION HALWARA PUNJAB ,141106","1624 ,275360",hknirmal59@rediffmail.com,
1600016,KENDRIYA VIDYALAYA NO 2,MANOJ KUMAR,Senior Secondary,31/03/2009,"AIR FORCE STATION ADAMPUR JALANDHAR PUNJAB ,144103","0181 ,2750732",mks242@rediffmail.com,
1600007,KENDRIYA VIDYALAYA NO 2,PL DHIMAN,Senior Secondary,31/03/2020,"ARMY AREA PATHANKOT PUNJAB ,145001","0186 ,2222898",kv2pathankot_armyarea@rediffmail.com,
1600005,KENDRIYA VIDYALAYA NO 2,JAMNA DASS GURU,Senior Secondary,31/03/2022,"OPP DEFENCE CINEMA JALANDHAR CANTT PUNJAB ,144005","0181 ,2262141",jamnadassguru@gmail.com,http://kvsrikakulam.ap.ni
700002 ,KENDRIYA VIDYALAYA NO 2,BHUSHAN KUMAR,Senior Secondary,31/03/2011,"JAMMU CANTT JAMMU & KASHMIR ,180003","0191 ,2432436",principalkv2jammucantt@gmail.com,
1600031,KENDRIYA VIDYALAYA NO 2,HARJEET KAUR,Senior Secondary,31/03/2023,"FEROZEPUR CANTT PUNJAB ,152001","0163 ,246123",kv2fzrcantt@gmail.com,
1600018,KENDRIYA VIDYALAYA NO 3,B S GHAROO,Senior Secondary,31/03/2018,"AIR FORCE STATION BHAISIANA BHATINDA PUNJAB ,151201","0164 ,2449215",KV3BATHINDA@GMAIL.COM,KV3BATHINDA.COM
1600015,KENDRIYA VIDYALAYA NO 3,G S SETHI,Senior Secondary,31/03/2025,"P O MAMOON PATHANKOT PUNJAB ,145001","0186 ,2347344",gssethiprincipal@yahoo.com,http://www.kvvidyanagar.o
1600029,KENDRIYA VIDYALAYA NO 3,Rashmi Shukla,Senior Secondary,31/03/2025,"NEW CANTT P.O. NARAYANGARH AMRITSAR PUNJAB ,143106","0183 ,2476789",kv3asr@rediffmail.com,http://www.kvnehu.g
1600036,KENDRIYA VIDYALAYA NO 3,SANJEET KUMAR SAGAR,Senior Secondary,31/03/2024,"TARAPORE ENCLAVE PATIALA CANTT PUNJAB ,147001","0175 ,2218903",SKSAGAR077@GMAIL.COM,
1600024,KENDRIYA VIDYALAYA NO 4,TARA BHANDARI,Senior Secondary,31/03/2021,"CHOUDHARY MARG BHATINDA CANTT PUNJAB ,151004","0164 ,2290106",t.bhandari16@gmail.com,http://www.kvvidyanagar.o
1600026,KENDRIYA VIDYALAYA NO 4,SULAKSHANA DOGRA,Senior Secondary,31/03/2023,"MAMUN CANTT P O BANGAL BADHAM PATHANKOT PUNJAB ,145001","0186 ,2349591",sulakshanadogra@yahoo.com,
1600034,KENDRIYA VIDYALAYA NO 5,MOHINDER SINGH,Senior Secondary,31/03/2029,"BHATINDA CANTT PUNJAB ,151004","0164 ,2291142",mohinderchauhan2015@gmail.com,http://www.kvvidyanagar.o
1600010,KENDRIYA VIDYALAYA NO-1,OMBIR SINGH,Senior Secondary,31/03/2021,"O R S COLONY SANGRUR ROAD PATIALA CANTT PUNJAB ,147001","0175 ,2218907",ombirsingh2001@gmail.com,
1600038,KENDRIYA VIDYALAYA NO-4,R K LOMRA,Senior Secondary,31/03/2026,"HARDAYAL ROAD, JALANDHAR CANTT, PUNJAB ,144005","0181 ,2265750",kv4jal@gmail.com,http://www.kvnhpclok.g
1600021,KENDRIYA VIDYALAYA NO. 3,SARJANA SANGHA,Senior Secondary,31/03/2022,"JALANDHAR CANTT PUNJAB ,144005","0181 ,2661533",sarjana.sangha@gmail.com,http://www.kvrwfyel.g
700017 ,KENDRIYA VIDYALAYA NO.2,Amit Walter,Senior Secondary,31/03/2021,"DHAR ROAD P.O.ROAN UDHAMPUR JAMMU & KASHMIR ,182126","1992 ,244441",principal_kv2udh@yahoo.co.in,http://kvno2udh.com/
1600040,KENDRIYA VIDYALAYA NO.2,HARJEET KAUR,Secondary School,31/03/2020,"RCF, HUSSAINPUR, KAPURTHALA, PUNJAB-144602 ,144602","1822 ,227303",pharjeet19@gmail.com,
700037 ,"KENDRIYA VIDYALAYA, BSF HUMHAMA",NARESH KANT,Secondary School,31/03/2022,"BSF HUMHAMA,SRINAGAR, JAMMU & KASHMIR-190007 ,123302","0194 ,2303100",kvbsfhumhama@gmail.com,
700018 ,KENDRIYA VIDYALYA,KRISHAN SINGH CHAUHAN,Senior Secondary,31/03/2022,"BARAMULLA JAMMU & KASHMIR C/O STN COMMAND 19 ARTY C/O 56 APO ,193101","1952 ,235893",ksc678@gmail.com,www.kvkishtwar.com
1600033,KENDRIYA VIDYALYA,UMMED SINGH,Senior Secondary,31/03/2025,"R C F HUSSAIN PUR (KPT) KAPURTHALA PUNJAB ,144602","0182 ,2228461",ummeds@gmail.com,http://www.kvvidyanagar.o
1630869,KESHAV PUBLIC SENIOR SECONDARY SCHOOL,SHALLU ARORA,Senior Secondary,31/03/2022,"JANAL ROAD, DIRBA, SUNAM, ,148035","1676 ,244292",kpsdirba@gmail.com,
1630658,KHALSA COLLEGE INTERNATIONAL PUBLIC SCHOOL,D K SANDHU ,Senior Secondary,31/03/2026,"OPP M.K HOTEL, C BLOCK, RANJIT AVENUE. ,143001","0183 ,5030781",devindersandhu114@ymail.com,
1630104,KHALSA COLLEGE PUBLIC SCHOOL,Sarvjit Brar,Senior Secondary,31/03/2023,"G T ROAD AMTITSAR PUNJAB ,143001","0183 ,5030774",bsarvjit@gmail.com,
1630881,KHALSA COLLEGE PUBLIC SCHOOL,Gurinderjeet Kamboj,Secondary School,31/03/2022,"VILLAGE & PO HEIR, AMRITSAR, ,143101","91 ,9878003809",kambojgurinderjeet@gmail.com,
1631079,KHALSA PUBLIC SENIOR SECONDARY SCHOOL,MR. BALRAJ KUMAR,Senior Secondary,31/03/2025,"VPO KAPIAL, DISTT. SANGRUR (PUNJAB) ,148024","0 ,09256899595",krishan_bsm@yahoo.com,http://www.kpskapial.in
