Affiliation Number,Name,Head/Principal Name,Status,Affiliated unto,Address,Phone no.,Email,Website
1630127,DESRAJ VADHERA DAV CENTENARY PUBLIC SCHOOL,YOGESH GAMBHIR,Senior Secondary,31/03/2023,"PHILLAUR DISTT. JALANDHAR PUNJAB ,144410","1826 ,222498",gambhiry@yahoo.in,http://www.drvdavphillaur
730078 ,"DEWAN BADRINATH VIDYA MANDIR, AMARVILLA",PRAVEENA JHA,Senior Secondary,31/03/2024,"155, GARDEN AVENUE TALAB TILLO P.O.: VINYAK BAZAR ,180016","0191 ,2554200",principal.av@dbntrust.in,http://www.dbntrust.com
1630146,DHILWAN INTERNATIONAL PUBLIC SCHOOL,Shanti Kumar Sharma,Senior Secondary,31/03/2022,"DHILWAN KAPURTHALA DISTT PUNJAB ,144804","0182 ,273082",shantisharma6442@gmail.com,
1630698,DIFFERENT CONVENT SCHOOL,MUNISH BATHLA,Senior Secondary,31/03/2022,"VILL. GHUDA, BADAL ROAD, NEAR FOCAL POINT, GHUDA ,151001","0164 ,2425857",dcsbtd@gmail.com,
1631234,DIKSHANT GLOBAL SCHOOL,MR. MITUL DIKSHIT,Secondary School,31/03/2026,"DIKSHANT GLOBAL SCHOOL, SAVITRY GREENS, VIP ROAD, ZIRAKPUR ,140603",",8427664878",dikshantglobal@gmail.com,http://www.dikshant.org
1630358,DIKSHANT INTERNATIONAL SCHOOL,RAJNI CHANDAN,Senior Secondary,31/03/2026,"ZIRAKPUR PANCHKULA HIGHWAY N H 22 ZIRAKPUR, DISTT MOHALI, PUNJAB ,144804","91 ,9257214796",dr.rajnichandan@gmail.com,
1630865,DIPS SCHOOL,Neelu Bawa,Senior Secondary,31/03/2025,"FATTUWAL,GT ROAD, BABA BAKALA, ,143111","9876 ,179861",neelubawa@hotmail.com,http://www.dipsedu.com
1630747,DIPS SCHOOL,RADHA GAKHAR,Senior Secondary,31/03/2023,"JALANDHAR ROAD, NEAR URBAN ESTATE, ,144601","9915 ,590262",dipskaputhala@gmail.com,http://www.dipsedu.com
1630706,DIPS SCHOOL,REKHA NAYYAR,Senior Secondary,31/03/2023,"VPO GILZIAN, NEAR MIANI, DASUYA, ,144202","9779 ,072008",gilziandips@gmail.com,http://www.dipsedu.com
1630717,DIPS SCHOOL,Bela Kapoor,Senior Secondary,31/03/2018,"MAQSUDAN, NEAR SURANUSSI ,144027","9915 ,034262",dipssuranussi@gmail.com,http://www.dipsedu.com
1631004,DIPS SCHOOL,MRS. VANITA CHADHA,Senior Secondary,31/03/2022,"MODEL TOWN VPO UGGI ,144623","8288 ,9876173731",gm.dipsho@gmail.com,http://www.dipsuggi.com
1630289,DIPS SCHOOL,Usha Parmar,Senior Secondary,31/03/2025,"NURMAHAL DISTT JALANDHAR PUNJAB ,144039","0182 ,242782",upushaparmar@gmail.com,
1631165,DIPS SCHOOL,MR. RAJINDER NAYYAR,Senior Secondary,31/03/2023,"VILLAGE RAJPUR, ,143203","7087 ,9876173731",gm.dipsho@gmail.com,http://www.dipsbutala.com
1630502,DIPS SCHOOL,MRS. DEEPAK RANA,Senior Secondary,31/03/2024,"NADALI ROAD, BEGOWAL, DISTT KAPURTHALA, PUNJAB ,144621","9876 ,9876173731",gm.dipsho@gmail.com,http://dipsbegowal.com
1630500,DIPS SCHOOL,SARVESH BALA,Senior Secondary,31/03/2024,"NEAR LODHEWALI, P.O. CHOGATTI, JALLANDHAR, PUNJAB ,144004","0181 ,2410156",dipskarolbagh@gmail.com,
1630760,DIPS SCHOOL,MR. PANKAJ CHOPRA,Senior Secondary,31/03/2024,"JALANDHAR ROAD, CHOWK MEHTA, AMRITSAR ,143114","9915 ,9876173731",gm.dipsho@gmail.com,http://www.dipsmehtachowk.com
1630997,DIPS SCHOOL,MRS. MONICA SACHDEVA,Senior Secondary,31/03/2022,"VILLAGE ADAMWAL, DASUYA ROAD, ,144208","9915 ,9876173731",gm.dipsho@gmail.com,http://www.dipshariana.com
1630513,"DIPS SCHOOL,",MRS. DIVYA CHAWLA,Senior Secondary,31/03/2025,"DARAPUR BYEPASS TANDA HOSHIARPUR, PUNJAB ,144204","9878 ,9876173731",gm.dipsho@gmail.com,http://www.dipstanda.com
1630622,DISCIPLINED DISCIPLES INTERNATIONAL SCHOOL,Gurpal Tuli,Senior Secondary,31/03/2022,"FATEHGARH CHURIAN, GURDASPUR, PUNJAB ,143602","9878 ,432939",gtuliddis@yahoo.co.in,http://www.ddis.com
1630660,"DISCIPLINED DISCIPLIES INTERNATIONAL SCHOOL,",Shabnam Sharma,Senior Secondary,31/03/2026,"F.C.ROAD, NANGALI,AMRITSAR ,143001","0183 ,9257272068",ddisprincipal@yahoo.co.in,http://www.ddis.co.in
1630285,DIVINE LIGHT INTERNATIONAL SCHOOL,DR. SAROJ CHAUHAN,Senior Secondary,31/03/2025,"SHAMSHER NAGER SIRHIND DISTT FATEHGARH SAHIB PUNJAB ,140406","1763 ,01763221497",divinelightinternational2002@gmail.com,divinelightinternationalschool.com
1630667,DIVINE MATA GUJRI PUBLIC SCHOOL,MR. LAKHWINDER SINGH,Senior Secondary,31/03/2024,"SADIQ, AT MANI SINGH WALA, DISTT. FARIDKOT ,151203","1639 ,01639-221999,",divinemgpschool@gmail.com,http://www.divinematagujri.com
1630666,DIVINE PUBLIC SCHOOL,SONU BALA,Senior Secondary,31/03/2026,"VILL. MALEWAL DISTT. GURDASPUR TEH. DERA BABA NANAK ,143604","91 ,8872796665",dpsmalewal@gmail.com,
1630501,DIVINE PUBLIC SCHOOL,MRS. RENU THAKUR,Senior Secondary,31/03/2024,"G.T. ROAD, CHCACHOKI, KAPTHALLA, PHAGWARA, PUNJAB ,144632","1824 ,01824220528",amarrooprai43@yahoo.com,http://www.divinepublicschoolphagwara.net
1630834,DIVINE WILL PUBLIC SCHOOL,RATTAN MALA,Secondary School,31/03/2026,"VILL. SAID MUBARAK, P.O BATALA, GURDASPUR ,143505","91 ,1871245501",RATTANAGILL@GMAIL.COM,
2630062,DIVYA PUBLIC SCHOOL,RAJESH KAMAL,Secondary School,31/03/2022,"SECTOR - 44 D, CHANDIGARH ,160047","0172 ,2620808",rajesh1267@yahoo.com,
1631291,"DIYA INTERNATIONAL SCHOOL, MANDI GOBINDGARH",MRS. PARVEEN BOBBY,Secondary School,31/03/2023,"SECTOR 9 RAM NAGAR NEAR GRAIN MARKET ,147301",",01765254037",diyainternationalschool80@gmail.com,WWW.DIYASCHOOL.IN
1630270,DOABA PUBLIC SCHOOL,BRINDER KAUR,Senior Secondary,31/03/2023,"KOT SANTOKH RAI DISTT GURDASPUR PUNJAB ,143519","1874 ,289462",brinder2001@gmail.com,
1630416,DOABA PUBLIC SCHOOL,MRS.SURINDER KAUR,Senior Secondary,31/03/2026,"VILL DOHLRON PO MAHILPUR HOSHIARPUR PUNJAB ,146105","1884 ,01884-245496",dps_dohlron@yahoo.co.in,http://www.dpsdohlron.com/
1630281,DOABA PUBLIC SR SEC SCHOOL,MR. GOBIND LUTHRA,Senior Secondary,31/03/2024,"PAROWAL TEH GARHSHANKAR DISTT HOSHIARPUR PUNJAB ,144527","1884 ,282205,",dps_parowal@yahoo.co.in,http://www.dpsparowal.com
1631073,DOLPHIN PUBLIC SCHOOL,Mrs.Avinash Rani,Secondary School,31/03/2024,"DOLPHIN PUBLIC SCHOOL, MUKTSAR ROAD ,151209",",01635210700",dolphinpublicschool@yahoo.in,
1630180,DON BOSCO SR. SEC. SCHOOL,MR. BINNY ISSAC,Senior Secondary,31/03/2025,"VILLAGE JHARMARI,AMBALA-CHANDIGARH HIGHWAY, VIA LALRU), TEHSIL DERA BASSI, DISTT. S.A.S NAGAR MOHALI, PUNJAB- 140 501. ,140501","0171 ,01712777544",dbsjharp@gmail.com,www.dbjharp.com
1630376,DOON INTERNATIONAL SCHOOL, Manjeet Madra,Senior Secondary,31/03/2026,"SECTOR 69 SAS NAGAR MOHALI PUNJAB ,160062","0172 ,2216700",principal@doointernational.net,
1631303,DOON INTERNATIONAL SCHOOL,MRS. APARANA KOHLI,Secondary School,31/03/2024,"VERKA BYPASS, AMRITSAR ,143001",",9797550999",info@doonamritsar.com,https://www.doonamritsar.com/
730082 ,DOON INTERNATIONAL SCHOOL,DR. M. RAMACHANDRAN,Senior Secondary,31/03/2022,"HOKARSAR HMT,SRINAGAR ,190012","0194 ,9103155601,",dooninternationalschoolsgr@gmail.com,http://www.doonsrinagar.com
730087 ,DOON INTERNATIONAL SCHOOL,Mrs.VIKESH KAUR,Senior Secondary,31/03/2022,"CHOWADHI ,180011","080 ,01912104050, 2104051",info@disjammu.com,http://www.disjammu.com
1631109,DOON OXFORD SCHOOL,SUNIL ARORA,Secondary School,31/03/2025,"DOON OXFORD SCHOOL VILL, THAKKARWAL PAKHOWAL ROAD, LUDHIANA. ,142022","0161 ,8194886999",doonoxfordschool@gmail.com,
1631357,DOON PUBLIC SCHOOL,MR. Y S RAVI KUMAR,Secondary School,31/03/2024,"VILL. SANDHWAL, P.O. HAJIPUR ,144221",",01883272140",doonpublicschoolmukerian@gmail.com,
1630486,DOON PUBLIC SCHOOL,NIRDOSH RALHAN,Senior Secondary,31/03/2023,"NATHANA-BHAGTA MAIN ROAD, V.PO. KALYAN SUKHA, THESIL & DISTT. BATHINDA, PUNJAB ,151001","0164 ,2750111",nirdoshralhan9@gmail.com,
1630396,DOON PUBLIC SCHOOL,PARMINDER KAUR,Senior Secondary,31/03/2023,"KARARWALA VIA RAMPURA PHUL DISTT BATHINDA PUNJAB ,151103","9257 ,224333",kaur.pinder186@gmail.com,
1630337,DOON VALLEY CAMBRIDGE SCHOOL,Usha,Senior Secondary,31/03/2022,"FEROZEPUR ROAD ZIRA DISTT FEROZEPUR PUNJAB ,142047","1682 ,254706",doonvalley60@gmail.com,
1630553,DORAHA PUBLIC SCHOOL,MRS. MONIKA SARWAL,Senior Secondary,31/03/2024,"DORAHA PUBLIC SCHOOL, DORAHA ,141421","1628 ,01628257701",dops_doraha@rediffmail.com,http://www.dops.in
1631227,DPS WORLD SCHOOL,MRS.JYOTI NAGRANEE,Secondary School,31/03/2026,"OLD AMBALA ROAD, SANAULI-DHAKOLI, ZIRAKPUR, PUNJAB ,140603",",01762-512900",principal@dpsworldzirakpur.com,http://www.dpsworldzirakpur.ac.in
1630070,DR DAULAT RAM BHALLA DAV CENTENARY PUBLIC SCHOOL,ANITA MEHRA,Senior Secondary,31/03/2025,"BATALA, DISTT GURDASPUR, PUNJAB ,143505","1871 ,241294",anitamehra41@gmail.com,
1630709,DR HOLMES ACADEMY,KAJAL,Senior Secondary,31/03/2022,"NH 15 , GONIANA BAJA KHANA ROAD , VILLAGE JEEDA ,151201","0164 ,2767654",kajal.bti@gmail.com,
1630075,DR MCM D A V PUBLIC SCHOOL,SONALI SHARMA,Senior Secondary,31/03/2023,"MISSION ROAD PATHANKOT PUNJAB ,145001","0186 ,2222764",mcmdav88@yahoo.com,
1630072,DR SAIF-UD-DIN KITCHLU MEMORIAL PUBLIC SCHOOL,MRS. HEM PRABHA SOOD,Senior Secondary,31/03/2025,"FCI ROAD OPP BHAG CINEMA MOGA PUNJAB ,142001","1636 ,01636237724",kps_mogacity@yahoo.com,www.drkitchlupublicschool.com
1630469,DR. DEV RAJ DAYANAND ANGLO VERNACULAR PUBLIC SCHOOL,NAVDEEP KUMAR,Senior Secondary,31/03/2024,"KHAI LEHRAGAGA, LEHRA SANGRUR, PUNJAB ,148031","1676 ,321324",davprincipal11@gmail.com,
1631236,DR. RAVINDER CONVENT SCHOOL,MRS. AMARJEET KAUR,Senior Secondary,31/03/2024,"MALLAH ROAD, BAJAKHANA, DISTRICT FARIDKOT, PUNJAB ,151205",",01635246188",drcs@malwa.org,WWW.DRRAVINDER.ORG
1631356,DR.B.S.SANDHU MEMORIAL PUBLIC SCHOOL,MRS. RAJINDER KAUR,Senior Secondary,31/03/2024,"GHARAM ROAD, JULAH KHERI, TEHSIL DUDHAN-SAADHAN, DISTT. PUNJAB-147111 ,147111",",8728000873",drbssmps46@yahoo.in,http://www.drbssandhumps.in
1630582,DRISHTI DR. R.C.JAIN INNOVATIVE PUBLIC SCHOOL,MRS. GAURI CHHABRA,Senior Secondary,31/03/2025,"PAKHOWAL ROAD,VPO NARANGWAL ,141203","0161 ,9216558503",info@drishtischool.com,www.drishtischool.com
1630967,DRS CONVENT SCHOOL,Santosh Kumar,Secondary School,31/03/2023,"V.P.O. KAONI GIDDARBAHA MUKTSAR ,152031","1633 ,270025",santoshkaoni@gmail.com,
1630421,EAST WOOD INTERNATIONAL SCHOOL,Rubal Sidhu,Senior Secondary,31/03/2022,"MALWA BYE PASS DOOMWALI BATHINDA PUNJAB ,147105","0164 ,242978",schooleastwood@gmail.com,www.eastwoodworld.com
1630422,EAST WOOD INTERNATIONAL SCHOOL,AMANDEEP KAUR BAKSHI,Senior Secondary,31/03/2022,"MULLANPUR RAIKAT ROAD LUDHIANA PUNJAB ,141101","0161 ,6450855",dr.amandeepbakshi@gmail.com,
1670018,EDUSTAR ADARSH SR SEC SCHOOL,Anu Sharma,Secondary School,31/03/2022,"BPO- KALEWAL, TEH-KHARAR, DIST- SAS NAGAR, MOHALI, PUNJAB ,","0160 ,2646466",principal.kalewal@edustaradarshschool.in,
1630468,EKAM PUBLIC SCHOOL,AMANDIP KAUR,Senior Secondary,31/03/2025,"VILLAGE & P.O. MEHATPUR(PARJIAN ROAD), DISTT JALANDHAR, PUNJAB ,144041","1821 ,251000",ekampschool@Yahoo.com,
1630446,EKLAVYA SCHOOL,DIMPAL SHARMA,Senior Secondary,31/03/2022,"VILL PARTAPPURA, P.O. LOHAR PARTAPPURA, NAKODAR ROAD, JALANDHAR ,144026","0181 ,2792298",dimpal1aryan@gmail.com,www.eklavyaschooljal.g
1630257,EMM AAR INTERNATIONAL SCHOOL,NAVDEEP VASHISTA,Senior Secondary,31/03/2024,"HOISHARPUR ROAD ADAMPUR DOABA DISTT JALANDHAR PUNJAB ,144102","0181 ,2753535",mr.physician@yahoo.com,
1631081,EVEREST PUBLIC SENIOR SECONDARY SCHOOL,MISS MONICA,Senior Secondary,31/03/2022,"MOTI NAGAR, LUDHIANA ,141010","0161 ,01612225237",everestludhiana@gmail.com,http://www.everestgroupofschools.com
1630478,EXCELSIOR CONVENT SCHOOL,URMIL AGGARWAL,Senior Secondary,31/03/2026,"VILLAGE:FAGGAN MAJRA,PO:CHAILLAILA, DISTT PATIALA, PUNJAB ,147001","1763 ,261330",principal@ecspatiala.com,
1631239,EXCELSIOR PUBLIC SCHOOL,MRS. MADHU GANDHI,Senior Secondary,31/03/2024,"V- DIWANIWAL, QADIAN ROAD, BATALA ,143505",",9714511722",excelsiorschool20@gmail.com,http://www.excelsiorpublicschool.org
1630907,EXCELSUM HIGH SCHOOL,Mrs.Gunita Grewal,Secondary School,31/03/2025,"LOHARKA ROAD , AMRITSAR ,143001",",0186832710303",gunita.grewal@excelsum.school,
1630570,FABLE PUBLIC SCHOOL,DHAWAN KUMAR,Senior Secondary,31/03/2025,"JAITU ROAD,DISTT FARIDKOT ,151204","1635 ,9803343376",dkparjapati@gmail.com,
1631201,FALCON INTERNATIONAL SCHOOL,Mr.RABINDER SINGH,Secondary School,31/03/2025,"FALCON INTERNATIONAL SCHOOL,SULTANPUR LODHI,(SAWAAL) ,144626",",01828222491",ajitkhmz2014@gmail.com,
1631013,"FEROZESHAH ANGLO SIKH WAR MEMORIAL PUBLIC SEN.SEC.SCHOOL,GHALL KHURD(FEROZEPUR)",Jaspreet Pal Singh,Senior Secondary,31/03/2024,"VILLAGE & P.O GHALL KHURD ,142052","1632 ,256024",fas1845@gmail.com,
1630876,FORTUNE CONVENT SENIOR SECONDARY SCHOOL,RAJVIR KAUR,Senior Secondary,31/03/2022,"VILLAGE AKOI SAHIB, DISTT. SANGRUR ,148001","1672 ,220245",fortune.sng@gmail.com,
1630364,G D R CONVENT SCHOOL,Shama Sharma,Senior Secondary,31/03/2026,"VILL BIR DHANDOLI PO RAWALPINDI HOSHIARPUR ROAD PHAGWARA, KAPURTHALA PUNJAB ,144407","1824 ,252191",principalgdr@gmail.com,
1630290,G H G ACADEMY,Poonam Sharma,Senior Secondary,31/03/2022,"KOTHE BAGGU G T ROAD JAGRAON PUNJAB ,142026","1624 ,229588",dipksh10@gmail.com,www.ghgit.com
1630186,G M A CITY PUBLIC SCHOOL,RAGHUVIR SINGH PANWAR,Senior Secondary,31/03/2025,"SINGRIWALA JALANDHAR ROAD HOSIARPUR PUNJAB ,146001","1882 ,264073",rspnwar@gmail.com,
1630353,G M T PUBLIC SCHOOL,RAVINDER KAUR,Senior Secondary,31/03/2024,"JALLANDHAR BY PASS CHOWK LUDHIANA PUNJAB ,141008","0161 ,2781794",RENNURAYAIT@GMAIL.COM,
730055 ,G. D. GOENKA PUBLIC SCHOOL,Mr. Arindam Roy Choudhury,Senior Secondary,31/03/2026,"OPP. NAGBANI PANCHAYAT GHAR, GAJANSOO, MARH ROAD JAMMU ,181206","0191 ,2642990,9469214182",principal@gdgoenkajammu.org,http://www.gdgoenkajammu.org
1630993,G.A.D ACADEMY,MRS. RAJNI ANGRISH,Senior Secondary,31/03/2024,"VILLAGE LADHIAN KHURD, POST OFFICE - BAGGA KHURD ,141008","0161 ,0160-2801710",gadacademy.ladhian@gmail.com,http://www.gadacademy.in
1630929,"G.C.M CONVENT SCHOOL,",PUNAM,Senior Secondary,31/03/2025,"DIRBA-PATRAN ROAD (NH71),NEAR V&PO- KHETLA & DIRBA ,148035","1676 ,243999",gcmconventprincipal@gmail.com,www.gcmconventschool.org
1631119,"G.D GOENKA INTERNATIONAL SCHOOL, JALANDHAR",MRS. RANJIT BHATIA,Senior Secondary,31/03/2022,"ELDECO GREENS, NAKODAR ROAD, JALANDHAR ,144026","0181 ,07837887244,",gdgoenkajalandhar@gmail.com,http://www.gdgoenkajalandhar.in
730090 ,G.D GOENKA PUBLIC SCHOOL SRINAGAR,MR. JOHNSON.P.J,Senior Secondary,31/03/2022,"UMER COLONY SADARBAL ,190006",",9070333490",principal@gdgoenkasrinagar.com,http://www.gdgoenkasrinagar.com
1631238,G.D. GOENKA PUBLIC SCHOOL,Dr.Daisy Sharma,Secondary School,31/03/2026,"144601 ,144601",",01822",principal@gdgoenkakapurthala.com,http://www.gdgoenkakapurthala.com
1630653,"G.D. GOENKA PUBLIC SCHOOL, AMRITSAR",AMANPREET KAUR KHAIRA,Senior Secondary,31/03/2022,"NH 1, OFF GT ROAD, MANAWALA (OPP BEST PRICE) ,143115","0183 ,2440011",Amanpreet@gdgoenkaamritsar.com,www.gdgoenkaamritsar.com
1630748,G.S. INTERNATIONAL PUBLIC SCHOOL,SONIA MAHAJAN,Senior Secondary,31/03/2023,"DERA BABA NANAK GURDASPUR, PUNJAB ,143605","1871 ,262136",sonia02mahajan@ymail.com,
1631042,G.S.PUBLIC SENIOR SECONDARY SCHOOL,Inderjit Singh,Senior Secondary,31/03/2024,"VILLAGE BILLASPUR PINDI, V.P.O. DHAULA, DISTT. BARNALA (PUNJAB)- 148107 ,148107","1679 ,260600",gsp_dhaula@yahoo.com,
1630785,G.T.B. PUBLIC SCHOOL,PARTAP SINGH,Senior Secondary,31/03/2026,"GURU HAR SAHAI MUKATSAR ROAD, NEW MODAL TOWN ,152022","1685 ,500726",GTBPUBLICSCHOOL@YAHOO.COM,
730088 ,GALAXY PUBLIC SCHOOL,MRS. JASPREET KAUR,Secondary School,31/03/2024,"SEC: E (EXTN.), SAINIK COLONY, JAMMU ,180011","040 ,01912468452",binoda@yahoo.com,www.galaxyschooljammu.com
1630499,GANGA INTERNATIONAL SCHOOL,DHARMENDRA SRIVASTAV,Senior Secondary,31/03/2024,"NEAR KHANORI MANDI PATIALA PUNJAB ,144601","1764 ,285048",giskhanori@gmail.com,
1630463,GARDEN VALLEY INTERNATIONAL SCHOOL,HARPREET KAUR,Senior Secondary,31/03/2023,"VILLAGE BHATTIAN, P.O. MACHHIWARA, LUDHINANA, PUNJAB ,141115","1628 ,251222",harpreettaneja75@gmail.com,
1630770,GARDEN VALLEY INTERNATIONAL SCHOOL,GURDEEP KAUR,Senior Secondary,31/03/2023,"VILLAGE BELA, ROPAR,PUNJAB ,140111","0 ,8284037532",gvisbela11@gmail.com,http://www.gvismachhiwara.in
1631181,GARDEN VALLEY INTERNATIONAL SCHOOL,MRS. SONIKA SANDHU,Senior Secondary,31/03/2022,"VILLAGE CHATAMALA, KURALI ROAD,MORINDA ,140101","91 ,09041106442,",gardenvalley78@gmail.com,http://www.gvismorinda.in
1630944,GARDEN VALLEY INTERNATIONAL SCHOOL,KAMALJIT KAUR,Senior Secondary,31/03/2025,"KHARAR ROAD, OPP. KHANNA HOSPITAL, BASSI PATHANA FATEHGARH PUNJAB ,140412","0000 ,9878241707",kamalgvis@gmail.com,http://www.gvisbassi.in
1631344,GARDEN VALLEY INTERNATIONAL SCHOOL,MRS. NAMITA CHAUHAN,Secondary School,31/03/2024,"VILLAGE SAMPLI, SAMPLA ROAD, NEAR UNIVERSITY COLLEGE, CHUNNI KALAN ,140307",",9041983221",gardenvalley78@gmail.com,http://www.gvischunni.in
1631325,GARDEN VALLEY INTERNATIONAL SCHOOL,MRS. JASKIRAN KAUR,Secondary School,31/03/2024,"VILLAGE BAINA BULAND, ,147203",",9316116243",gardenvalley78@gmail.com,http://www.gvisamloh.in
1630564,GB INTERNATIONAL SCHOOL,Poonam Rani,Senior Secondary,31/03/2025,"PATIALA ROAD, NABHA DIST PATIALA PUNJAB) 147201 ,147201","1765 ,228125",gbisnabha@yahoo.com,
1630433,GEM PUBLIC SCHOOL,R BUVANA,Senior Secondary,31/03/2022,"PHASE 3 B2 SECTOR-60, SAS NAGAR, MOHALI ROPAR PUNJAB ,160060","0172 ,5090720",lr.buvana@yahoo.com,http://www.alagojothiacademy.in
1630629,GEMS CAMBRIDGE INTERNATIONAL SCHOOL,YACHANA CHAWLA,Senior Secondary,31/03/2021,"GEMS CAMBRIDGE INTERNATIONAL SCHOOL JALANDHAR-PHAGWARA BYEPASS PURHIRAN HOSHIARPUR ,146111","1882 ,249313",principal.gcishoshiarpur@gmail.com,http://www.gemseducation.com
1630792,GEMS CAMBRIDGE INTERNATIONAL SCHOOL,Md Imtazul Hussain,Senior Secondary,31/03/2024,"VILLAGE SHAHAPURA, AMRITSAR ROAD, TEH. BATALA, GURDASPUR ,143505","1871 ,8728892400",gcisbprincipal@gmail.com,
1631187,GEMS PUBLIC SCHOOL,Anju Nagpal,Secondary School,31/03/2025,"82 FEET CIRCLE ROAD, SUSHANT CITY - II, MANSA ROAD ,151001","0 ,9115003264",principal.bathinda@gemspublicschool.co.in,
1631220,GEMS PUBLIC SCHOOL,MISS MANJARI TEJPAL,Senior Secondary,31/03/2024,"NEAR ITBP CAMP, CHAURA-SANOUR ROAD, VILL-DHARAMKOT, PATIALA ,147002",",8285586816",ekta.passi@gemseducation.com,www.gemseducation.com
1630015,GEN GURNAM SINGH PUBLIC SCHOOL,MRS. TEJINDER KAUR SEKHON,Senior Secondary,31/03/2025,"GENERAL GURNAM SINGH PUBLIC SCHOOL,PATIALA BYPASS SANGRUR ,148001","1672 ,1672250588",principal.ggsschool@gmail.com,ggspublicschoolsangrur.org
1630464,GENIUS INTERNATIONAL PUBLIC SCHOOL,Poonam Dogra,Senior Secondary,31/03/2022,"NEAR GURUDWARA SOLKHIAN, NH-21, ROPAR CHANDIGARH HIGHWAY, PUNJAB ,144401","1881 ,240080",issh786s@gmail.com,
1631327,GGS WORLD SCHOOL FEROZEPUR ROAD MALLANWALA FEROZEPUR,MR. MANJIT SINGH,Secondary School,31/03/2024,"FEROZEPUR ROAD MALLANWALA FEROZEPUR ,152021",",9781215704",ggsworld18@gmail.com,WWW.GGSWORLDFZR.COM
1630920,GHG ACADEMY,MR. VIPAN KUMAR,Senior Secondary,31/03/2024,"VPO- KHANDOOR, DISTT. LUDHIANA ,141103",",9855612226",ghgacademykhandoor@gmail.com,www.ghgacademyjagraon.com
1630373,GHOMAN INTERNATIONAL PUBLIC SCHOOL,Manjeet,Senior Secondary,31/03/2023,"BEAS ROAD GHOMAN BATALA GURDASPUR PUNJAB ,143514","1872 ,266740",bawa.mann10@gmail.com,
1630023,GIAN JYOTI GLOBAL SCHOOL,RANJEET BEDI,Senior Secondary,31/03/2025,"PHASE II SAS NAGAR MOHALI PUNJAB ,160055","0172 ,2228806",gian_jyoti@rediffmail.com,http://www.gjpsmohali.com
1630949,GILLCO INTERNATIONAL SCHOOL,MRS.INDERPREET KAUR,Senior Secondary,31/03/2026,"GILLCO VALLEY, SECTOR-127, DISTT. MOHALI, P.O KHARAR, PUNJAB (140301) ,140301","0160 ,01606600497",principal@gillcoschool.com,http://www.gillcoschool.com
1630243,GITA BHAWAN PUBLIC SCHOOL,Venu Sood,Secondary School,31/03/2026,"VEDANT NAGAR MOGA PUNJAB ,142001","1636 ,229220",soodvenu@gmail.com,
1631035,GLOBAL DISCOVERY SCHOOL,MRS. SARABJEET KAUR SRAN,Senior Secondary,31/03/2022,"BATHINDA ROAD ,151103","7529 ,09814000607",amitsaraf607@gmail.com,http://www.discoveryschools.in
1630498,GLOBAL PUBLIC SCHOOL,MRS. JYOTI,Senior Secondary,31/03/2024,"RANGA, MUKERIAN HOSHIARPUR PUNJAB ,144306","1883 ,233095,",gpsranga36@yahoo.com,http://www.gpsranga.com
1631177,GLOBAL WISDOM CONVENT SCHOOL,MRS. SAMITA SINGH,Senior Secondary,31/03/2024,"LOHGARH ROAD ,142042","1682 ,9781285444",gwcsdmk1@gmail.com,http://www.gwcsdmk.com
1631252,GLOBAL WISDOM INTERNATIONAL SCHOOL,MRS. MONICA MANN,Senior Secondary,31/03/2024,"BARWALA ROAD, DERA BASSI DISTT SAS NAGAR MOHALI PUNJAB ,140507",",01727165601",gwisderabassi@gmail.com,www.gwis.co.in
1630616,GMA CITY PUBLIC SCHOOL,ANITA ARORA,Senior Secondary,31/03/2026,"CHANDIGARH ROAD, CHABBEWAL ,146001","1882 ,270006",ecoarora@gmail.com,
1630766,GMT INTERNATIONAL PUBLIC SCHOOL,Neetu Sharma,Senior Secondary,31/03/2023,"KAKOWAL ROAD, NEAR VENUS GARMENT FACTORY, LUDHIANA ,141007","0161 ,2174324",Neetu.bhambi@gmail.com,http://www.gmtinternationalschool.com
1630601,GN CONVENT SCHOOL,PARMPAL KAUR BUTTER,Senior Secondary,31/03/2025,"VPO BHALOOR, DISTT MOGA PUNJAB ,151207","1636 ,247357",parmpalmachaki@gmail.com,www.gnconventschool.com
1630724,GOBIND PUBLIC SCHOOL,MRS. SONIKA SHARMA,Secondary School,31/03/2025,"G.T. ROAD, DINANAGAR ,143531","1875 ,01875222117",gpsdnn@gmail.com,www.gobindpublicschool.com
1630063,GOBINDGARH PUBLIC SCHOOL,Dr.Neeru Arora,Senior Secondary,31/03/2025,"MANDI GOBIND GARH FATEHGARH SAHIB PUNJAB ,147301","1765 ,255450,9872070638",gpsgobindgarh@yahoo.com,
1630817,GOD BLESSING PUBLIC SCHOOL,SUSHMA RANI,Senior Secondary,31/03/2023,"NEAR SHAKTI NAGAR, DHARMGARH ROAD, LALRU MANDI, TEH: DERA BASSI, DISTRICT: AJITGARH, PUNJAB ,140501","0 ,9041864395",sssushthakur@gmail.com,
1630439,GODWIN PUBLIC SCHOOL,LAKHWINDER KAUR,Senior Secondary,31/03/2026,"ABOHAR FAZILKA ROAD GHALLU PO NIHAL HERA TEH FAZILKA FEROZEPUR PUNJAB ,152122","1638 ,233317",brarjagjit80@gmail.com,
1630153,GOLDEN BELLS PUB SCHOOL,ANJALI CHAUDHRY,Senior Secondary,31/03/2022,"SOHANA MOHALI PUNJAB ,140308","91 ,9915808830",achaudhry.chd@gmail.com,http://www.goldenbells.or
1630887,GOLDEN DAYS PUBLIC SCHOOL,Mrs.Surjit Kaur,Secondary School,31/03/2022,"BATHINDA-DABWALI ROAD, GURTHARI(BATHINDA) ,151001",",9316277100",kuldeepbathinda@gmail.com,
1630694,GOLDEN EARTH CONVENT SCHOOL,MR. VINOD KUMAR,Senior Secondary,31/03/2022,"MOGA-FEROZEPUR HIGHWAY V.P.O JOGEWALA DISTT. MOGA ,142048","91 ,9914278100,",goldenearthconventschool@rediffmail.com,http://www.goldenearthconventschool.in/
1630411,GOLDEN EARTH GLOBAL SCHOOL,Sk Nurul Haque,Senior Secondary,31/03/2023,"PATIALA ROAD SANGRUR PUNJAB ,176102","91 ,8054958385",nurulhaque3266@gmail.com,
1630987,"GOLDEN ERA MILLENNIUM SCHOOL, SULTANPUR",MR. JAANDEEP SANDHU,Secondary School,31/03/2024,"MALERKOTLA, RAIKOT ROAD ,148023","1675 ,07589220611",gems_schoolindia@yahoo.in,http://www.gemssultanpur.com
1630798,GOLDEN ERA SCHOOL,MISS VISHWARUCHI DE,Senior Secondary,31/03/2022,"BHADSON-PATIALA ROAD, VILLAGE DITTUPUR JATTAN, NABHA PATIALA ,147202","1765 ,01675283116",gespatiala@gmail.com,http://www.goldeneraschool.co.in
1631247,GOLDEN PUBLIC SCHOOL,Mrs.Amandeep kaur,Secondary School,31/03/2022,"TARPALLA ,143602",",0187121905",sgvp@ymail.com,
1631328,GOLDEN SENIOR SECONDARY SCHOOL,MR. JATINDER GUPTA,Senior Secondary,31/03/2024,"HANUMAN CHOWK, GURDASPUR ,143521",",01874503500",goldencbse@gmail.com,
1630644,GOOD SHEPHERD PUBLIC SCHOOL,MR. JOGINDER SINGH,Senior Secondary,31/03/2024,"V.P.O.PANNIWALA FATTA, MUKTSAR ,151210","1637 ,01637242368,",gspspanniwalafatta@gmail.com,http://www.gspspanniwala.org
1631108,GOODEARTH CONVENT SCHOOL,SAPANDEEP KAUR GILL,Secondary School,31/03/2025,"VPO-SIAHAR,TEH-PAYAL ,141117","1628 ,09169498000",principalgoodearth@gmail.com,http://www.goodearthconventschool.com
1631115,GOODWILL INTERNATIONAL SCHOOL,MR. SATNAM SINGH,Secondary School,31/03/2025,"GOODWILL INTERNATIONAL SCHOOL, VPO DHADIALA NATT, TEHSIL BATALA(ALIWAL), DISTRICT GURDASPUR, PIN: 143507 ,143507","1871 ,01871268201",goodwillschool1@rediffmail.com,www.goodwillschool.org
2620085,GOVERNMENT MODEL HIGH SCHOOL,RAJESH SHARMA,Secondary School,31/03/2021,"SECTOR 38 (WEST), U.T. CHANDIGARH ,160023","0172 ,2688024",rajeshsharma6651@gmail.com,
2620084,GOVERNMENT MODEL HIGH SCHOOL,SANGEETA YADAV,Secondary School,31/03/2023,"VIKAS NAGAR, MAULI JAGRAN, CHANDIGARH ,160023","0172 ,2730298",,http://www.jnvwashim.gov.in
2620102,GOVERNMENT MODEL HIGH SCHOOL MALOYA-II CHANDIGARH,MR. S.K.ANAND,Secondary School,31/03/2025,"GOVERNMENT MODEL HIGH SCHOOL MALOYA - II ,160025",",01722680009",gmhsmaloya2@gmail.com,http://www.gmhsIImaloya.in
2620067,GOVT  HIGH  SCHOOL,MANOJ KUMAR SHARMA,Secondary School,31/03/2026,"MAULI COLONY P O MANIMAJRA CHANDIGARH ,160101","0172 ,2751001",ghsmc@rediffmail.com,edu.gsssrk.com.in
1620028,GOVT ADARSH SR.SEC. SCHOOL,RUCHI GROVER,Senior Secondary,31/03/2021,"LODHIPUR ANANDPUR SAHIB PUNJAB ,140118","1887 ,212001",gasss2011@gmail.com,
2620008,GOVT GIRLS SR SEC SCHOOL,RAJ BALA,Senior Secondary,31/03/2023,"SECTOR-18 C CHANDIGARH ,160018","0172 ,2700237",rbala715@gmail.com,
2620002,GOVT GIRLS SR SEC SCHOOL,MONICA MAINI,Senior Secondary,31/03/2025,"SECTOR 8B CHANDIGARH ,160018","0172 ,2700274",gmsss8-chd@nic.in,
2620012,GOVT GIRLS SR SEC SCHOOL,manita sehgal,Senior Secondary,31/03/2022,"SECTOR-20B CHANDIGARH ,160021","0172 ,2700720",ggsss20b@yahoo.com,
2620018,GOVT GIRLS SR SEC SCHOOL,MINI GUPTA,Senior Secondary,31/03/2023,"SECTOR-23A CHANDIGARH ,160023","0172 ,2700083",gmsss23chd@gmail.com,
2620047,GOVT HIGH SCHOOL,INDERJIT SINGH,Secondary School,31/03/2020,"SECT 24 A CHANDIGARH ,160","0172 ,2700112",govt24@gmail.com,
2620097,GOVT HIGH SCHOOL,SHASHI KUMAR,Secondary School,31/03/2026,"INDIRA COLONY, MANIMAJARA, CHANDIGARH ,160101","0172 ,2737099",shashikumarattri@gmail.com,
2620070,GOVT HIGH SCHOOL,Tejvinder Kaur,Secondary School,31/03/2024,"SECTOR 46 CHANDIGARH ,","0172 ,2678027",,
2620054,GOVT HIGH SCHOOL,HARJINDER KAUR,Secondary School,31/03/2023,"SECTOR 30A CHANDIGARH ,160","0172 ,2679004",hkarora1078@gmail.com,
2620092,GOVT HIGH SCHOOL,Satya Prakash Semwal,Secondary School,31/03/2026,"SECT 52, CHANDIGARH ,160061","0172 ,2682291",satyaprakash2198@gmail.com,
2620093,GOVT HIGH SCHOOL,BALJIT KAUR,Secondary School,31/03/2024,"SECT. 54, CHANDIGARH ,262122","0172 ,2271054",baljeetkaur.kaur09@gmail.com,
2620089,GOVT HIGH SCHOOL,SUPINDER SINGH,Secondary School,31/03/2022,"MALOYA COLONY. CHANDIGARH ,160014","0172 ,2643777",gmsmaloyacolony@rediffmail.com,
2620042,GOVT HIGH SCHOOL,Kulwant Kaur,Secondary School,31/03/2024,"SECT-35D CHANDIGARH ,160035","0172 ,2676039",,
