Affiliation Number,Name,Head/Principal Name,Status,Affiliated unto,Address,Phone no.,Email,Website
2730704,JAMES CONVENT SCHOOL,Sangeeta,Senior Secondary,31/03/2023,"F-34/2&3, SATSANG ROAD, NIHAL VIHAR, NANGLOI, NEW DELHI -110041 ,110041","011 ,25947474",jamesconventschool1@gmail.com,
2730152,JASPAL KAUR PUBLIC SCHOOL,Asha Saran Srivastava,Senior Secondary,31/03/2023,"'B' PASCHIMI SHALIMAR BAGH DELHI ,110052","011 ,27470022",GEORGEMATHEWJKPS@GMAIL.COM,http://www.jkps.org
2740001,JAWAHAR NAVODAYA VIDYALAYA,KUSUM KUMARI SINGH,Senior Secondary,31/03/2023,"MUNGESHPUR P.O. BAWANA, DELHI ,110039","011 ,27741768",kusumsingh5566@gamil.com,
2730440,JEEVAN PUBLIC SCHOOL,SEEMA,Senior Secondary,31/03/2021,"PRATAP VIHAR PART II KIRARI EXTENSION NANGLOI DELHI ,110041","011 ,65488257",seemasumitchoudhary@gmail.com,
2730563,JEEWAN JYOTI SENIOR SECONDARY SCHOOL,R K BANSAL,Senior Secondary,31/03/2025,"CH. HUKAM SINGH MARG SADATPUR, EXTN, SHAHADARA, DELHI ,110094","011 ,9650121850",rakeshbansal61966@gmail.com,http://www.dldavpp.com
2730750,JESUS GRACE MODERN SCHOOL,MRS. SHILPE RANI,Senior Secondary,31/03/2024,"ST NO.-13B, A-BLOCK BABA COLONY BURARI ,110084",",01132315541",shilpe12456@gmail.com,www.jesusgracemodernschool.in
2730680,JESUS MARY JOSEPH SCHOOL,Marykutty Antony,Senior Secondary,31/03/2026,"G-17, SITE-10, PASCHIM VIHAR, OPP. GH-2, ANKUR APARTMENT ,110063","011 ,45538691",delhijmj15@gmail.com,http://www.xyz.com
2730253,JHABBAN LAL DAV PUBLIC SCHOOL,INDU ARORA,Senior Secondary,31/03/2025,"J-BLOCK R B ENCLAVE PASCHIM VIHAR, DISTT WEST DELHI, NEW DELHI ,110063","011 ,45522816",anupama3469@gmail.com,
2730662,JINDAL INTERNATIONAL SCHOOL,Niti Sharma,Senior Secondary,31/03/2021,"SHAHBAD DAULATPUR, MAIN BAWANA ROAD, SECTOR-28, ROHINI, PHASE - IV ,110042","011 ,65232031",niti55551111@gmail.com,
2730416,JOSEPH AND MARY PUBLIC SCHOOL,SINDHU PRASEETH,Senior Secondary,31/03/2026,"SHASTRI PARK NATHUPURA BURARI DELHI ,110084","011 ,27612796",praseeth.sindhu205@gmail.com,
2730550,JYOTI MODEL SCHOOL,Pankaj Gulati,Secondary School,31/03/2015,"C - 18 , ACHARYA KRIPLANI ROAD ,110033","011 ,27682469",thegulatizone@gmail.com,
2730334,K D MODEL SCHOOL,MR. RAJENDER KUMAR,Secondary School,31/03/2025,"BAWANA ROAD BARWALA DELHI ,110039","011 ,01127822205",kdmodelschool@gmail.com,
2730538,K R MANGALAM WORLD SCHOOL,Ms  Priya Arora,Senior Secondary,31/03/2025,"H BLOCK, VIKAS PURI, DISTT WEST DELHI, DELHI ,110018","011 ,28541441",PRINCIPAL.VP@KRMANGALAM.COM,
2776015,KALGIDHAR KHALSA SR SEC SCHOOL,HARVINDER KAUR,Senior Secondary,31/03/2019,"SUBHASH NAGAR NEW DELHI ,110027","011 ,25132483",kkssssubhashnagar@gmail.com,
2730829,KALINGA INSTITUTE OF SOCIAL SCIENCES DELHI GOVERNMENT SENIOR SECONDARY RESIDENTIAL SCHOOL,Mrs. Kumkum Sharma,Senior Secondary,31/03/2024,"VILLAGE ISSAPUR, NAJAFGARH, DELHI-110073 ,110073",",01123315876",kissdelhi@outlook.com,www.kissdelhi.ac.in
2730819,KAMS CONVENT SCHOOL,MRS. SONIA,Secondary School,31/03/2022,"122, MAIN ROAD, KUSHAK NO.2, VILLAGE QADIPUR, DELHI-110036 ,110036",",9212628324",kamsconventschool122@gmail.com,
2730567,KASTURI RAM INTERNATIONAL SCHOOL,ANIL KUMAR BHATNAGAR,Senior Secondary,31/03/2023,"SECTOR A - 10, NARELA, DISTT NORTH DELHI, DELHI ,110040","011 ,27781912",ak56bhatnagar@gmail.com,http://www.gudhainternational.com
2700038,KENDRIYA VIDYALAYA,DR POONAM BHARDWAJ,Senior Secondary,31/03/2022,"SECTOR 22 AT SECTOR 3 ROHINI DELHI ,110085","011 ,27512701",poonamrajshiva@gmail.com,http://www.kvnhpclok.org
2700037,KENDRIYA VIDYALAYA,KUMUD SRIVASTAVA,Senior Secondary,31/03/2023,"SECTOR 25 ROHINI DELHI ,110085","011 ,27947920",kumud1958@gmail.com,
2700035,KENDRIYA VIDYALAYA,MITA ADHIKARY,Senior Secondary,31/03/2023,"SECTOR 3 ROHINI DELHI ,110085","011 ,27525310",ADHIKARYMITA@GMAIL.COM,
2700034,KENDRIYA VIDYALAYA,UTTAM KUMAR,Senior Secondary,31/03/2022,"SEC 8 ROHINI DELHI ,110085","011 ,27944923",kvsector8rohini@gmail.com,http://www.kvnehu.org
2700033,KENDRIYA VIDYALAYA,SABIRA SHORI,Senior Secondary,31/03/2025,"PASCHIM VIHAR NEW DELHI ,110087","011 ,43055822",kvpaschimvihar@yahoo.co.in,
2700029,KENDRIYA VIDYALAYA,DEVENDER KUMAR,Senior Secondary,31/03/2025,"VILLAGE HASTSAL VIKAS PURI NEW DELHI ,110059","11 ,25648201",devender15965@gmail.com,http://www.kvranikhet.com
2700027,KENDRIYA VIDYALAYA,SUBHASH CHANDER,Senior Secondary,31/03/2026,"A F S GHOGA BAWANA DELHI ,110039","011 ,27754563",kv_bawana@yahoo.com,http://www.kv1chakeri.org
2700021,KENDRIYA VIDYALAYA,LEENA SINGH,Senior Secondary,31/03/2017,"SAINIK VIHAR DELHI ,110034","011 ,27022979",kvsainikvihar@yahoo.co.in,http://www.kvsvdelhi.com
2700026,KENDRIYA VIDYALAYA,RAMA RAGHURAM,Senior Secondary,31/03/2022,"T P BLOCK PITAM PURA DELHI ,110034","011 ,27325256",KVPITAMPURA@GMAIL.COM,http://kvpushpvihar.com
2700012,KENDRIYA VIDYALAYA,HARINDER SINGH LAMBA,Senior Secondary,31/03/2023,"KESHAV PURAM DELHI ,110035","011 ,27395361",harindersinghlamba@gmail.com,
2700009,KENDRIYA VIDYALAYA,perveen kumar malik,Senior Secondary,31/03/2021,"ROBERT SQUARE GOLE MARKET NEW DELHI ,110001","011 ,23747395",KVGOLEMARKET@GMAIL.COM,www.kvcrpfdurgapur.com
2700007,KENDRIYA VIDYALAYA,VINOD KUMAR YADAV,Senior Secondary,31/03/2023,"C-2 JANAKPURI NEW DELHI ,110058","011 ,25551376",vkdhundhla@gmail.com,http://www.kvnehu.org
2700045,KENDRIYA VIDYALAYA,.,Secondary School,31/03/2022,"SECT-28, ROHINI WKING AT KENDRIYA VIDYALAYA, SECT -3, ROHINI CAMPUS, AT D-16, SECT-3, ROHINI, DELHI-110 085 ,110053","011 ,22198148",,
2700008,KENDRIYA VIDYALAYA,K Jayalakshmi Raju,Senior Secondary,31/03/2022,"TAGORE GARDEN NEW DELHI ,110027","011 ,25109436",kvtagoregarden@rediffmail.com,http://www.kvnhpclok.org
2700042,KENDRIYA VIDYALAYA,SHOBHA SHARMA,Secondary School,31/03/2025,"SHAKURBASTI, C/O K.V. PASCHIM VIHAR, OPP. AMBIKA VIHAR, NEW DELHI ,110087","011 ,25269441",kvshobha.sharma@gmail.com,
2700040,KENDRIYA VIDYALAYA,Pushpa Rani Yadav,Senior Secondary,31/03/2021,"SEC A-5, POCKET - 11, NARELA, DELHI ,110040","011 ,27787278",pryadav1819@gmail.com,
2700017,KENDRIYA VIDYALAYA,D V RAMKRISHNA,Senior Secondary,31/03/2024,"POCKET AN BLOCK SHALIMAR BAGH DELHI ,110088","011 ,27477494",kvshalimarbagh@yahoo.co.in,
2774009,KERALA EDUCATION SOCIETY SR SEC SCH,HARI KUMAR K G,Senior Secondary,31/03/2017,"CANNING ROAD NEW DELHI ,110001","011 ,23385725",principalkscanningroad@gmail.com,
2776012,KERALA SCHOOL,JAYANTHI R CHANDRAN,Senior Secondary,31/03/2023,"M BLOCK VIKASPURI NEW DELHI ,110018","011 ,25595475",jayarc88@gmail.com,
2788019,KHALSA GIRLS SR SEC SCHOOL,Amarjeet Kaur,Senior Secondary,31/03/2022,"CHUNA MANDI PAHARGANJ NEW DELHI ,110055","011 ,23586282",,
2730840,KHEMO DEVI PUBLIC SCHOOL,MRS. PRIYA MESH RAM,Senior Secondary,31/03/2024,"KHASRA NO. 33/4, STREET NO SAFIABAD ROAD, VILLAGE NEAR BHARAT GAS AGENCY, NARELA, DELHI-110040 ,110040",",01127281897",kdps2016@gmail.com,www.khemodevipublicschool.com
2778057,KHRIST RAJA SEC SCHOOL,sh martin thomas,Secondary School,31/03/2022,"(CONVENT OF JESUS MARY) BANGLA SAHIB ROAD NEW DELHI ,110001","011 ,23733119",,
2730110,KIIT WORLD SCHOOL,Sangeeta Bhatia,Senior Secondary,31/03/2024,"ZONE H-4 KESHMI APARTMENTS & DIPALI PITAM PURA DELHI ,110034","011 ,47502551",sangeeta_kamrah@yahoo.com,
2730069,KULACHI HANSRAJ MODEL SCHOOL,SNEH VERMA,Senior Secondary,31/03/2018,"ASHOK VIHAR PHASE III DELHI ,110052","011 ,27143364",sneh1959@gmail.com,
2788009,L D JAIN GIRLS SR SEC SCHOOL,SHASHI GUPTA,Senior Secondary,31/03/2024,"PAHARI DHIRAJ DELHI ,110006","011 ,23528202",SHASHILDJ@GMAIL.COM,
2730528,L K INTT SCHOOL,SARAMMA JACOB,Senior Secondary,31/03/2022,"OPP RAJIV GANDHI STD AUCHANDI ROAD, BAWANA, DISTT NORTH WEST DELHI, DELHI ,110039","011 ,65195298",sarasanthosh1970@yahoo.co.in,
2778060,L N GIRDHARI LAL K U SR SEC SCHOOL,Sunil Kumar Mishra,Senior Secondary,31/03/2025,"FATEHPURI BAGH DEWAR DELHI ,110006","011 ,23963213",skm1964.skm@gmail.com,
2784001,LADY IRWIN GIRLS SR SEC SCHOOL,G RAMA KIRPAL,Senior Secondary,31/03/2029,"CANNING ROAD NEW DELHI ,110001","011 ,23389729",gollamudirama@gmail.com,
2730160,LANCER'S CONVENT SR SEC SCHOOL,LATESH CHAUDHARY,Senior Secondary,31/03/2023,"PRASHANT VIHAR OUTER RING ROAD ROHINI NEW DELHI ,110085","011 ,27562816",principal@lancersconvent.net,www.lancersconvent.in
2730715,LAUREL HIGH THE SCHOOL,JYOTI MAHAJAN,Senior Secondary,31/03/2024,"BEHIND IDPL CHBS, (NEAR ASHIANA CHOWK), PITAM PURA, NEW DELHI-110034 ,110034","011 ,47096600",laurelhigh@rediffmail.com,http://www.laurel-high.com
2730751,LAVI PUBLIC SCHOOL,Pravesh Kumari,Senior Secondary,31/03/2024,"141, VILLAGE GHEVRA, NEW DELHI -110081 ,110081","011 ,25951542",lavipublicschool@yahoo.com,http://www.abc.com
2730067,LILAWATI VIDYA MANDIR SR SEC SCHOOL,Shurti KHURANA,Senior Secondary,31/03/2025,"NEAR RAILWAY CROSSING 2 SHAKTI NAGAR, DISTT NORTH WEST DELHI, DELHI ,110007","011 ,23656142",khurana.sushma0@gmail.com,
2730271,LIONS PUBLIC SCHOOL,NEENA SINGH,Senior Secondary,31/03/2023,"I-BLOCK PHASE I ASHOK VIHAR DELHI ,110052","011 ,47062575",lions_public_school@yahoo.co.in,
2774010,LIONS VIDYA MANDIR SEC SCHOOL,PRADEEP KUMAR,Secondary School,31/03/2017,"KASHMIR HOUSE KUSHAK LANE NEW DELHI ,110011","011 ,23013271",PRADEEPKUMARNALWA@REDIFFMAIL.COM,
2730545,LITTLE FAIRY PUBLIC SCHOOL,MEENAKSHI,Senior Secondary,31/03/2022,"HUDSON LINE ,110009","011 ,27457677",meenakshilfps@gmail.com,
2730831,LITTLE STAR CONVENT SCHOOL,Mr.SATENDRA KUMAR TYAGI,Secondary School,31/03/2023,"KH. NO.56/1, PARASRAM ENCLAVE, BURARI, ,110084",",9891081418",lscschool@gmail.com,
2730192,LT. COL. MEHAR LITTLE ANGELS SR SEC SCHOOL,MRS S MEHAR,Senior Secondary,31/03/2025,"B5-BLOCK PASCHIM VIHAR NEW DELHI ,110063",",25588053",,
2730055,M C L SARASWATI BAL MANDIR,MR. KULDIP SINGH CHOUHAN,Senior Secondary,31/03/2024,"L-BLOCK HARI NAGAR NEW DELHI ,110064","011 ,28124302,",mclsbmhn@gmail.com,http://www.mclsbm.com
2730503,M D MEMORIAL PUBLIC SCHOOL,S MANN,Senior Secondary,31/03/2024,"FRIENDS ENCLAVE SULTANPURI INDRAJKEEL NANGLOI DELHI ,678594","011 ,55330111",goyalgbp99@hotmail.com,
2752048,M G RANADAY GOVT. SARVODAYA BOYS SR,SHEESH PAL SINGH,Senior Secondary,31/03/2023,"SEC GAUTAMPURI USMANPUR DELHI ,110053","011 ,22172513",principal.gp@gmail.com,
2750010,M L GOVT BOYS SR SEC SCHOOL,VIJENDRA SINGH PANKAJ,Senior Secondary,31/03/2021,"NARELA DELHI ,110040","011 ,27783505",vspankaj2@gmail.com,
2730223,M M PUBLIC SCHOOL,ROOMA PATHAK,Senior Secondary,31/03/2025,"VASUDHA ENCLAVE PITAM PURA, DISTT NORHT WEST DELHI, DELHI ,110034","011 ,27351513",info@mmpublicschool.com,
2730362,M N CONVENT SECONDARY SCHOOL,SUNITA HOODA,Senior Secondary,31/03/2009,"1/14, KUSHAK ROAD SAROOP NAGAR DELHI ,110042","011 ,27811957",mncss@yahoo.in,
2730453,M R C PUBLIC SCHOOL,Sunaina,Secondary School,31/03/2022,"B 29 VIKAS NAGAR HASTSAL NEW DELHI ,110059","011 ,25373437",principal_mrc@yahoo.co.in,
2730305,M S MODEL SCHOOL,MRS. ANITA RANI SHARMA,Senior Secondary,31/03/2024,"MOHALLA-SATGHARA, VILLAGE-KARALA,DELHI ,110081","0 ,9211804219",msmodelschool@yahoo.co.in,http://www.msmodelschool.in
2730744,M.D.INDRAPRASTHA PUBLIC SCHOOL,Mrs.SEEMA YADAV,Senior Secondary,31/03/2025,"BARWALA ROAD, BEGUM PUR EXTN., OPP. ROHINI SEC-22 ,110086",",01132311115",info@mdipps.com,http://www.mdipps.com
2730709,M.N.B. MODERN SCHOOL,MANOJ SHARMA,Secondary School,31/03/2026,"PHASE-9 GALI NO. 1 SHIV VIHAR ,110094","011 ,22934299",ms522507@gmail.com,
2730681,M.R. BHARTI MODEL SR. SEC. SCHOOL,SUBHASH CHAND,Senior Secondary,31/03/2022,"K-53/15, FRIENDS COLONY, MUNDKA ,110041","011 ,65646661",mrbhartimodelschool@yahoo.com,
2730175,MAHARAJA AGARSAIN PUBLIC SCHOOL,PUNAM GUPTA,Senior Secondary,31/03/2023,"PHASE IV ASHOK VIHAR, DISTT NORTH WEST DELHI, DELHI ,110052","011 ,27304700",punam28gupta@yahoo.com,
2730499,MAHARAJA AGGARSAIN ADARSH SCHOOL,HARSH ARYA,Senior Secondary,31/03/2024,"D U BLOCK PITAM PURA, DISTT NORTH WEST DELHI, DELHI ,110098","011 ,27344340",harya12@rediffmail.com,
2730301,MAHARAJA AGGARSAIN PUBLIC SCHOOL,Mr.Subhash Chander,Senior Secondary,31/03/2023,"BAWANA ROAD NARELA DELHI ,110040","011 ,27285177",principal_maps.sch@rediffmail.com,
2730149,MAHARAJA AGGARSEN MODEL SCHOOL,PRATIBHA KOHLI,Senior Secondary,31/03/2024,"CD BLOCK PITAMPURA DELHI ,110034","011 ,27311113",PRATIBHAKOHLI8@GMAIL.COM,
2730523,MAHARISHI DAYANAND MODEL SCHOOL,Neena Sharma,Secondary School,31/03/2024,"134 ARVIND ENCLAVE AMAR COLONY, NANGLOI DELHI ,110041","011 ,25945309",neenasharma10051964@gmail.com,
2730841,MAHARISHI DAYANAND VIDYA BHAWAN,MR. PRADEEP KUMAR,Secondary School,31/03/2023,"KH. NO. 158/3, ISHWAR COLONY, VILLAGE BAWANA, DELHI-110039 ,110039",",9818460189",mdvidyabhawanbawana@gmail.com,
2730130,MAHAVIR SR MODEL SCHOOL,VIVEK,Senior Secondary,31/03/2023,"SANGAM PARK EXTN G T KARNAL ROAD, DISTT NORTH DELHI, DELHI ,110033","011 ,27444797",principalmahavirschool@gmail.com,http://www.dpsrewa.com
2730133,MAMTA MODERN SR SEC SCHOOL,PALLAVI SHARMA,Senior Secondary,31/03/2023,"VIKAS PURI, DISTT WEST DELHI, NEW DELHI ,110059","011 ,45614501",mamtamodernschool@hotmail.com,
2730050,MANAV STHALI SCHOOL,DIPTI A BHATNAGAR    Officiating,Senior Secondary,31/03/2023,"R-BLOCK NEW RAJINDER NAGAR NEW DELHI ,110060","011 ,28742464",info@manavsthalischool.com,
2730647,MANAVA BHAWNA PUBLIC SCHOOL,KAVITA SHARMA,Secondary School,31/03/2024,"MANAVA BHAWNA PUBLIC SCHOOL NATHUPURA MAIN ROAD NEAR BUS STAND,BURARI. ,110084","011 ,27731003",mbps.education@gmail.com,
2770011,MANENDRA SHAKTI SR SEC VIDYALAYA,archna tyagi,Senior Secondary,31/03/2022,"B-3 KESHAV PURAM DELHI ,110035",",27184769",,
2730549,MANVI PUBLIC SCHOOL,Anjali Malik,Secondary School,31/03/2025,"BLOCK - C , SECTOT - 7 ,110085","011 ,27045080",manvipskool@gmail.com,
2730718,MARGSHREE SCHOOL,MRS. ANITA YADAV,Senior Secondary,31/03/2023,"NANGLOI-NAJAFGARH ROAD, NEAR WATER TANK, NANGLOI ,110041","011 ,01125946039,",anita.ashry@gmail.com,http://www.margshree.net
2730692,MARIGOLD PUBLIC SCHOOL,Uma Sharma,Senior Secondary,31/03/2022,"KHASRA NO 559 JAT KH ROAD VPO KATEWARA DELHI ,110039","011 ,27741072",mgpskatewara@gmail.com,
2778059,MARWARI SR SEC SCHOOL,PADAM BHUSHAN GUPTA,Senior Secondary,31/03/2025,"AMIR CHAND MARG NAI SARAK CHANDNI CHOWK DELHI ,110006","011 ,23261202",marwarisss@gmail.com,
2752039,MASTER DA SURYA SEN GOVT.,SALEK CHAND,Senior Secondary,31/03/2021,"SARVODAYA BOYS SR. S. SCHOOL NO 1 B BLK YAMUNA VIHAR DELHI ,110053","011 ,22918967",gsbvno.1@gmail.com,
2730070,MATA JAI KAUR PUBLIC SCHOOL,RASHMI MEHTA,Senior Secondary,31/03/2025,"ASHOK VIHAR PHASE III DELHI ,110052","011 ,27244590",rashmimehta.rashmi@gmail.com,
2730686,MATA SUKHDEVI PUBLIC SCHOOL,Anju Gupta,Senior Secondary,31/03/2022,"MAIN G.T.K.ROAD NANGLI POONA DELHI 110036 ,110036","011 ,27202129",ms_ps2007@yahoo.com,http://www.xyz.com
2730093,MATER DEI SCHOOL,STELLA JOSEPH,Senior Secondary,31/03/2025,"TILAK LANE, DISTT NEW DELHI, NEW DELHI ,110001","011 ,23387679",contact@materdeischool.in,
2730678,MAXFORT SCHOOL,Ratna Chakravarty,Senior Secondary,31/03/2024,"HS-2 , SECTOR - 23 , ROHINI , NEW DELHI - 85 ,110085","011 ,30073001",principalrohini@maxfort.in,http://www.maxfort.in
2778038,MAZHARUL ISLAM SEC SCHOOL,Imteyaz Ahmad,Secondary School,31/03/2010,"FRASH KHANA DELHI ,110006","011 ,23215587",,
2730219,MERRY INTERNATIONAL PUBLIC SCHOOL,NAMITA PANDEY,Secondary School,31/03/2023,"BLOCK H-19 SECTOR VII ROHINI DELHI ,110085","011 ,27049347",principal.missps@gmail.com,
2730698,MHDC SARASWATI BAL MANDIR,USHA KIRAN,Secondary School,31/03/2026,"B-1 JANAKPURI, WEST DELHI, NEW DELHI -110058 ,110058","11 ,25616280",ushakiran505@gmail.com,http://www.samarthshikshasamiti.com
2730075,MIRA MODEL SR SEC SCHOOL,SADHANA BHALLA,Senior Secondary,31/03/2019,"B-BLOCK JANAK PURI NEW DELHI ,110058","011 ,25500489",miramodelschool@gmail.com,
2730106,MODERN CHILD PUBLIC SCHOOL,SUDHA DATTA,Senior Secondary,31/03/2023,"SULTANPURI ROAD NANGLOI DELHI ,110041","011 ,25473035",duttasudha@gmail.com,
2730325,MODERN ERA CONVENT,S MODY,Secondary School,31/03/2025,"B-1 BLOCK JANAKPURI NEW DELHI ,110058","011 ,25594614",modern_era1@rediffmail.com,
2730066,MODERN PUBLIC SCHOOL,ALKA KAPUR,Senior Secondary,31/03/2023,"B BLOCK, SHALIMAR BAGH, NTH WEST DELHI, DELHI-110052 ,110052","011 ,27480118",mpsshbagh@gmail.com,http://www.mpsshalimarbagh.com
2730009,MODERN SCHOOL,DR V. DATTA,Senior Secondary,31/03/2023,"BARAKHAMBA ROAD NEW DELHI ,110001",",23311618",mshbkr@del3.vsnl.net.in,
2730065,MONTFORT SCHOOL,MONACHAN K K,Senior Secondary,01/05/1985,"ASHOK VIHAR DELHI ,110052","011 ,27130841",monumonkurian@gmail.com,
2730258,MOTHER DIVINE PUBLIC SCHOOL,HANU,Senior Secondary,31/03/2024,"G-31 SECTOR 3 ROHINI DELHI ,110085","011 ,43001772",info@motherdivineschool.com,
2730815,MOTHER KHAZANI CONVENT SCHOOL,MRS. RASHMI KATHURIA,Senior Secondary,31/03/2023,"NEAR PUNJAB NATIONAL BANK, VILLAGE BAKHTAWARPUR, DELHI - 110036 ,110036",",01127722188,9212375054",motherkhazani@gmail.com,
2730764,MOTHERHOOD PUBLIC SCHOOL,REETU JAIN,Middle Class,31/03/2020,"E 4/446,4 1/2 PUSTA NEAR SAGAR MARKET SONIA VIHAR ,110094","011 ,7838518053",satyatiwari41@gmail.com,
2730397,MOUNT ABU PUBLIC SCHOOL,JYOTI ARORA,Senior Secondary,31/03/2019,"SECTOR 5 POCKET B-8, ROHINI DELHI ,110085","011 ,27041516",JYOTIARORA212@GMAIL.COM,www.mountabuschool.com
2730609,MOUNT ABU SCHOOL,sindhu sadhu,Senior Secondary,31/03/2023,"PKT H-3 SECTOR 18 ROHINI ,110089",",011-27872787",maisdelhi@yahoo.co.in,http://www.maisdelhi.com
2730380,MOUNT OLIVET SCHOOL,BIRENDRA YADAV,Senior Secondary,31/03/2016,"STREET NO 100 B BLOCK SANT NAGAR BURARI DELHI ,110084","011 ,65374770",mount_olivetschool@yahoo.com,
2730600,MRL SECONDARY SCHOOL,MANJU BANSAL,Senior Secondary,31/03/2024,"319, PRAKASH VIHAR, KARAWAL NAGAR ,110094","011 ,22932842",mrl_sec@redfiffmail.com,
2730547,MUKUND LAL KATYAL SANATAN DHARAM,Alka Tyagi,Secondary School,31/03/2025,"SABHA VIDYALAYA ASHOK NAGAR ,110018","011 ,65569130",Alkatyagi1963@gmail.com,
2778048,MULTAN D A V SEC SCHOOL,Niraj Kumar singh,Secondary School,31/03/2023,"RAJINDER NAGAR NEW DELHI ,110060","011 ,25746985",niraj_singh68@yahoo.co.in,
2730645,MUNI INTERNATIONAL SCHOOL,Seema Sharma,Secondary School,31/03/2024,"A-2/16-17-18, HASTSAAL ROAD, MOHAN GARDEN, NEW DELHI -110059 ,110059","011 ,25354833",muniinternationalschool@yahoo.co.in,
2730762,MURTI DEVI PUBLIC SCHOOL,Mrs.MANJULA RANI,Secondary School,31/03/2024,"221, A-2 BLOCK, WEST SANT NAGAR, P.O. BURARI, DELHI ,110084",",09212205870",bkdubey1964@yahoo.co.in,
2730057,N C JINDAL PUBLIC SCHOOL,D K PANDEY,Senior Secondary,31/03/2024,"ROAD NO 73 PUNJABI BAGH NEW DELHI ,110026","011 ,25228288",drdkp211@gmail.com,bbpsgr@hotmail.com
2730244,N K BAGRODIA PUBLIC SCHOOL,PRASHANT PARASHAR B,Senior Secondary,31/03/2023,"AHINSA MARG SECTOR 9 ROHINI DELHI ,110085","011 ,27566633",principalnkbpsrohini@gmail.com,
2730620,NALANDA MODERN PUBLIC SCHOOL,SEEMA VATS,Senior Secondary,31/03/2025,"SANT NAGAR MAIN ROAD BURARI ,110084","011 ,27615716",seema.vats07@gmail.com,
2730690,NATHU RAM CONVENT SCHOOL,RACHNA SINGH,Senior Secondary,31/03/2022,"SHIV RAM PARK PHASE-II, NILOTHI MORE, NANGLOI, NAJAFGARH ROAD ,110041","0 ,8882411533",n.r.convent@gmail.com,
2730363,NATIONAL PUBLIC SCHOOL,MRS. KRISHNA KHATRI,Senior Secondary,31/03/2024,"SAFIABAD ROAD NARELA DELHI ,110040","01762 ,27283513,",nps.narela@gmail.com,http://nationalpublicschool.in
2730294,NAV BHARTI PUBLIC SCHOOL,MR. SANJAY BHARTIYA,Senior Secondary,31/03/2024,"DEEPALI PITAM PURA DELHI ,110085",",011-27010908",navbhartipublicschool@yahoo.co.in,
2730142,NAV BHARTI SR SEC SCHOOL,VIMLESH HINDWAN,Senior Secondary,31/03/2024,"SHREE NAGAR COLONY DELHI ,110052","011 ,23654929",nbsss52@gmail.com,
2730702,NAV DURGA ADARSH VIDYALAYA,Mr.KRISHAN KUMAR,Secondary School,31/03/2021,"HOUSE NO 165 A, STREET NO 14, BLOCK A, COLONY BUDH VIHAR PHASE - II, DELHI - 110086. ,110086","08284 ,011- 27532222",ndavrana@gmail.com,
2730671,NAV JEEVAN ADARSH PUBLIC SCHOOL,Mamta Sharma,Senior Secondary,31/03/2025,"GALI NO: 16, A-BLOCK, PART-III, CIRCULAR ROAD, SONIA VIHAR, DELHI-110092 ,110092",",09999995580",binoda@yahoo.com,
2788025,NAV SHAKTI GIRLS SR SEC SCHOOL,mr. mrs.s.bhatla,Senior Secondary,31/03/2019,"ROUSE AVENUE (VISHNU DIGAMBER MARG) NEW DELHI ,110002","011 ,23212319",alkakatyal55@yahoo.com,
2778021,NAV SHAKTI VIDYA MANDIR GIRLS,mrs kshma mani,Senior Secondary,31/03/2021,"SR SEC SCHOOL PAHAR GANJ NEW DELHI ,110055",",23616974",,
2788005,NAVA HIND GIRLS SR SEC SCHOOL,MEENA GOEL,Senior Secondary,31/03/2023,"NEW ROHTAK ROAD NEW DELHI ,110005","011 ,28713217",meena.navahind@gmail.com,
2730406,NAVEEN PUBLIC SCHOOL,MRS SUNITA,Secondary School,31/03/2026,"VILLAGE NITHARI NANGLOI DELHI ,110041",",",,
2730112,NAVIN BHARTI PUBLIC SCHOOL,MR. L.M.ATREY,Senior Secondary,31/03/2024,"BALBIR NAGAR SHAHDARA, DISTT NORTH EAST DELHI, DELHI ,110032","011 ,1122325005",nbsss.school@gmail.com,http://www.navinbharti.com
2730427,NAVYUG HAPPY PUBLIC SCHOOL,JITENDER BANSAL,Senior Secondary,31/03/2023,"MUKUND VIHAR KARAWAL NAGAR DELHI ,110094","011 ,22932436",jitenderbansal55@gmail.com,
2730309,NAVYUG SCHOOL NDMC,RAKESH KUMAR,Senior Secondary,31/03/2008,"PESHWA MARG GOLE MARKET NEW DELHI ,110001","11 ,23347236",npsh.ss@ndmcmail.gov.in,
2730608,"NAVYUG SCHOOL, MANDIR MARG, NEW DELHI-110001",DINESH KUMAR,Senior Secondary,31/03/2024,"NAVYUG SCHOOL, MANDIR MARG, ,110001","011 ,23366022",nmdr.ss@ndmcmail.gov.in,www.ndmc.gov.in
2730163,NEO CONVENT SCHOOL,KUSHAL DEEP KAUR,Senior Secondary,31/03/2023,"G 17 AREA PASCHIM VIHAR, DISTT WEST DELHI, NEW DELHI ,110063","011 ,25364343",rajjugsingh@gmail.com,
2730211,NEW DELHI PUBLIC SCHOOL,MRS. SANKALITA MODGILL,Senior Secondary,31/03/2025,"A-BLOCK - VIKAS PURI, DISTT WEST DELHI, NEW DELHI ,110018","011 ,01149404314",ndpsonline@yahoo.co.in,WWW.NDPSEDU.COM
2730047,NEW ERA PUBLIC SCHOOL,VANDANA CHAWLA,Senior Secondary,31/03/2024,"H-17 MAYAPURI ROAD MAYAPURI, DISTT WEST DELHI, NEW DELHI ,110064","011 ,25494277",vchawla12@gmail.com,
2730514,NEW SARASWATI PUBLIC SEC SCHOOL,SUNITA PARASHAR,Secondary School,31/03/2024,"NANGLOI EXTENSION NO 2 DELHI ,110041","011 ,25949073",SUNITA.PARASHAR87@GMAIL.COM,http://www.kunilschool.co
2730516,NEW SHALIMAR PUBLIC SCHOOL,NEETU DUGGAL,Secondary School,31/03/2024,"B M BLOCK PASCHIMI SHALIMAR BAGH DELHI ,110052","011 ,27481393",nduggal2000@hotmail.com,
2730808,NIRVAN ROOPAM MODERN SCHOOL,MR. VIRAT RAJPUT,Senior Secondary,31/03/2024,"A/26, TILAK ENCLAVE, MOHAN GARDEN, NEW DELHI - 110059 ,110059","3655 ,7289099730",nirvanroopammodernschool@gmail.com,www.nirvanroopammodernschoo.com
2730276,NORTH DELHI PUBLIC SCHOOL,SHIVANI VERMA,Senior Secondary,31/03/2023,"SHALIMAR BAGH DELHI ,110052","011 ,27470448",shambhushivani@gmail.com,
2730655,NORTH-EX PUBLIC SCHOOL,RAKHI SACHDEVA,Senior Secondary,31/03/2026,"SCHOOL BLOCK,JAIN NAGAR, ROHINI,DELHI ,110085","011 ,27582529",nxj@northexschool.com,
2778023,NUTAN MARATHI SR SEC SCHOOL,SHUBHADA BAPAT,Senior Secondary,31/03/2025,"PAHARGANJ NEW DELHI ,110055","011 ,23615889",BAPAT.SHUBHADA60@GMAIL.COM,
2730102,NUTAN VIDYA MANDIR SR SEC SCHOOL,MR. GUNENDRA KUMAR MISHRA,Senior Secondary,31/03/2023,"G T B ENCLAVE NAND NAGRI DILSHAD GARDEN, DISTT NORTH EAST DELHI, DELHI ,110093","011 ,22123608,25576486",nutanvidyamandirsr.sec.school@gmail.com,
2730501,OSCAR PUBLIC SCHOOL,SUNITA KANT,Senior Secondary,31/03/2026,"SWROOP NAGAR ROAD BURARI DELHI ,110084","011 ,9971473470",oscarsch1997@gmail.com,
2730080,OXFORD SR SEC SCHOOL,KOKILA PRABHAKAR,Senior Secondary,31/03/2023,"E BLOCK VIKASPURI, DISTT WEST DELHI, NEW DELHI ,110018","011 ,45546666",oxfordschoolvp@gmail.com,
2778067,P & T SR SEC. SCHOOL,SHAIL VERMA,Senior Secondary,31/03/2024,"ATUL GROVE ROAD NEW DELHI ,110001","011 ,23753599",vermashail21@gmail.com,
2730551,P D MODEL SECONDARY SCHOOL,Madhu Devi,Senior Secondary,31/03/2023,"88, PASCHIMI FRIENDS ENCLAVE SECTOR-6, SULTANPURI ROAD, ,110041","011 ,69999918",PDMS59@YMAIL.COM,
2776011,P G D A V SR SEC SCHOOL,JAWAHAR LAL SHARMA,Senior Secondary,31/03/2018,"WEST PATEL NAGAR NEW DELHI ,110008","011 ,25882031",pgdav08@yahoo.co.in,
2730449,P S M PUBLIC SCHOOL,RENU CHAUDHARY,Senior Secondary,31/03/2022,"PRATAP VIHAR KIRARI EXTENSION NANGLOI, DISTT WEST DELHI, DELHI ,110041","011 ,65455868",renuchaudhary73@yahoo.com,
2730855,P.S.M WORLD SCHOOL,MISS USHA SEHRAWAT,Secondary School,31/03/2024,"F1/147,KH.NO.-615,AMAN VIHAR, KIRARI, SULEMAN NAGAR ,110086",",08700810348",psmworld12@gmail.com,www.psmworldschool.com
2730838,PARAG JYOTI PUBLIC SCHOOL,MRS. CHANDRAMANI,Secondary School,31/03/2023,"KHASRA NO. 86-87/9/1, SHIV VIHAR (OPP. DESU OFFICE) KARALA, DELHI-110081 ,110081",",9968230791",paragschool321@gmail.com,
2730776,PARKASH BHARTI PUBLIC SCHOOL,Mrs.Sunita Tokas,Secondary School,31/03/2025,"ST BLOCK, PREM NAGAR - II, DURGA MANDIR ROAD, NEAR KIRARI NEHAR, ,110086",",9213333338",nkmahajanfca@gmail.com,
2730720,PERFECT PUBLIC SCHOOL,PRABHJOT KAUR,Senior Secondary,31/03/2025,"LD BLOCK, OPP METRO PILLAR NUMBER 333, PITAM PURA ,110034","011 ,45161066",info@ppischool.com,http://www.ppischool.com/
2730606,PIONEER CONVENT SCHOOL,SEEMA BAJAJ,Senior Secondary,31/03/2024,"LOK NAYAK PURAM BAKKARWALA NEW DELHI ,110041","011 ,28341408",pioneerconvent@gmail.com,
2730422,PIONEER KAMAL CONVENT,SAVITA WASON,Secondary School,31/03/2022,"VIKAS VIHAR VIKAS NAGAR HASTSAL NEW DELHI ,110059","011 ,25376192",pioneerkamalconvent@gmail.com,
2730064,PRABHU DAYAL PUBLIC SCHOOL,Dr. Anita Aggarwal,Senior Secondary,31/03/2023,"BLOCK-A DAKSHINI SHALIMAR BAGH DELHI ,110052","011 ,27489789",anagwal@gmail.com,http:/www.pdpschool.com
2730557,PRAG BHARTI MODEL SCHOOL,MS. SUNITA,Secondary School,31/03/2015,"VEENA ENCLAVE NANGLOI, WEST DELHI ,110041","011 ,5182578",dldavpp@hotmail.com,http://www.dldavpp.com
2750116,PRATIBHA VIKAS VIDYALAYA,SARITA BATRA,Senior Secondary,31/03/2021,"BT BLOCK SHALIMAR BAGH DELHI ,110088","011 ,27483136",rpvv1309124@gmail.com,
2750117,PRATIBHA VIKAS VIDYALAYA,SANJEEV KUMAR,Senior Secondary,31/03/2019,"NAI BASTI KISHAN GANJ DELHI ,110040","011 ,23695836",skrpvv@gmail.com,
2730061,PRESENTATION CONVENT SR SEC SCHOOL,JYOTI THOMAS,Senior Secondary,31/03/2023,"S P MUKHERJI MARG DELHI ,110006","011 ,23862862",office@pcsdelhi.in,www.pcsdelhi.in
