Affiliation Number,Name,Head/Principal Name,Status,Affiliated unto,Address,Phone no.,Email,Website
2778036,A R S D SR SEC SCHOOL,PIYUSH CHANDRA,Senior Secondary,31/03/2023,"AJMERI GATE DELHI ,110006","011 ,232375556",arsd2127079@gmail.com,
2778041,A S V J SR SEC SCHOOL,Gajay Singh,Senior Secondary,31/03/2021,"DARYAGANJ NEW DELHI ,110002","011 ,23271636",asvj2127080@yahoo.co.in,
2730847,A-ONE INTERNATIONAL PUBLIC SCHOOL,MRS. REKHA BHATT,Secondary School,31/03/2023,"B-BLOCK, INDER ENCLAVE, PHASE-II, DELHI-110086 ,110086",",9312658395",aoneinternationalpublicschool@gmail.com,
2730494,AADHARSHILA VIDYAPEETH,BYOMAKESH MISHRA,Senior Secondary,31/03/2026,"CD BLOCK PITAM PURA DELHI ,110088","011 ,27316362",avprincipal34@gmail.com,www.aadharshilavidyapeeth.org
2730717,AAKASH INTERNATIONAL SCHOOL,MRS. PRATIBHA GUPTA,Senior Secondary,31/03/2024,"G-2 BLOCK, JAI VIHAR,NANGLOI ROAD, NAJAFGARH ROAD, ,110043",",9958640830",aakashpublicschool@gmail.com,http://www.aakashinternationalschool.co.in
2730439,ABHINAV PUBLIC SCHOOL,RAJESH SHARMA,Secondary School,31/03/2022,"SECTOR 3, ROHINI DELHI ,110085","011 ,27512199",aps.1986@yahoo.co.in,http://www.dpsfamily.org
2730442,ABHINAV PUBLIC SCHOOL,SAROJ,Senior Secondary,31/03/2022,"CU-BLOCK PITAMPURA, DISTT NORTH WEST DELHI, DELHI ,110088","011 ,27344148",aps_2003@yahoo.co.in,
2730790,ADARSH GYAN SAROVER BALIKA VIDYALAYA,MRS. UMA CHATURVEDI,Secondary School,31/03/2025,"ADARSH GYAN SAROVER BALIKA VIDYALAYA, GAMRI,5TH PSUTA GAMRI ,110053",",9990727283",agsbv99@gmail.com,www.agsbv.in
2730603,ADARSH LAKHPAT MODEL SEC SCHOOL,CHIRAG CHAUDHARY,Secondary School,31/03/2022,"E-25, KHAJURI KHASH, DAYAL PUR ROAD, ,110094","011 ,22963999",adarshlakhpat2001@gmail.com,
2730119,ADARSH PUBLIC SCHOOL,Mrs. Pooja Malhotra,Senior Secondary,31/03/2024,"C-BLOCK VIKAS PURI, DISTT WEST DELHI, NEW DELHI ,110018","011 ,28543300, 28544400",adarshpublicschool@hotmail.com,
2776017,ADARSH SEC SCHOOL,SADHNA BHARDWAJ,Secondary School,31/03/2021,"D-BLOCK VIKAS PURI NEW DELHI ,110018","011 ,28537799",jha.ranjan@yahoo.com,
2770010,ADARSH SR SEC SCHOOL,RAMPATI,Senior Secondary,31/03/2025,"G T RAOD LIBASPUR DELHI ,110042","011 ,27835110",adarshssschoollibaspur42@gmail.com,
2730737,ADRIEL HIGH SCHOOL,POONAM LEEKHA,Senior Secondary,31/03/2026,"POCKET2 SECTOR24 ROHINI ,110085","011 ,27933377",principal.adrielhigh@gmail.com,http://www.adrielhighschool.in
2778047,AKALI BABA PHOOLA SINGH KHALSA,SUNITA JAIN,Senior Secondary,31/03/2021,"SR SEC SCHOOL RAJINDER NAGAR NEW DELHI ,110060","011 ,25868382",ABPS_KHALSASSS@REDIFFMAIL.COM,
2730475,AKASH MODEL SCHOOL,MRS. GEETA RANI,Senior Secondary,31/03/2024,"BALJEET VIHAR, NITHARI EXTN., DELHI-110086 ,110086","011 ,9811088324",akashschoolrana@gmail.com,http://www.akashmodelschool.in
2772012,ALOK PUNJ SEC SCHOOL,NARESH PAL,Secondary School,31/03/2016,"KARAWAL NAGAR DELHI ,110094","011 ,22934565",npal1961@gmail.com,
2776013,ANDHRA EDN SOCIETY SR SEC SCHOOL,E ANITHA,Senior Secondary,31/03/2021,"B3 BLOCK JANAKPURI NEW DELHI ,110058","011 ,25595488",aesjp2006@yahoo.co.in,
2778055,ANDHRA EDU SOCIETY SR SEC SCHOOL,B DHANA LAKSHMI,Senior Secondary,31/03/2022,"PRASAD NAGAR NEW DELHI ,110005","011 ,05723372",principalaesprasadnagar@gmail.com,
2778034,"ANDHRA EDUCATION SOCIETY,",K DURGA,Senior Secondary,31/03/2023,"DR. DURGABAI DESHMUKH MEMORIAL SR. SEC. SCHOOL, DDU MARG, ROUSE AVENUE, NEW DELHI-110 002 ,110002","011 ,23238497",kandukuridurga@yahoo.com,
2730668,ANGLO ARABIC MODEL SCHOOL,FARAH SAJID,Secondary School,31/03/2024,"AJMERI GATE, DELHI.2 ,110006","011 ,23210863",aams96@gmail.com,
2778035,ANGLO ARABIC SR SEC SCHOOL,FAZLE ALAM,Senior Secondary,31/03/2021,"AJMERI GATE DELHI ,110006",",2522714",ssdps_nn@yahoo.in,
2730184,APEX PUBLIC SCHOOL,DEREK RICHARD BRENDISH,Senior Secondary,31/03/2022,"APEX AVENUE SANT NAGAR (BURARI), DISTT NORTH DELHI, DELHI ,110009","011 ,27617750",derekbrendish@gmail.com,http://www.prashantigurukulam.org
2730259,APPEJAY SCHOOL,DILIP KUMAR BEDI,Senior Secondary,31/03/2022,"SAINIK VIHAR ROAD NO 42 PITAM PURA, DISTT NORTH WEST DELHI, DELHI ,110034","011 ,27022140",principalbedi@gmail.com,
2730424,ARISTOTALE PUBLIC SCHOOL,Radha Bhardwaj,Senior Secondary,31/03/2026,"QUTAB GARH MAIN BUS STAND QUTAB GARH DELHI ,110039","011 ,27741529",kdbhardwaj.school@gmail.com,
2730438,ARUN MODERN PUBLIC SCHOOL,MRS JYOTI RANI,Senior Secondary,31/03/2025,"D-1 MAIN ROAD BRIJ PURI, DISTT NORTH EAST DELHI, DELHI ,110094","011 ,22567874",shashisms@gmail.com,
2730224,ARVIND GUPTA D A V CENTENARY PUBLIC SCHOOL,MALA SOOD,Senior Secondary,31/03/2024,"MODEL TOWN BEHIND POLICE HQTS DELHI ,110009","011 ,27455245",principal@agdav.edu.in,
2788007,ARYA GIRLS SR SEC SCHOOL,Ms. Namita Arora,Senior Secondary,31/03/2025,"TELIWARA DELHI ,110006","011 ,23614670",asha.chhabra1234@gmail.com,
2788034,ARYA GIRLS SR SEC SCHOOL,RAJ KUMARI,Senior Secondary,31/03/2024,"RAHGARPURA KAROL BAGH NEW DELHI ,110005","011 ,25818412",agsss8078@gmail.com,
2788011,ARYA SAMAJ GIRLS SR SEC SCHOOL,ARCHANA AGGARWAL,Senior Secondary,31/03/2021,"CHAWRI BAZAR DELHI ,110006","011 ,23268046",id_2127083@yahoo.co.in,
2778030,ATAL ADARSH BAL VIDYALYA,Narender Kumar Kataria,Senior Secondary,31/03/2025,"MANDIR MARG NEW DELHI ,110001","011 ,23363629",srisolu62@gmail.com,
2788021,ATAL ADARSH BALIKA VIDYALYA,MUKTA SINGH,Senior Secondary,31/03/2025,"GOLE MARKET NEW DELHI ,110001","011 ,23743701",,
2788022,ATAL ADARSH BENGALI BALIKA VIDYALAYA,JAYA SREE BASU,Senior Secondary,31/03/2025,"GOLE MARKET NEW DELHI-110001 ,110001","011 ,23744090",,
2778070,ATAL ADARSH VIDYALYA,DINESH KUMAR TANWAR,Secondary School,31/03/2022,"SANGLI MESS, NEW DELHI ,110001","011 ,23383403",tanwar.dinesh1966@gmail.com,
2778069,ATAL ADARSH VIDYALYA,BISHUN RAM,Secondary School,31/03/2022,"BABAR ROAD NEW DELHI ,110001","011 ,23358337",ndmc.secschbbrrd@gmail.com,
2788044,ATAL ADARSH VIDYALYA,SURESH CHANDRA,Senior Secondary,31/03/2024,"HAVLOCK SQUARE NEW DELHI ,110001","011 ,23366714",sureshmeena965@gmail.com,
2788040,ATAL ADARSH VIDYALYA,SHYAM SUNDER,Secondary School,31/03/2021,"BALMIKI BASTI, NEW DELHI ,110001","011 ,23367030",blk.m@ndmcmail.gov.in,
2778045,ATAL ADARSH VIDYALYA,NAVIN CHANDRA JOSHI,Senior Secondary,31/03/2022,"TILAK MARG NEW DELHI ,110001","011 ,23382635",tlk.s@ndmcmail.gov.in,
2730353,AUROBINDO PUBLIC SCHOOL,ms janak mehra,Secondary School,31/03/2024,"BUDH VIHAR DELHI ,110041",",27916608",,
2788016,B D ARYA GIRLS SR SEC SCHOOL,NAVITA MANGLA,Senior Secondary,31/03/2023,"BAZAR SITA RAM DELHI ,110006","011 ,23231602",navita_mangla@yahoo.co.in,
2730441,B M BHARTI MODEL SCHOOL,MRS. NEETA KUMARI,Senior Secondary,31/03/2026,"VILLAGE MAJRI PO KARALA DELHI ,110081","011 ,25950500,",nkmahajanfca@gmail.com,
2788001,B M GANGE GIRLS SR SEC SCHOOL,MEENAKSHI MERCY PHILIP,Senior Secondary,31/03/2024,"21 RAJ NIWAS MARG DELHI ,110054","011 ,23968664",62meenakshi@gmail.com,
2788037,B N RASTOGI GIRLS SR SEC SCHOOL,kshem rustgi,Senior Secondary,31/03/2018,"BHAGIRATH PALACE DELHI ,110006","011 ,22966497",,
2788003,B P JAIPURIA GIRLS SR SEC SCHOOL,PREM HANDOO,Senior Secondary,31/03/2019,"25 RAJPUR ROAD DELHI ,110054","011 ,22522812",,
2730491,B R PUBLIC SCHOOL,MRS. NIRMAL YADAV,Secondary School,31/03/2024,"EXT 2 C NANGLOI NEW DELHI ,110041","011 ,2547062,",jaincomputerwala@gmail.com,http://www.brps.in
2730286,B R TYAGI PUBLIC SCHOOL,MAYA TYAGI,Senior Secondary,31/03/2025,"PHASE-II SECTOR 24, BUDH VIHAR DELHI ,110086","0 ,27535949",mayatyagi2@gmail.com,
2730425,B V M MODEL SCHOOL,KANTA DEVI,Senior Secondary,31/03/2025,"B 245 RAJIV NAGAR BEGUMPUR, DISTT NORTH WEST DELHI, DELHI ,110041","011 ,27582741",principlebvmschool@gmail.com,
2730851,B.R. INTERNATIONAL SCHOOL,MRS. NATASHA CHAUDHARY,Senior Secondary,31/03/2024,"MAIN QUTABGARH ROAD, MUNGESHPUR, DELHI - 110039 ,110039",",9811755706",brinternationalschool2016@gmail.com,www.brisdelhi.in
2730772,B.S. INTERNATIONAL SCHOOL,MRS. ANITA SHOKEEN,Senior Secondary,31/03/2022,"PLOT NO. 26, DALIP VIHAR, NILOTHI EXTN., DELHI - 110041 ,110041",",9811120850,",nkmahajanfca@gmail.com,
2730658,B.S.M. PUBLIC SCHOOL,Neetu,Senior Secondary,31/03/2026,"BALJIT VIHAR, NITHARI EXTN., NANGLOI, ,110041","0128 ,01125475436",nkmahajanca@yahoo.co.in,
2760009,BABA NANNE NATH GOVT SARVODAYA KANYA,MEENAKSHI KOHLI,Senior Secondary,31/03/2025,"VIDYALAYA KHERA KALAN DELHI ,110082","011 ,27843014",bnn1310039skv@gmail.com,http://www.kdispilkhuwa.com
2768036,BABA RAM DEV GOVT. SARVODAYA GIRLS,RANJU AILAWADI,Senior Secondary,31/03/2021,"SR SEC. SCHOOL PRASAD NAGAR NEW DELHI ,110005","011 ,25713700",brdskvprasadnagar212@gmail.com,
2778026,BABA SAHEB AMBEDKAR SEC SCHOOL,RAJBAR SINGH BHANDARI,Secondary School,31/03/2024,"RANI JHANSI ROAD NEW DELHI ,110055","011 ,23531925",Rajbar67@gmail.com,
2730045,BAL BHARATI PUBLIC SCHOOL,L V SEHGAL,Senior Secondary,31/03/2019,"SIR GANGARAM HOSPITAL MARG RAJINDER NAGAR NEW DELHI ,110060","011 ,25786897",lvsehgal@hotmail.com,bbpsgr@hotmail.com
2730162,BAL BHARATI PUBLIC SCHOOL,MEENU GOSWAMI,Senior Secondary,31/03/2024,"PITAMPURA, DISTT NORTH WEST DELHI, DELHI ,110034","011 ,27028600",ppbbps@hotmail.com,http://www.xyx.com
2730282,BAL BHARTI PUB SCHOOL,GEETA GANGWANI,Senior Secondary,31/03/2023,"SECTOR 14 ROHINI DELHI ,110085","011 ,27554563",geeta29nov@yahoo.com,
2730418,BAL VIDYA MANDIR MODEL SCHOOL,SH BHOOP SINGH,Secondary School,31/03/2022,"POOTH KALAN NEAR ROHINI SECTOR 20 DELHI ,110041","0121 ,25185938",,
2730677,BAL VIDYA MODEL SCHOOL,MRS. SAVITA,Senior Secondary,31/03/2024,"B-247, LAXMI PARK, NANGLOI ,110041","05943 ,9811230325",bvss8857@gmail.com,
2730148,BANASTHALI PUBLIC  SCHOOL,KM INDU PRIYA DARSHANI,Senior Secondary,31/03/2025,"H-1/149 VIKASPURI, DISTT WEST DELHI, NEW DELHI ,110018","011 ,25590912",apsdc@indiatimes.com,http://apsdelhicantt.org
2788008,BANSIDHAR MEMORIAL GIRLS SR SEC SCH,Kusum Lata,Senior Secondary,31/03/2018,"PAHARI DHIRAJ DELHI ,110006","011 ,23550247",Kusumlata87569@gmail.com,
2778056,BAPU ADARSH SEC VIDYALAYA,MRS ASHA KADAM,Secondary School,31/03/2023,"R BLOCK NEW RAJINDER NAGAR NEW DELHI ,110060","011 ,28745471",bapuadarshindia@gmail.com,
2778003,BENGALI SR SEC SCHOOL,RAMA MAZUMDER,Senior Secondary,31/03/2020,"22-A ALIPUR ROAD DELHI ,110054","011 ,23967864",rama.mazumder452@gmail.com,
2730849,BHAGAT INTERNATIONAL SCHOOL,MRS. KAVITA,Secondary School,31/03/2023,"KH. NO. 26/8, MOHAMAD PUR MAJRI, RAMA VIHAR, DELHI, 110081 ,110081",",9999099052",bhagat.intlschool@gmail.com,http://www.bhagatinternationalschool.com
2730472,BHAGATI JI MEMORIAL MODEL SCHOOL,JAI PRAKASH,Secondary School,31/03/2023,"34/8/1 YAMUNA ROAD PALLA DELHI ,110036","011 ,27722130",bmms.principal@gmail.com,
2776010,BHAI BIBA SINGH KHALSA SR SEC SCH,I P Kaur,Senior Secondary,31/03/2022,"MOTI NAGAR NEW DELHI ,110015","011 ,9899337276",princibbskhalsa@gmail.com,
2786003,BHAI JOGA SINGH KH GIRLS SR SEC SCH,ANITA GUJRAL,Senior Secondary,31/03/2022,"EAST PATEL NAGAR NEW DELHI ,110008","011 ,25883297",anitagujral1961@gmail.com,
2730145,BHAI JOGA SINGH PUBLIC SCHOOL,Harinder Pal Singh,Senior Secondary,31/03/2024,"D 4 FAIZ ROAD KAROL BAGH, DISTT CENTRAL DELHI, NEW DELHI ,110005","011 ,23611058",harinder183@yahoo.com,
2730293,BHARAT MATA SARASWATI BAL MANDIR,SHARDA DIXIT,Senior Secondary,31/03/2025,"BAWANA ROAD NARELA DELHI ,110040","011 ,27285165",naresh04061975@gmail.com,
2730011,BHARATIYA VIDYA BHAVAN'S MEHTA,Anju Tandon,Senior Secondary,31/03/2024,"VIDYALAYA KASTURBA GANDHI MARG NEW DELHI ,110001","011 ,23384881",principal@bvbmehtavidyalaya.org,airfcebalbharatischool.com
2730659,BHARDWAJ MODEL SCHOOL,NEERU SHARMA,Secondary School,31/03/2024,"RZ-Q-88, NIHAL VIHAR, NORTH WEST DELHI ,110041","011 ,65164123",bhardwajmodelschool88@gmail.com,
2730694,BHARTI VIDYA NIKETAN PUBLIC SCHOOL,mrs.jyoti kiran,Senior Secondary,31/03/2022,"A-26, RANJEET VIHAR, CHANDER VIHAR, ,110041","0884 ,01132584022",nkmahajanfca@gmail.com,
2730711,BHATNAGAR INTERNATIONAL SCHOOL,Vina Sharma,Senior Secondary,31/03/2023,"BHERA ENCLAVE, PASCHIM VIHAR, ,110087","011 ,25262188",vinasharma26@yahoo.in,
2752012,BHISHAM PITAMAH GOVT. SARVODAYA BOYS,PRAMOD KUMAR,Senior Secondary,31/03/2023,"S S S B BLOCK NAND NAGRI DELHI ,110093","011 ,22575804",,
2788041,BIRLA ARYA GIRLS SR SEC SCHOOL,SUNITA KHURANA,Senior Secondary,31/03/2021,"BIRLA LINES KAMLA NAGAR DELHI ,110007","011 ,23840219",bagssskamlanagar1207135@gmail.com,
2778063,BIRLA SR SEC SCHOOL,R D GUPTA,Senior Secondary,31/03/2025,"KAMLA NAGAR (BIRLA LINES) DELHI ,110007",",27281546",,
2730444,BLOOMING DALES PUBLIC SCHOOL,URMILA DEVI,Secondary School,31/03/2022,"RAJENDRA PARK NEAR LOKESH CINEMA NANGLOI DELHI ,110041","011 ,65456504",bloomingdalespublicschool@yahoo.co.in,
2730174,BOSCO PUBLIC SCHOOL,SUJATA CHAWDHRY,Senior Secondary,31/03/2023,"SUNDER VIHAR PASCHIM VIHAR NEW DELHI ,110041","011 ,25284343",principal@boscopublicschool.com,
2730450,BRAHMA SHAKTI PUBLIC SCHOOL,GITA DEVI,Senior Secondary,31/03/2024,"BHARAT VIHAR BEGUMPUR DELHI ,110041","011 ,65556664",brahmashaktipublicschool2012@gmail.com,
2730582,BRAIN INTERNATIONAL SCHOOL,SEEMA BEHL,Senior Secondary,31/03/2024,"H BLOCK VIKAS PURI, WEST DELHI ,110018","011 ,28544328",behl_seema50@hotmail.com,
2730565,BRILLIANT'S CONVENT,Reeta Hashia,Senior Secondary,31/03/2024,"WEST ENCLAVE, PITAMPURA, DELHI-110034 ,110034","011 ,27028625",reetahashia_bcs@rediffmail.com,
2730535,BSM PUBLIC SCHOOL,RENU MATHUR,Senior Secondary,31/03/2026,"SULTAN PUR ROAD, ,110081","011 ,65257211",bsmpublicschool.karala@gmail.com,http://www.chinmayamission.g
2730763,BUDS PARADSE SCHOOL,Mr.RAJIV KUMAR DUBEY,Secondary School,31/03/2024,"135/7/2, PUSTA ROAD, SANT NAGAR, BURARI, DELHI-110084 ,110084",",8860601789",onlinebps@gmail.com,
2788002,BUTLER MEMORIAL GIRLS SR SEC SCHOOL,Dhiraj Khan    School Incharge,Senior Secondary,31/03/2013,"17 BOULEVERD ROAD DELHI ,110054","011 ,23968530",dhirajkhan10@gmail.com,
2778027,C L BHALLA D A V SR SEC SCHOOL,ARUN ARYA,Senior Secondary,31/03/2023,"JHANDEWALAN NEW DELHI ,110005","011 ,23546022",clbdav23@yahoo.com,
2730250,C L BHALLA DAYANAND MODEL SCHOOL,SHARDA RANI,Senior Secondary,31/03/2024,"PLOT NO 7 JHANDEWALAN, DISTT CENTRAL DELHI, NEW DELHI ,110005","011 ,23527644",sharda.oberoi1811@gmail.com,
2730164,C R P F PUBLIC SCHOOL,NIDHI CHAUDHARY,Senior Secondary,31/03/2025,"SECTOR XIV ROHINI, DISTT NORTH WEST DELHI, DELHI ,110085","011 ,27562305",nidhichaudhary14@gmail.com,
2730576,C R SAINI PUBLIC SCHOOL,-,Senior Secondary,31/03/2022,"E-BLOCK, LAXMI PARK, SAINI VIHAR, NANGLOI, DISTT WEST DELHI, DELHI-41 ,110041","0161 ,4132622662",rodhemsell@yahoo.com,http://www.auroville.org.in
2762001,C.R.DASS GOVT.SARVODAYA GIRLS,SHASHI KANTA DASS,Senior Secondary,31/03/2023,"SR SEC SCHOOL NEW SEELAMPUR DELHI ,110053","011 ,22172528",kishwer.jahan1@gmail.com,
2762035,C.RAJAGOPALACHARI GOVT.,SUDHIR BHUSAN TRIPATHI ,Senior Secondary,31/03/2022,"SARVODAYA G.S.S.SCH. NO 2 GHONDA DELHI ,110053","011 ,22565874",sbtripathi1958@gmail.com,
2730051,CAMBRIDGE FOUNDATION SR SEC SCHOOL,ANITA PURI,Senior Secondary,31/03/2024,"G-8 AREA RAJOURI GARDEN EXTN NEW DELHI ,110027","011 ,41001113",principal@cambridgefoundationschool.in,
2730556,CANTERBURY PUBLIC SCHOOL,ms. usha mudgan,Secondary School,31/03/2025,"B- BLOCK, YAMUNA VIHAR, DELHI ,110053","011 ,22917165",stjoseph_eng08@rediffmail.com,
2730832,CENTRAL ACADEMY INTERNATIONAL SCHOOL,Mrs. Garima Pandey,Secondary School,31/03/2023,"SECTOR 10 DWARKA OPPOSITE METRO LINE, NEW DELHI 11007 ,110075",",01140072828",ca_affiliation@rediffmail.com,http://www.centralacademyschools.org
2730329,CH JASWANT LAL PUBLIC SCHOOL,SMT KIRAN,Secondary School,31/03/2020,"13/77 PUNJABI BAGH NEW DELHI ,110026",",25430914",nhps_np@yahoo.co.in,http://www.newhizonps.com
2750114,CH. BANWARI LAL GOVT. SARVODAYA,SUMAN SHARMA,Senior Secondary,31/03/2023,"CO-EDN SCHOOL WAZIR PUR VILLAGE DELHI ,110052","011 ,27215661",1411035.sv@gmail.com,
2730672,CHAND RAM PUBLIC SR. SEC. SCHOOL,AMBIKA SHARMA,Senior Secondary,31/03/2026,"NANGAL THAKRAN DELHI -39 ,110039","011 ,27751912",CRPSSCHOOL@GMAIL.COM,
2730660,CHHOTU RAM PUBLIC SCHOOL,MR. HARENDER KUMAR YADAV,Senior Secondary,31/03/2024,"OPP BANK OF INDIA MAIN ROAD BAKHTAWARPUR DELHI --36 ,110036","011 ,011-27722507,",crpsdelhi@yahoo.com,http://www.crpsdelhi.in
2730114,CHOWGULE PUBLIC SCHOOL,POOJA SALPEKR,Senior Secondary,31/03/2023,"D-4 FAIZ ROAD KAROL BAGH, DISTT CENTRAL DELHI, NEW DELHI ,110005","011 ,23522370",pooja.salpekar@gmail.com,
2730778,CIAT CONVENT SCHOOL,MRS. ANITA KUMARI,Secondary School,31/03/2025,"VPO KANJHAWALA ,110081",",9953050866",ciatschool1998@gmail.com,www.ciatschool.com
2730290,CITIZEN MODEL  SCHOOL,SUNILA RANI,Senior Secondary,31/03/2025,"PHASE 2 BUDH VIHAR DELHI ,110041","011 ,27532221",sunilarani201@gmail.com,http://www.sduirs.com
2730536,CM MODEL SCHOOL,SUDHA TRIPATHI,Senior Secondary,31/03/2022,"J-1, VISHWA NATH MANDIR, BUDH VIHAR, PHASE I, DELHI ,110041","011 ,27532619",reply_cmms@yahoo.co.in,
2730169,COLUMBIA FOUNDATION SR SEC SCHOOL,DEEPSHIKHA DANDU,Senior Secondary,31/03/2023,"D BLOCK CREATIVITY NAGAR VIKAS PURI, DISTT WEST DELHI, NEW DELHI ,110018","011 ,45660811",vdeepshikha@gmail.com,http://www.sgrrsrinagar.com
2778040,COMMERICAL SR SEC SCHOOL,Pradeep Kumar,Senior Secondary,31/03/2021,"24 DARYAGANJ NEW DELHI ,110002","011 ,23271235",commercial.school2127086@yahoo.com,
2730012,CONVENT OF JESUS & MARY SCHOOL,JANET,Senior Secondary,31/03/2019,"BANGLA SAHIB MARG NEW DELHI ,110001","011 ,23747061",srjanetrjm@gmail.com,airfcebalbharatischool.com
2730196,CRESCENT PUBLIC SCHOOL,MR. SUNIL MAINI,Senior Secondary,31/03/2024,"D BLOCK SARASWATI VIHAR PITAMPURA DELHI ,110034","011 ,27016688,",crescentpublicschool@gmail.com,http://www.crescentpublicschool.in
2730218,D A V PUBLIC SCHOOL,RAJBIR KAUR,Senior Secondary,31/03/2023,"SECTOR VII ROHINI, DISTT NORTH WEST DELHI, DELHI ,110085","011 ,27043298",xsrajbirkaur@gmail.com,
2730260,D A V PUBLIC SCHOOL,Rashmi Raj Biswal,Senior Secondary,31/03/2024,"PUSHPANJALI ENCLAVE PITAM PURA, DISTT NORHT WEST DELHI, DELHI ,110034","011 ,27018261",davpushpanjali1989@gmail.com,www.davpushpanjali.com
2770002,D A V SENIOR SECONDARY SCHOOL,DR N S YADAV,Senior Secondary,31/03/2024,"SAMAIPUR BADLI, DISTT NORTH WEST DELHI, DELHI-110042 ,110042","011 ,27292733",,
2778024,D A V SR SEC SCHOOL,Satyavir Singh,Senior Secondary,31/03/2022,"CHITRAGUPTA ROAD NEW DELHI ,110055","011 ,23625209",davssscgr@yahoo.co.in,
2778006,D C M BOYS SR SEC SCHOOL,SHIV CHARAN SINGH,Senior Secondary,31/03/2021,"KISHAN GANJ DELHI ,110006","011 ,23615513",dcmschool@gmail.com,
2788004,D C M GIRLS SR SEC SCHOOL,SHAKUNTLA RANI,Senior Secondary,31/03/2021,"KISHAN GANJ DELHI ,110006","011 ,23619919",dcmgirls1234@yahoo.in,
2778050,D I KHAN BHARATRI SABHA SR SEC SCH,REKHA RANA,Senior Secondary,31/03/2022,"NEW RAJINDER NAGAR NEW DELHI ,110060","011 ,28743172",rekharana67@yahoo.co.in,
2730420,D S MEMORIAL PUBLIC SCHOOL,REKHA YADAV,Senior Secondary,31/03/2022,"EXTN 2-C, NANGLOI,DISTT WEST DELHI, DELHI ,110041","011 ,25947411",rao.aadi@yahoo.co.in,
2730455,D S SAINIK MODEL SCHOOL,ASHA RANI DABAS,Secondary School,31/03/2022,"SWARN PARK MUNDKA DELHI ,110041","011 ,64599977",OP_LAKRA_SCHOOL@YAHOO.CO.IN,matha_school@yahoo.com
2778051,D T E A SR SEC SCHOOL,CHITRA VASAGAM,Senior Secondary,31/03/2022,"PUSA ROAD NEW DELHI ,110005","011 ,25818581",chitrav1961@gmail.com,
2778031,D T E A SR SEC SCHOOL,GAYATHRI V K,Senior Secondary,31/03/2022,"MANDIR MARG NEW DELHI ,110001","011 ,23363114",gayathrinew2011@gmail.com,
2730521,D V PUBLIC SCHOOL,Poonam Singh,Senior Secondary,31/03/2024,"F 205, PHASE I VIJAY NAGAR ROHINI DELHI ,110085","011 ,27044360",dvpublicschool89@gmail.com,
2730842,D. K. CONVENT SCHOOL,MRS. BHARTI JOSHI,Secondary School,31/03/2023,"B-BLOCK, GALI NO. 110, SANT NAGAR, BURARI, DELHI-110084 ,110084",",9871401476",dkconventschool@yahoo.com,http://www.dkconventschool.com
2730602,D.A.V.CENTENARY PUBLIC SCHOOL,BIMLESH JHA,Senior Secondary,31/03/2022,"D.A.V.CENTENARY PUBLIC SCHOOL, SECTOR B-4,POCKET-5,DDA PROJECT NARELA DELHI ,110040","011 ,27784139",bjha.dav@gmail.com,
2730651,DAFFODIL PUBLIC SCHOOL,R P TYAGI,Senior Secondary,31/03/2026,"PREM COLONY, BAWANA ROAD, NARELA DELHI-110040 ,110040","011 ,65179836",rptyagi92122@gmail.com,http://daffodilpublicschool.in/
2730117,DARBARI LAL D A V MODEL SCHOOL,REENA RAJPAL,Senior Secondary,31/03/2018,"BN BLOCK SHALIMAR BAGH DELHI ,110052","011 ,27473634",reenarajpal@rediffmail.com,http://www.dldavsb.org
2730116,DARBARI LAL D A V MODEL SR.SEC SCH,ANITA WADEHRA,Senior Secondary,31/03/2023,"ND BLOCK VISHAKHA ENCLAVE PITAMPURA DELHI ,110034","011 ,47568800",anitawadehra8@gmail.com,http://www.dldavpp.com
2730364,DARSHAN ACADEMY,A DAVID,Senior Secondary,31/03/2022,"KIRPAL BAGH SANT KIRPAL SINGH MARG, DISTT NORTH WEST DELHI, DELHI ,110009","011 ,27465800",principal.delhi@darshanacademy.org,www.thegurukul.in
2778013,DAU DAYAL ARYA VEDIC SR SEC SCHOOL,BHASKER DUTT DWIVEDI,Senior Secondary,31/03/2025,"NAYA BANS DELHI ,110006","011 ,23991235",daudayal.1928@gmail.com,
2730292,DAV PUBLIC SCHOOL,Kusum Bhardwaj,Senior Secondary,31/03/2023,"ASHOK VIHAR PHASE IV DELHI ,110052","011 ,47510805",kusumbhardwaj123@yahoo.com,http://davashokvhr.com
2730542,DAV PUBLIC SCHOOL,DEVIKA DUTT,Secondary School,31/03/2025,"KHERA KHURD ,110082","011 ,27844245",devi_ratan9@yahoo.com,
2730478,DAVID MODEL SECONDARY SCHOOL,VINAY CHAUDHARY,Senior Secondary,31/03/2024,"MAIN ROAD TUKHMIRPUR, DISTT NORTH EAST DELHI, DELHI ,110094","011 ,22969090",davidschool2007@yahoo.com,
2788020,DAYANAND MODEL GIRLS SR SEC SCHOOL,INDU KHURANA,Senior Secondary,31/03/2018,"MANDIR MARG NEW DELHI ,110001","011 ,23363725",khuranaindu34@gmail.com,
2730712,DE INDIAN PUBLIC SCHOOL,SEEMA AWASTHI,Senior Secondary,31/03/2023,"POCKET-11, SECTOR-24, ROHINI ,110085","011 ,27050252",seema.awasthi1@gmail.com,http://www.dipsrohini.in
2730500,DECENT PUBLIC SCHOOL,renu gupta,Senior Secondary,31/03/2024,"H 34 SECT 3 ROHINI DELHI ,110085","011 ,27511089",decentpublicschool@gmail.com,
2730787,DEEP MODERN PUBLIC SCHOOL,Mrs.KAVITA RANI,Secondary School,31/03/2025,"PLOT NO. 67, VILLAGE KIRARI SULEMAN NAGAR, ,110041",",9212526773",deepmodern1412164@gmail.com,
2730392,DEEPANSHU PUBLIC SCHOOL,Anil Kumar,Senior Secondary,31/03/2022,"KAMERDIN NAGAR NANGLOI DELHI ,110041","011 ,25941630",yanil86@ymail.com,
2730297,DELHI CITY SCHOOL,MOHIT SHARMA,Senior Secondary,31/03/2022,"POCKET C-8, SECTOR-8, ROHINI, DELHI-110085 ,110085","011 ,64726418",info@rajarammohanroyschool.com,
2730770,DELHI HERITAGE SCHOOL,MRS. VIBHA GUPTA,Senior Secondary,31/03/2022,"G-111,112 RAJIV NAGAR, MAIN KANJHAWALA ROAD, OPP. SEC-22, ROHINI ,110085","011 ,09667003235",delhiheritageschool@gmail.com,
2730578,DELHI INTERNATIONAL PUBLIC SCHOOL,MADHU KANSAL,Senior Secondary,31/03/2021,"SECTOR-9 ROHINI ,110085","011 ,27864050",madhukansal@yahoo.com,http://dipsrohini.co.in
2730595,DELHI INTERNATIONAL SCHOOL, Kusum lata,Secondary School,31/03/2022,"MAIN LONI ROAD JAWAHAR NAGAR, JOHRIPUR , WEST DELHI ,110007","011 ,8459103400",diss.jn@gmail.com,
2730773,DELHI INTERNATIONAL SCHOOL,MRS. PRIYANKA  BARARA,Senior Secondary,31/03/2022,"POCKET B 5 SECTOR 3 ROHINI ,110085",",011-27521015,",principal.rohini@dis.ac.in,http://www.dis.ac.in/rohini
2750173,DELHI POLICE PUBLIC SCHOOL,TARUNIMA ROY,Senior Secondary,31/03/2020,"NEW POLICE LINES, KINGSWAY CAMP, DELHI- 110 009 ,","011 ,27418517",roy.tarunima@rediffmail.com,
2730303,DELHI PUBLIC SCHOOL,VIBHA SINGH,Senior Secondary,31/03/2026,"SECTOR 24 PHASE III ROHINI NEW DELHI ,110085","011 ,27055742",principal@dpsrohini.com,http://www.dpsrohini.com
2778002,DELHI UNITED CHRISTIAN SR SEC SCHOOL,DARWIN PERSHAD,Senior Secondary,31/03/2025,"17 RAJ NIWAS MARG DELHI ,110054","011 ,23967401",nibeditapershad@gmail.com,
2730777,DEVENDRA PUBLIC SCHOOL,MRS. ADITYA SHARMA,Secondary School,31/03/2025,"Z-105, NARAYAN VIHAR, PREM NAGAR-II, KIRARI SULEMAN NAGAR ,110086","011 ,7428295673",devendrapublicschool@yahoo.com,devendrapublicschool.in
2770007,DHANPATMAL VIRMANI SR SEC SCHOOL,DHARAM BIR SINGH,Senior Secondary,31/03/2020,"ROOP NAGAR DELHI ,110007","011 ,23840224",dmvsssroopnagar1207139@gmail.com,
2730553,DHARAMDEEP PUBLIC SCHOOL,SUMAN RATHI,Secondary School,31/03/2025,"J-BLOCK, ADHAYAPAK NAGAR, NAZAFGARH ROAD NANGLOI, DELHI ,110041","011 ,25945989",dharamdeepsecpublic@yahoo.com,
2730221,DIVINE HAPPY SCHOOL,NEELAM BHAIRO,Senior Secondary,31/03/2023,"A-2 PASCHIM VIHAR, DISTT WEST DELHI, NEW DELHI ,110063","011 ,25265200",neelam.bhairo1@gmail.com,
2730132,DOON PUBLIC SCHOOL,AANIEETAA VAISSNAVA,Senior Secondary,31/03/2024,"B-2 PASCHIM VIHAR NEW DELHI ,110063","011 ,25268686",aanieetaa.vaissnava@gmail.com,
2772013,DR ZAKIR HUSAIN MEMIAL SR SEC SCH,DR MOHD MAROOF KHAN,Senior Secondary,31/03/2024,"JAFARABAD DELHI ,110053","011 ,22198465",schoolmmk@gmail.com,alokbhartischool@yahoo.co
2730269,DR.S.R.S MISSION SCHOOL,JYOTI KAPOOR,Senior Secondary,31/03/2025,"B-1 JANAK PURI NEW DELHI ,110058","011 ,41570769",info@srsmissionschool.com,
2776004,DTEA SR SEC SCHOOL,RAJI KAMALASANAN,Senior Secondary,31/03/2022,"B-1 BLOCK JANAKPURI NEW DELHI ,110058","011 ,25506487",rajikamalasanan@gmail.com,
2730822,EDUCATION POINT CONVENT SCHOOL,MR. VIPUL TYAGI,Secondary School,31/03/2022,"PLOT NO 3-4 VIKAS NAGAR SOM BAZAR ROAD NEW DELHI 110059 ,110059",",9891582025",epcschool.3@yahoo.com,http://www.xyz.com
2730845,ELITE INTERNATIONAL SCHOOL,MR. NAVIN KUMAR,Secondary School,31/03/2024,"2ND PUSTA SONIA VIHAR, NEW DELHI - 110094 ,110094",",9871725573",vasuvats1969@gmail.com,http://eliteinternationalschool.org/
2730673,FAIR CHILD PUBLIC SCHOOL,MRS. HIMANI GARG,Senior Secondary,31/03/2024,"B-3/365, 33 FOOTA ROAD, HARSH VIHAR, SHAHDARA ,110093","011 ,08510008061",fairchildpublicschool@rediffmail.com,http://www.fairchildpublicschool.in
2730054,FAITH ACADEMY,M KANNAN,Senior Secondary,31/03/2024,"JOHN L, DORSEY ROAD, PRASAD NAGAR NEW DELHI ,110005","0 ,25715784",mkanm2002@yahoo.co.in,
2778061,FATEHPURI MUSLIM SR SEC SCHOOL,FAIYAZ MEER KHAN,Senior Secondary,31/03/2021,"FATEHPURI DELHI ,110006","011 ,23951853",,
