Affiliation Number,Name,Head/Principal Name,Status,Affiliated unto,Address,Phone no.,Email,Website
2132566,MAP PUBLIC SCHOOL,MR. RAHUL TIWARI,Senior Secondary,31/03/2022,"VILLAGE-GOPALPUR BIRAICHA, POST-HATA, DISTRICT-KUSHINAGAR, UP-274 203 ,274203","0000 ,9453204625,",princmappublicschool@gmail.com,http://www.mappublicschool.com
2130012,MARIAMPUR SR SEC SCHOOL,SONIA VARGHESE,Senior Secondary,31/03/2024,"SHASTRI NAGAR KANPUR UTTAR PRADESH ,208005","0512 ,2216638",principalmariampurschoolkanpur@yahoo.com,
2133695,MARTINS CHILDREN SCHOOL,MRS. RUCHI RANDHAR UPADHYAY,Secondary School,31/03/2024,"BHAWARKOL, GHAZIPUR, U.P. ,233231",",0000000",martinschildrenacademygzp@gmail.com,www.martinschildrenacademy.com
2133090,MATA MULARI DEVI BALA PURVA MADHYAMIK VIDYALAYA,MR. KAMLESH SINGH YADAV,Senior Secondary,31/03/2024,"GHOGHAWA, RAMPUR, SAIDPUR, GHAZIPUR ,233221",",9839370625",cbse.mmdbpmv@gmail.com,http://www.matamdbpmv.com
2132932,MERRY CITY SCHOOL & HOSTEL,MRS. NEELAM RAI,Senior Secondary,31/03/2022,"BHU BYPASS ROAD, NARAYANPUR, DAFI ,221011",",05422570313,",mcsvns@gmail.com,http://www.marrycityschool.com
2133500,MILLENNIUM  EDUCATIONAL ACADEMY,MRS. NARMADA SINGH,Secondary School,31/03/2024,"VILL./POST,BHELSAR TEHSIL-RUDAULI, DISTT-AYODHYA, U.P. 224116 ,224116",",8090622117",info.meducational@gmail.com,WWW.MEACADEMY.COM
2132997,MIRZAPUR LIONS PUBLIC SCHOOL,MRS. SMITA TAILANG,Senior Secondary,31/03/2023,"BHUJWA KI CHAWKI, REWA ROAD, MIRZAPUR ,231001",",05445245066",lionspublics@gmail.com,www.mirzapurlionspublicschool.org
2132239,MIS INTERNATIONAL SCHOOL,MR. GANESH PRASAD GUPTA,Senior Secondary,31/03/2023,"DEOKALI, FAIZABAD ,224001","0527 ,05278241333",misschool241333@gmail.com,www.misinternationalschool.cm
2132148,MIZPAH CHRISTIAN SCHOOL,Susheela Pachauri,Senior Secondary,31/03/2026,"JHANSI ROAD,ORAI ,285001","5162 ,252032",schoolmizpah@gmail.com,
2131844,"MJRP ACADEMY,",Uday Shankar Yadav,Senior Secondary,31/03/2025,"VILL + POST- TIWARIPUR, MOHAMMDABAD GHAZIPUR ,233227","0542 ,9415890085",mjrpacademy1@gmail.com,
2131592,ML CONVENT SCHOOL,Syed Afsar,Senior Secondary,31/03/2024,"BHITARA, ORAI ROAD ,285123","5168 ,222155",principalmlc2009@gmail.com,http://www.mlic.co.in
2131058,MMD PUBLIC SCHOOL,Ajay Kumar Singh,Senior Secondary,31/03/2024,"SASANA, BAHADURPUR, BELTHARA ROAD,BALLIA, ,221715","5491 ,245559",principalmmdps1@gmail.com,
2131429,"MODERN ACADEMY,NAUTANWA",BHALENDU SHUKLA,Senior Secondary,31/03/2022,"BY-PASS ROAD,NAUTANWA-MAHRAJGANJ ,273164","0552 ,235682",vksjitesh@gmail.com,
2130498,MODERN CONVENT SCHOOL,NIDHI JAISWAL,Secondary School,31/03/2025,"SECTOR 8 OBRA DISTT SONBHADRA UTTAR PRADESH ,227101","0544 ,5262218",nidhi.appu07@gmail.com,http://www.rampusgkp.org
2131930,MODERN ERA HIGHER SECONDARY SCHOOL,SIMA YADAV,Senior Secondary,31/03/2025,"JIYANPUR ,276140","0546 ,230131",morderneraintercolle@gmail.com,
2130906,MODERN PUBLIC SCHOOL,Shanthi Vishwanathan,Senior Secondary,31/03/2022,"KANPUR ROAD, JHANSI ,284001","0510 ,2472472",mpsjhs@gmail.com,
2132728,MODERN PUBLIC SCHOOL,MR. ANKIT PANDEY,Senior Secondary,31/03/2022,"VILL.-BHADULI, PO.-MOHAMMDALLA, AZAMGARH,U.P.-276001. ,276001","0546 ,9415834900,",modernps2014@gmail.com,http://www.mpsazamgarh.in
2133391,MODERN WINGS PUBLIC SCHOOL,MRS. PRIZZA RAI,Senior Secondary,31/03/2024,"VILL- KOPA, PO.- PATARAHI, JAUNPUR ,222129",",9005454777",anilkyadav777@gmail.com,http://modernwingsps.com/
2132034,MONTFORT INTER COLLEGE,JOY THOMAS,Senior Secondary,31/03/2023,"MAHANAGAR SADAR LUCKNOW UP ,226006","0522 ,2321362",joythomas2000@rediffmail.com,http://www.montfortlucknow.org
2132836,MOON INTERNATIONAL PUBLIC SCHOOL,MR. JITENDRA JAISWAL,Senior Secondary,31/03/2024,"NH-25, VILL. JARHA KHURD - BHUJOND ,284303","91 ,9956136910",70714@cbseshiksha.in,WWW.MOONINTERNATIONALPUBLICSCHOOL.COM
2133076,MOON STAR ENGLISH SCHOOL,MRS. YASMIN BEGUM,Senior Secondary,31/03/2023,"MUIRPUR SONEBHADRA U.P. ,231208",",9918589934",moonstarmyr@gmail.com,www.moonstarenglishschool.in
2130764,MORNING STAR CHILDREN'S ACADEMY,RAJNEESH SINGH,Senior Secondary,31/03/2022,"KARMIR ROAD ORAI DISTT JALAUN UP ,285001","5162 ,251242",principalms@mscagroup.com,
2132309,MORNING STAR SR. SEC. ACADEMY,KUSUM SINGH,Secondary School,31/03/2024,"OFFICERS COLONY JALAUN ROAD ORAI ,285001","5162 ,258241",principalmsg@mscagroup.com,http://www.msgi.org.in
2131515,MOTHER AYESHA CHILDREN ACADEMY,NILOFAR SALMAN,Senior Secondary,31/03/2024,"JAMIA NAGAR, SIPAH RAILWAY CROSSING, JAUNPUR ,222001","5452 ,264982",salmannilofar@rediffmail.com,http://www.islamicwelfaresociety.com
2133087,MOTHER GEETA INTERNATIONAL SCHOOL,Mr.Sanjay Kumar Tripathi,Secondary School,31/03/2026,"MOTHER GEETA INTERNATIONAL SCHOOL,MOTHER GEETA INTERNATIONAL SCHOOL,,A/22O H.A.L KORWA AMETHI ,SULTANPUR ,UTTAR PRADESH ,227412 ,227405",",05452265141",jaiswalankit123@rediffmail.com,
2130409,MOTHER HALEEMA PUB SCHOOL,SHAKIL AHMAD ANSARI,Senior Secondary,31/03/2023,"PO BHADOHI DISTT. SANT RAVIDAS NAGAR BHADOI UTTAR PRADESH ,221401","5414 ,224145",mhpsbdh@yahoo.co.in,www.motherhaleema.com
2131715,MOTHER LAND PUBLIC SCHOOL,Vanisha Khanna,Senior Secondary,31/03/2025,"BIRBHANPUR, MOHANSARAI, VARANASI ,221311","0542 ,2632040",vanisha.khanna@gmail.com,
2133154,MOTHER MARIAM GLOBAL SCHOOL,MR. VINAY SINGH,Senior Secondary,31/03/2024,"KHARHARWA,KOLHUI,MAHARAJGANJ,UTTAR PRADESH ,233001",",8400698208",sameer.adhami@gmail.com,http://mmgs.net.in/
2131134,MOTHER SITA PUBLIC SCHOOL,VIBHA TALWAR,Senior Secondary,31/03/2025,"SARANDHRA NAGAR, HANSARI ,284001","0510 ,2473231",vibhatalwar72@gmail.com,
2133234,MOTHER SUHAG EDUCATION CENTRE,MR. SHAILESH SINGH,Secondary School,31/03/2022,"HAZIPUR CHHITA, KNOWLEDGE PARK SULTAN NAGAR ,212601",",9565654444",msecftp@gmail.com,http://www.msecftp.com
2133578,MOTHER TERESA PUBLIC SCHOOL,MR. SANDEEP KR. SINGH,Secondary School,31/03/2023,"REMA ROAD,GODHANA, MANOHARPUR MUGHALSARAI, CHANDAULI, U.P. ,232101",",9305289731",motherterasaps2013@gmail.com,
2133397,MOUNT CARMEL INTERNATIONAL SCHOOL,MRS. NEELAM SINGH,Senior Secondary,31/03/2023,"PIPRA JATAMPUR KUBERSTAN, PADRAUNA KUSHINAGAR ,274303",",9936330433",Mountcarmelis2019@gmail.com,www.mciskushinagar.com
2133309,MOUNT LEARNER ACADEMY,Mr. SHEELENDRA KUMAR SINGH,Secondary School,31/03/2022,"BAJRANGNAGAR, DOBHI JAUNPUR ,222148",",0",anusingh41276@gmail.com,http://www.mountlearner.com
2131535,MOUNT LITERA ZEE SCHOOL,Pankaj Sharma,Senior Secondary,31/03/2023,"SAI CITY, UDAYPURA, FARRUKHABAD ROAD (NH-92), ETAWAH (U.P.) ,206001","0568 ,8215776",principalmlzsetawah@gmail.com,http://www.zeeschooletawah.com
2131573,MOUNT LITERA ZEE SCHOOL,Mathura Prasad Pandey,Senior Secondary,31/03/2023,"VILL. RUDRAPUR, KUSMHI BAZAR, GORAKHPUR-273002 ,273002","0551 ,2230063",zeeschoolgorakhpur@gmail.com,www.emountlitera.com
2133455,MOUNT LITERA ZEE SCHOOL,.,Senior Secondary,31/03/2023,"ELDECO-2, SANSKRITI-4, RAKSHA KHAND, RAEBAREILY ROAD, LUCKNOW UTTAR PRADESH,LUCKNOW , 226014 ,",",9415106117",,
2131446,MOUNT LITERA ZEE SCHOOL,VINCENT STUART,Senior Secondary,31/03/2023,"TUBE WELL ROAD KHATIBABA, JHANSI ,284003","0510 ,2483553",V.STUART125@GMAIL.COM,
2133178,MOUNT LITERA ZEE SCHOOL,MRS. APARNA SANJAY,Senior Secondary,31/03/2022,"ROOMA, NH-2, ALLAHABAD HIGHWAY, 5 KM FROM RAMADEVI CHAURAHA) ,209402",",0512",harshit.agarwal@mountlitera.com,http://www.mlzskanpur.com
2133191,MOUNT LITERA ZEE SCHOOL,MRS. PRATIKSHA R. SINGH,Senior Secondary,31/03/2024,"ALLAHABAD ROAD, FATEHGANJ ,222132",",07311171181",principal.jaunpur@mountlitera.com,www.mlzsjaunpur.com
2132328,MOUNT LITERA ZEE SCHOOL,MRS.SUNITA YADAV,Senior Secondary,31/03/2026,"OPP TO SHRI RADHA SWAMI ASHRAM ,209602","0902 ,9026730302",mlzs.farrukhabad@mountlitera.com,http://www.mountlitera.com
2132276,MOUNT LITERA ZEE SCHOOL ALLAHABAD,MR. V.K. SHRIVASTAVA,Senior Secondary,31/03/2026,"255 SHARFUDDINPUR SARAI INAYAT JHUNSI ALLAHABAD ,221505","0532 ,9919191599,",mlzsalld@gmail.com,http://www.zeeschoolallahabad.com
2132274,MOUNT LITERA ZEE SCHOOL GHAZIPUR,DR.RAJESH KARKUN,Senior Secondary,31/03/2026,"BANDHWA,PEERNAGAR ,233001","0548 ,0548-2221511,",principal.ghazipur@mountlitera.com,http://www.zeeschoolghazipur.in
2131619,MOUNT LITERA ZEE SCHOOL UNNAO,SARANA NATHANI,Senior Secondary,31/03/2023,"LUCKNOW HIGHWAY PO SINGRAUSI UNNAO UP ,209801","0515 ,823199",principal.mlzsunnao@gmail.com,http://www.zeeschoolkanpur.com
2131408,MOUNT LITERA ZEE SCHOOL VARANASI,Anjana Deva,Senior Secondary,31/03/2022,"VILLAGE KHUSHIPUR. P.O - BACHHAON, NH 2 (MOHANSARAI BYPASS) ,221011","0542 ,6450333",principal@zeeschoolvaranasi.com,http://www.zeeschoolvaranasi.com
2132712,MOUNTAIN VIEW CITY PUBLIC SCHOOL,MRS. MITA CHATURVEDI,Senior Secondary,31/03/2022,"BANARALIPUR TEHSIL AKBARPUR NH-2 ,209101","0 ,9956790774",mvcpschoolakb@gmail.com,http://www.mvcpschool.com
2131711,MSA EXCELLENCE ACADEMY,MRS. SANGEETA AGRAWAL,Senior Secondary,31/03/2026,"RAJEEV NAGAR NAGRA, JHANSI, ,284003","0510 ,05102310136,",msaexcellenceacademy@gmail.com,
2132487,MSK INTERNATIONAL SCHOOL,MR. SHIV PRASAD,Senior Secondary,31/03/2022,"BAKEWAR ROAD BHARTHANA ,206242",",9412183826,",ppsrajawat24@gmail.com,http://www.mskinternationalschool.com
2131113,MUKULARANYAM ENGLISH SCHOOL,RAGHAW JEE CHATURVEDI,Senior Secondary,31/03/2025,"D 57/32, SIGARA, VARANASI. (U.P) INDIA ,221010","0542 ,2421042",maesvns@gmail.com,
2132154,MUNSHI RAMANAND SINGH (M.R.S.) SCHOOL & COLLEGE,PREETI SINGH,Senior Secondary,31/03/2025,"PATEL NAGAR, JHUNSI, ALLAHABAD, U.P. ,211019","0532 ,2567334",principal@mrsschool.org,
2132927,MYTECH CONVENT SCHOOL,Mr.Musarrat Jahan,Secondary School,31/03/2025,"VILLAGE & POST BHARAULI ,277501",",08795572914",info.mytechschool@gmail.com,
2180050,N E RLY SR SEC SCHOOL,ARUN KUMAR SAXENA,Senior Secondary,31/03/2027,"KAWABAGH COLONY GAKHPUR UTTAR PRADESH ,273001","0551 ,2280385",principalnersss@gmail.com,
2130913,N S CHILDREN ACADEMY,SHASHIKALA SINGH,Senior Secondary,31/03/2023,"NEW COLONY MADOPUR, GORAKHNATH, GORAKHPUR ,273015","0551 ,2257778",rajeev.nsca@gmail.com,
2133564,N. R. S.  INTERNATIONAL SCHOOL,MR. ASHEESH SINGH,Secondary School,31/03/2023,"KOHALA, VISHWANATHGANJ, TEHSIL-SADAR, PRATAPGARH, U.P.-230404 ,230404",",9838502842",nrsispbh@gmail.com,www.nrsinpbh.in
2133059,N.B.S. PUBLIC SCHOOL,Mrs.ANITA SINGH,Secondary School,31/03/2026,"VILL-TRILOKPUR P.O.-BARROW ,230129","1262 ,09721752002",nbskunda@gmail.com,http://www.nbspublicschool.co.in
2180049,N.E RAILWAY BOYS INTER COLLEGE,.,Senior Secondary,31/03/2021,"JATEPUR RAILWAY COLONY GAKHPUR-273012 ,",",",,
2133319,N.S. PUBLIC SCHOOL,MRS. NIVEDITA VISHWAKARMA,Senior Secondary,31/03/2024,"CHHEDIHA, LAL GANJ, BASTI ,272171",",8052241666",nspublicschool2018@gmail.com,http://www.nspsbasti.com/
2133100,NAGAJI SARASWATI VIDYA MANDIR,MR. RAMESH RAI,Senior Secondary,31/03/2024,"AKHANPURA,RASRA,BALLIA ,221712",",9450777932",nagajisvm.rasra@gmail.com,http://www.nagajirasra.com/
2130192,NAGGAJI SARASWATI VIDYA MANDIR,Mr. Arvind Singh Chauhan,Senior Secondary,31/03/2023,"MALDEPUR BALIA UTTAR PRADESH ,277001","5498 ,220510",nagajimaldepurballia@gmail.com,
2130716,NALANDA SHIKSHAN SANSTHAN,MOHTASHIM HAIDER NAQVI,Senior Secondary,31/03/2026,"UDHRANPUR SHAHABAD HARDOI UP ,241124","5853 ,268061",naqvimohtashi@gmail.com,
2132770,NANAK PUBLIC SCHOOL,MR. SUNIL KUMAR SHUKLA,Senior Secondary,31/03/2022,"HARBASPUR, PHOOLPUR (CITY STATION NEXT TO MARIYAHU ROAD) ,222002","5452 ,05452265141,",nanakpublicschool@gmail.com,http://www.nanakpublicschool.in
2132876,NANDI VANI PUBLIC SCHOOL,MR. LALIT K. CHAURASIA,Senior Secondary,31/03/2022,"MANDI SAMITI BHARWARI KAUSHAMBI ,212201",",9235656791,",nandivanips@gmail.com,http://www.nvpschool.in
2131641,NANHKU RAM PUBLIC SCHOOL,VINAY KUMAR PAANDEY,Secondary School,31/03/2022,"PARDIKHURD (PATHAKAGAV) MURILADEEH SONEBHADRA ,231215","0544 ,222755",AMITCHAUBEY7890@GMAIL.COM,
2131355,NARAYAN COLLEGE OF SCIENCE AND ARTS,P N AGNIHOTRI,Senior Secondary,31/03/2022,"ALAMPUR HAUZ, AGRA ROAD, ETAWAH (U.P.) 206002 ,206002","5688 ,250561",premagnihotri@yahoo.com,http://www.narayancollege.com
2131758,NARAYANA PUBLIC SCHOOL,MR. VINOD KUMAR BHATT,Senior Secondary,31/03/2024,"NEAR AVAS VIKAS PHASE III, GONDA, UP, 271002 ,271002","0526 ,05262223000",narayanapublicschool@gmail.com,http://www.schoolnarayana.org
2132499,NARAYANI CHALLENGER CONVENT SCHOOL,MR. RANJIT SINGH,Senior Secondary,31/03/2022,"GANGAPUR, MANGARI, 221202 ,221202",",05422622292",ncconventschool@gmail.com,http://www.ncconventschool.org
2133421,NARENDRA BAHADUR SHAHI SHIKSHA SEWA SANSTHAN,MR. ARUN KUMAR SHAHI,Secondary School,31/03/2023,"JASUI, BHATPAR RANI DISTRICT DEORIA UTTAR PRADESH 274702 ,274702",",9935310011",NBSPUBLIC7071@GMAIL.COM,
2130239,NARENDRA DEVA DAV PUBLIC SCHOOL,O P MISHRA,Senior Secondary,31/03/2023,"NARENDRA DEVA UNIV. OF AGRI & TECH KUMAR GANJ FAIZABAD UTTAR PRADESH ,224229","5270 ,262142",principalop@gmail.com,
2132249,NATIONAL ACADEMY,MR. INDRA NARAYAN TIWARI,Secondary School,31/03/2024,"GAJRAGANJ, MUNGRABADSHAHPUR, JAUNPUR, U.P. ,222202","91 ,9648795253",nationalacademymbp@gmail.com,http://www.yournationalacademy.com
2132752,NATIONAL PUBLIC SCHOOL,DEEPA VERMA,Secondary School,31/03/2025,"224190 ,224190","0527 ,3222356",contact@nationalpublicschool.edu.in,
2133611,NATIONAL PUBLIC SCHOOL,MR. PRABHAT RANJAN TIWARI,Secondary School,31/03/2024,"SALEMPUR ROAD, DEORIA ,274001",",9415281863",npschool.deoria@gmail.com,WWW.NATIONALPUBLICSCHOOL.COM
2133417,NATIONAL PUBLIC SCHOOL,MR. RAM KRISHNA,Secondary School,31/03/2023,"GORABARIK SULTANPUR UP ,228001",",9455244943",nps23122@gmail.com,http://www.npssultanpur.in
2132195,NATIONAL PUBLIC SCHOOL,MR. BINU THOMAS,Senior Secondary,31/03/2023,"KM 32 LUCKNOW KURSI MEHMOODABAD ROAD, NINDURA, BARABANKI ,225302","0091 ,05222501765",zaidkidwai@gmail.com,http://www.npsbarabanki.com
2133359,NAV JEEVAN MISSION INTERNATIONAL SCHOOL,MR. BINU KR,Secondary School,31/03/2023,"MEDICAL COLLEGE ROAD, GULARIYA, GORAKHPUR ,273158",",7275724211",navjeevaninternational3@gmail.com,http://www.navjeevaninternationalschool.com/
2132348,NAV JEEVAN MISSION SCHOOL,MR. SHAJI LOUIS,Senior Secondary,31/03/2022,"SONAULI ROAD, ANANDNAGAR ,273155","91 ,8127025451",navjeevananandnagar@gmail.com,
2130499,NAV JEEVAN MISSION SCHOOL,Cyril Costa,Senior Secondary,31/03/2023,"NAVJEEVAN NAGAR SAPAHA ROAD KASIA KUSHINAGAR UTTAR PRADESH ,274402","0 ,9198269162",cyrilcosta.m@gmail.com,
2131639,NAV JEEVAN MISSION SCHOOL,M V Rajan,Senior Secondary,31/03/2023,"ASHISHNAGAR SALEMPUR ROAD DEORIA ,274001","0000 ,9889471995",rajan211974@gmail.com,
2131653,NAV VANI SCHOOL,FR RONALD DSOUZA,Secondary School,31/03/2021,"KOIRAJPUR, HARHUA, VARANASI ,221105","0542 ,9793603755",frronald@hotmail.com,
2130869,NAVAL'S NATIONAL ACADEMY,SUJOY BISWAS,Senior Secondary,31/03/2024,"KUSHMI GORAKHPUR UTTAR PRADESH ,273001","0551 ,2345969",sujoy.arpit@gmail.com,
2130536,NAVALS NATIONAL ACADEMY,MR. AJIT DIXIT,Senior Secondary,31/03/2025,"RAPTI NAGAR GORAKHPUR UTTAR PRADESH ,273001","0551 ,2507019",navalsraptinagar@gmail.com,navalsacademy.org
2131493,"NAVALS NATIONAL ACADEMY,",Ghanshyam Pandey,Senior Secondary,31/03/2022,"SURAJKUND GORAKHPUR ,273015","0551 ,2258690",ghanpandey2@gmail.com,
2130034,NAVAYUGA RADIANCE BILINGUAL SR SEC SCHOOL,Bhupender Singh,Senior Secondary,31/03/2024,"RAJENDRA NAGAR LUCKNOW UTTAR PRADESH ,226004","0522 ,2691413",navayuga.radiance@gmail.com,
2130948,NAVAYUGA RADIANCE SCHOOL,Ms. Amita Mishra,Senior Secondary,31/03/2023,"SECTOR-G, JANKIPURAM, DISTT LUCKNOW, UTTAR PRADESH ,226021","0522 ,4041414",navayuga_jkp@yahoo.com,
2131189,NAVJEEVAN ENGLISH SCHOOL,GRACY JOHN,Senior Secondary,31/03/2026,"BELTHARA ROAD ,221715","0549 ,1245137",gracy270@gmail.com,
2132313,NAVNEET INTERNATIONAL SCHOOL OF SCIENCE,NAVNEET SINGH,Secondary School,31/03/2019,"VILLAGE-BAGHAWAR POST-TAHIRPUR ,276122","0522 ,2754500",rdjs455@hotmail.com,http://nissindia.in
2131141,NAVNEETA KUNWAR PUBLIC SCHOOL,DIWAKAR RAI,Secondary School,31/03/2023,"GANESHPURI, SUSUWAHI, HYDERABAD GATE, B.H.U. VARANASI ,221001","0542 ,2575132",NKPUBLICVNS@GMAIL.COM,
2133297,NAVODAYA BAL NIKETAN,MR. AMIT KUMAR SINGH,Secondary School,31/03/2022,"KOLANA CHUNAR MIRZAPUR ,231304",",7607979336",singhchandresh154@gmail.com,
2131556,NAVODAYA VIDYA MANDIR,PRADEEP KUMAR TIWARI,Senior Secondary,31/03/2023,"RAMIPUR, MEDHA, DISTT JAUNPUR,UTTAR PRADESH ,222125","0 ,9935067957",pradeeptiwari112233@gmail.com,http://www.xyz.com
2133597,NAVYUG INTERNATIONAL PUBLIC  SCHOOL,MR. SANDEEP MISHRA,Senior Secondary,31/03/2024,"BADHAULI, DOSTPUR, SULTANPUR, U.P.-228131 ,228131",",9919332588",navyugips.cbse@gmail.com,www.nyips.in
2133649,NEELDEEP ACADEMY,MRS. KALYANI RAI,Senior Secondary,31/03/2024,"DHERAPUR, KALICHABAD, JAUNPUR (U.P.) ,222001",",0000000",neeldeepacademy@gmail.com,www.neeldeepacademy.org.in
2131931,NEHRU BALODYAN,SANJIV KUMAR MISHRA,Senior Secondary,31/03/2025,"KANHIPUR, MURADGANJ ,222001","5452 ,260899",mishrasanjiv29@gmail.com,http://www.xyz.com
2130909,NETAJEE DEFENCE ACADEMY,INDAL YADAV,Senior Secondary,31/03/2023,"GORAKHPUR, SAINIK VIHAR ,273008","0551 ,9648960557",principal.ndas@gmail.com,
2130850,NEW ANGELS SR SEC SCHOOL,MANJULA KAPOOR,Senior Secondary,31/03/2022,"KATRA ROAD, PRATAPGARH UTTAR PRADESH ,230001","0534 ,220408",principalnewangels@gmail.com,
2131171,NEW CAMBRIDGE SENIOR SECONDARY SCHOOL,SATYA RAI,Senior Secondary,31/03/2026,"SANEECHAR BAZAAR PHOOLPUR (TOWN & POST) AZAMGARH (DISTRICT) UTTAR PRADESH ,276304","5460 ,230272",ncs.cambridge44@gmail.com,
2132969,NEW CENTRAL ACADEMY,Mr.A. R. VERMA,Secondary School,31/03/2026,"DADAUA MAHENIA, BABHNAN, GONDA ,271313",",9450555808",newcentralacademygonda@gmail.com,http://xyz.com
2131921,NEW CENTRAL PUBLIC ACADEMY,POONAM PRASAD,Senior Secondary,31/03/2025,"BELTHARA ROAD, DISTT. BALIA, UP ,221715","5491 ,245115",poonambltr123@gmail.com,
2132091,NEW ERA ACADEMY,MRS. REENA RAHUL SRIVASTAVA,Senior Secondary,31/03/2022,"CHANDIYAMAU, GOMTINAGAR EXTENSION, LUCKNOW ,226010","0000 ,8400004435,",neweraacademy.edu@gmail.com,http://www.neweraacademy.edu.in
2131725,NEW ERA SCHOOL,KIRAN BAJPAI,Senior Secondary,31/03/2024,"A.B. NAGAR, UNNAO, ,209801","0515 ,8127186658",neweraschool2014@gmail.com,http://www.xyz.com
2133269,NEW IDEAL CONVENT SCHOOL,MR. RAJ BAHADUR YADAV,Senior Secondary,31/03/2024,"ITAHARA, MUNGRABADSHSHPUR, JAUNPUR ,222202",",9936276854",nicschool2021@gmail.com,http://www.newidealconventschool.com
2131212,NEW KINGSTON SENIOR SECONDARY SCHOOL,NAMRATA  GRACE PARMAR,Senior Secondary,31/03/2023,"15/486, CHAKERI,PALI ROAD, BEFORE RAILWAY CROSSING KANPUR ,208021","0512 ,9453026547",nkssschool@gmail.com,
2133336,NEW LIGHT EDUCATION CENTRE,Mrs.Alka Shukla,Secondary School,31/03/2023,"MAIDU ROAD, AKBARPUR ,209101",",9935833245",nlec.akbarpur@gmail.com,
2133427,NEW LIGHT NURSERY SCHOOL,MRS. URMILA SINGH,Senior Secondary,31/03/2023,"SIKANDARPUR AMBEDKAR NAGAR U.P. ,224186",",9161945339",newlightacademy9@gmail.com,www.nlns.in
2133052,NEW LUCKNOW PUBLIC SCHOOL,MR. ANURAG SINGH,Secondary School,31/03/2026,"JUGREHLI,4TH KM MILE STONE, BANDA ROAD, BABERU. ,210121",",919559680001",newlucknowpublicschool@gmail.com,http://www.nlps.com
2132532,NEW MODERN CHILDREN SCHOOL,MR. RAKESH SINGH,Senior Secondary,31/03/2022,"VILL. & POST - DULLAHAPUR, DISTRICT - GHAZIPUR - 275202 ,275202",",9450584643,",nmcschool3333@gmail.com,http://www.nmcschool.in
2130860,NEW PUBLIC COLLEGE,DURGA BAJPAI,Senior Secondary,31/03/2022,"SOUTH CITY RAI BARELLY ROAD LUCKNOW UTTAR PRADESH ,226012","0522 ,2443782",npcsouthcity@gmail.com,http://www.lfs.org.in
2133584,NEW R S J PUBLIC SCHOOL,MR. ARUN KUMAR RAHA,Secondary School,31/03/2024,"JAMSHEDPUR-LALAPUR, HANDIA, PRYAGRAJ, U.P. ,221508",",8052885522",skr_advocate@yahoo.co.in,www.newrsj.in
2131041,NEW R.S.J. PUBLIC SCHOOL,SUMAN JAISWAL,Senior Secondary,31/03/2024,"USTAPUR-MAHMOODABAD, CHATNAG ROAD, JHUSI, ALLAHABAD ,211019","0532 ,9235405690",sasjaiswal@gmail.com,
2133088,NEW SHAH FAIZ PUBLIC SCHOOL,Mr.Savaru Lal,Secondary School,31/03/2026,"DILDARNAGAR,NEAR POWER HOUSE, STATION ROAD ,232326",",05497 244213",newshahfaiz@gmail.com,
2133001,NEW STANDARD PUBLIC SCHOOL,MRS. ANITA MAURYA,Senior Secondary,31/03/2023,"VILLAGE- BAGAHA, POST- MATKA, SALON, RAEBARELI ,229127",",05311212700",principalnspss@gmail.com,http://www.nsscindia.org
2132742,NEW STANDARD PUBLIC SCHOOL,SHIV LAKHAN,Senior Secondary,31/03/2025,"TRIPULA ,229316","0535 ,2217400",principalnsps@nsscindia.org,http://www.nsscindia.org
2130168,NEW WAY SCHOOL,Rita Srivastava,Senior Secondary,31/03/2024,"78-B NIRALA NAGAR LUCKNOW UTTAR PRADESH ,226020","0522 ,2745679",nwssc1974@gmail.com,
2132926,NIDHI IDEAL SCHOOL,Mrs.NISHA YADAV,Secondary School,31/03/2025,"JUNGLE TULSIRAM, BICCHIA, GORAKHPUR ,273001",",983938135",kjnidhi13@gmail.com,http://www.nidhiidealschool.com
2131084,NIMISHA CONVENT SCHOOL,KRISHNA KUMAR UPADHYAYA,Senior Secondary,31/03/2026,"MATKA SALON RAI BARELI, UP ,229127","5311 ,212287",kk_upadhyaya@yahoo.co.in,
2133314,NIRMAL JEEVAN PUBLIC SCHOOL,MR. RANJEET KUSHWAHA,Secondary School,31/03/2022,"ATRAUL, INDAULI, BELTHARA ROAD, BALLIA,U.P. ,221715",",7897993351",njpsbltr@gmail.com,http://www.njps.co.in
2130018,NIRMALA CONVENT HIGH SCHOOL,Sr.Alina,Senior Secondary,31/03/2025,"P O RENUKOOT SONEBHADRA DISTT UTTAR PRADESH ,231217","5446 ,252402,9670762672",nirmalarkt14@gmail.com,
2131033,NOBLE SR. SEC. SCHOOL,MOHD MATLOOB KHAN ,Secondary School,31/03/2022,"DEWENTHA ROAD DILDARNAGAR, TEHSIL-ZAMANIA, GAZIPUR ,232326","5497 ,9453382407",25am2k16usia@gmail.com,
2131735,NOORJAHAN CHILDREN SCHOOL,ALMEEN BANO,Senior Secondary,31/03/2024,"VILL-DAUNA, JEHATMANDPUR, LALGANJ, AZAMGARH ,276202","5463 ,225034",qurban66@gmail.com,
2130611,NOORUL HUDA ENG MEDIUM SCHOOL,Afroz Ahemad Khan,Senior Secondary,31/03/2026,"LUCKNOW ROAD FATEHPUR UTTAR PRADESH ,212601","5180 ,210466",noorulhudaschool@hotmail.com,
2180033,NORTH CENTRAL RAILWAY COLLEGE,Mr. P.C.Nayyer,Senior Secondary,31/03/2012,"TUNDLA DISTT FIROZABAD UTTAR PRADESH ,283204","05612 ,229463",ncrcollegetundla@rediffmail.com,
2131382,NURTURE INTERNATIONAL SCHOOL,RITU CHITRANSHI,Senior Secondary,31/03/2017,"SINGHPUR KACHHAR, KALYANPUR BITHOOR ROAD ,208017","0512 ,3277621",rituchitranshi@gmail.com,http://www.nurtureinternational.in
2130376,NYAYA NAGAR PUBLIC SCHOOL,BUSHRA MUSTAFA Acting Principal,Senior Secondary,31/03/2024,"GANGA ENCLAVE JHUNSI ALLAHABAD UTTAR PRADESH ,141001","0532 ,9335525666",bmustafa227@gmail.com,http://www.alpineints.com
2133255,O GROVE CHILDRENS ACADEMY,MR. VIKAS CHAND MISHRA,Secondary School,31/03/2022,"BETABER BACHHAW ,201011",",07703008206",devialb@gmail.com,http://www.xyz.com
2131006,OASIS PUBLIC SCHOOL,KARMSHEEL DUTTA TRIPATHI,Senior Secondary,31/03/2024,"ALUADDINPUR, BANKAT (NAWADA) ,221107","0542 ,2255819",anandoasis@gmail.com,http://www.xyz.com
2133027,OM PUBLIC SCHOOL,MR. MOHD AKHTAR SIDDIQUI,Senior Secondary,31/03/2024,"VILL- PHIROJPUR PO- JAMUPATTI, BADLAPUR, JAUNPUR ,222125",",9918538291",opschoolphirojpur@gmail.com,http://www.ompublicschool.in
2132541,OM PUBLIC SCHOOL,MR. SUNIL DUTTA TRIPATHI,Senior Secondary,31/03/2022,"OM PUBLIC SCHOOL,BITTHALPUR,(CHATTAMI) ,221303","5414 ,9559465039",ompublicschool13@gmail.com,http://www.ompublicschoolgopiganj.com
2132952,OMEGA PUBLIC SCHOOL,DR. JITESH KUMAR SINGH,Senior Secondary,31/03/2023,"VILL-CHHATIDIH POST-KUTIR CHAKKEY DIST-JAUNPUR PIN-222146 ,222136","0 ,9616286405",omegapublicschool@gmail.com,http://www.omegapublicschool.in/
2132718,OMNI INTERNATIONAL SCHOOL,MR. MUKESH KUMAR GUPTA,Senior Secondary,31/03/2022,"SANSARPUR, POST- GANDHI NAGAR, FUTAHIYA, BASTI ,272001",",9918199514",omnischoolbasti@rediffmail.com,http://www.omniinternationalschool.com
2132671,ONGC COMMUNITY SCHOOL,MR. DANISH KHAN,Senior Secondary,31/03/2022,"VILLAGE PAINTALA, NEAR RANIFARM, LAHERPUR, ,261135",",8009244441,",ongc.school@yahoo.com,http://www.ongcschool.com
2133219,ORCHID INTERNATIONAL SCHOOL,MRS. SEEMA GIRI,Secondary School,31/03/2022,"B-37/164 K, GIRI NAGAR,BIRDOPUR,VARANASI,U.P.-221010 ,221010",",9956855384",orchidinternationalschoolvns@gmail.com,
2131791,ORIENTAL INSTITUTE SENIOR SECONDARY SCHOOL,ANITA TIWARI,Senior Secondary,31/03/2024,"AMETHI KHORA RAM ROAD DEORIA ,274001","91 ,9235463797",anitamani25@gmail.com,
2130417,OXFORD MODEL SENIOR SECONDARY SCHOOL,RAKHI SINGH,Senior Secondary,31/03/2025,"SHYAM NAGAR KANPUR UTTAR PRADESH ,208013","0512 ,9044064013",contact@oxfordmodelknp.org,
2131831,OXFORD MODEL SENIOR SECONDARY SCHOOL,VANDANA GAUR,Senior Secondary,31/03/2025,"MAHARAJPUR, KANPUR NAGAR, ,209402","0512 ,2724032",vandana.pvns@gmail.com,http://www.xyz.com
2133067,OXFORD PUBLIC SCHOOL,MR. RAMANUJ YADAV,Senior Secondary,31/03/2024,"PHOOLPUR, ,221005",",9506151601",ops18052014@gmail.com,http://www.oxfordschool.org.in
2130440,OXFORD PUBLIC SCHOOL,JHUMPA MAL,Senior Secondary,31/03/2026,"MORORKHREE SAMPURNANAGAR LAKHIMPUR KHERI UTTAR PRADESH ,262904","5871 ,222560",oxford_spng@yahoo.co.in,
2130944,OXFORD PUBLIC SCHOOL,GIRISH CHANDRA MISHRA,Senior Secondary,31/03/2024,"NEAR TARA MANDAL ROAD, KAJAKPUR, SADAR, GORAKHPUR ,273001","0551 ,2324527",gcmishra100@gmail.com,
2132995,P R INTERNATIONAL SCHOOL,Mr.B. S. Sharma,Secondary School,31/03/2021,"KARIMUDDINPUR ,233225",",9839122330",printernationalschool@gmail.com,
2133031,P. D. PUBLIC SCHOOL,DR. ABHAY TRIPATHI,Senior Secondary,31/03/2023,"MANIRAM, SADAR, GORAKHPUR ,273007",",09838363668",pdpublicschool.mgkp@gmail.com,www.pdpublicschool.edu.in
2133424,P. N. CENTRAL ACADEMY,MRS. SMITA KHARE,Secondary School,31/03/2023,"MAHUADEEH, SAIDABAD, PRAYAGRAJ, U.P.-221508 ,221508",",9793404694",pncentralacademy47@gmail.com,www.pncentralacademy.com
2131621,P.D. ACADEMY,MANOJ KUMAR JAISWAL,Senior Secondary,31/03/2023,"C.C. ROAD, KATARARI MOUR, DEORIA, U.P ,274001","5568 ,228120",pdacademy@ymail.com,
2131500,P.G.SENIOR SECONDARY SCHOOL,Sangita Singh,Senior Secondary,31/03/2023,"CAPTAINGANJ KUSHINAGAR UTTAR PRADESH ,274301","5567 ,252718",sangitasinghpg@gmail.com,
2133497,P.H. INTERNATIONAL PUBLIC SCHOOL,MRS. ANJU GUPTA,Secondary School,31/03/2024,"KUSHAL DEHIYA, URUA BAZAR, GORAKHPUR ,273407",",7045017220",info.phips@gmail.com,http://phinternational.in/
