Affiliation Number,Name,Head/Principal Name,Status,Affiliated unto,Address,Phone no.,Email,Website
2131044,SANSKRITI PUBLIC SCHOOL,MRS. SHILPEE GUPTA,Senior Secondary,31/03/2024,"RANIDIHA,NEAR DIVYA NAGAR,DEORIA ROAD,POST-KHORABAR, GORAKHPUR ,273010","0551 ,05512270673",sanskritips.gkp@gmail.com,http://www.spsgkp.com
2132669,SANSKRITI SANSKAR PUBLIC SCHOOL,RAJESH PATHAK,Secondary School,31/03/2025,"GANESH BNAGH,INFRONT OF JHARNA,FOOTERA BARUASAGAR,JHANSI. ,284201","0510 ,2735031",pathakrajesh1972@gmail.com,http://www.sspsjhs.com
2130841,SANT ATULANAND RESIDENTIAL ACADEMY,Jagdish Pandey,Senior Secondary,31/03/2022,"VILL HOLAPUR PERMANAND PUR SHIVPUR VARANASI UTTAR PRADESH ,221002","0542 ,2284108",atulanandacademy@gmail.com,http://www.dpsfamily.org
2132072,SANT CHATURBHUJ SHIKSHA NIKETAN (GURUKUL),SHARDA TRIPATHI,Secondary School,31/03/2023,"VILL- RAMJANPUR, PO- SIKANDARPUR (KARANDA), DIST- GHAZIPUR ,233224","0548 ,2901416",gurukul.scsn@gmail.com,
2131398,SANT GURUPAD SAMBHAV RAM ACADEMY,MRS. SHILPI SINGH,Senior Secondary,31/03/2026,"32/48, UMARPUR, HARIBANDHANPUR, CITY STATION, JAUNPUR ,222002","5452 ,05452222849",gsra99@gmail.com,www.sgsracademy.com
2132407,SANT KAMLA CHILDREN SENIOR SECONDARY SCHOOL,PIYUSH TRIPATHI,Senior Secondary,31/03/2021,"VILL AND POST JAHANGIRGANJ AMBEDKARNAGAR ,224147","0527 ,2274259",tpiyush6@gmail.com,
2131174,SANT KEENARAM PUBLIC SCHOOL,R P MAURYA,Senior Secondary,31/03/2025,"LOHRI, ROBERTSGANJ, SONEBHADRA ,231216","91 ,9415257925",santoshrbj95@gmail.com,
2130176,SANT PATHIK VIDYALAYA,pooja agarwal,Senior Secondary,31/03/2024,"PASHUPATI NAGAR BAHRAICH UTTAR PRADESH ,271801","2551 ,227314",spvbrh@gmail.com,www.pisagra.com
2132358,SANT RAM NARAYAN SHANKAR SHIV PUBLIC SCHOOL,MR. DILIP KUMAR SINGH,Senior Secondary,31/03/2026,"BARUIN, ZAMANIA ,232331","5497 ,05497252107,",senss2015@gmail.com,
2131783,SANT RANJEET SINGH MEMORIAL ACADEMY,MR. KULVEER SINGH,Senior Secondary,31/03/2022,"VILL & POST AGGAR KHURD(BASAHI) ,261506","0587 ,05872225125",srsma01@gmail.com,http://www.srsmacademy.com
2131553,SANT TULSI PUBLIC SCHOOL,AKANKSHA BARANWAL,Senior Secondary,31/03/2026,"INDIRA PARK,INDIRA NAGAR ,210001","5192 ,221692",akanksha.guddi@gmail.com,
2132792,SAPIEN SCHOOL,MRS. SANJU TIWARI,Senior Secondary,31/03/2023,"OFF GAURIGANJ ROAD, RAIPUR PHULWARI (SOUTH) ,227405",",9889177940",sapienschoolamt@gmail.com,www.sapienschool.co.in
2133425,SARASWATI BALIKA VIDYA MANDIR SECTOR I JANKIPURAM LKO,MRS. SUDHA TIWARI,Secondary School,31/03/2023,"SECTOR I JANKIPURAM LKO ,226021",",09415246297",saraswatibalika.jankipuram@gmail.com,
2131686,SARASWATI BALIKA VIDYALAY,DR SAROJ TIWARI,Senior Secondary,31/03/2024,"SURYAKUND, GORAKHPUR SADAR, ,273015","0551 ,2257438",sbvsurajkund@gmail.com,
2130143,SARASWATI SENIOR SECONDARY VIDYA MANDIR,ARVIND SINGH CHAUHAN,Senior Secondary,31/03/2025,"DEORIA KHAS DEORIA UTTAR PRADESH ,274001","5568 ,223928",chauhansingh1967@gamil.com,http://www.rampusgkp.org
2133634,SARASWATI SHIKSHA MANDIR GRAM BHARTI,MR. GULAB SHANKAR TIWARI,Senior Secondary,31/03/2024,"PARTOSH, DHAMMAUR, AMETHI ,227408",",0000000000",jsskp2014@gmail.com,www.saraswatishikshamandirgrambharti.com
2132370,SARASWATI SHISHU MANDIR PAKKIBAG GORAKHPUR,MR.RAMESH RAI,Senior Secondary,31/03/2026,"ARYA NAGAR ,273001","0551 ,0551-2242660,",ssm.pakkibag1952@gmail.com,http://www.ssmpakkibag.com
2130340,SARASWATI SHISHU MANDIR PURV MADHYAMIK VIDYALAYA,ARVIND SINGH,Senior Secondary,31/03/2019,"RAMBAGH, BASTI UP-272 001 ,272001","5542 ,282716",svmrbbasti@rediffmail.com,
2130071,SARASWATI SHISHU MANDIR SENIOR SECONDARY SCHOOL,RAJ BIHARI VISHWAKARMA,Senior Secondary,31/03/2025,"SURYAKUND GORAKHPUR UTTAR PRADESH ,273015","0551 ,2256168",ssmvmvsuryakundgkp@gmail.com,
2130108,SARASWATI VIDYA MANDIR HR SEC SCHOOL,HAREY RAM PANDEY,Senior Secondary,31/03/2023,"SECTOR-Q ALIGANJ LUCKNOW UTTAR PRADESH ,226024","0522 ,2746211",SVMLKO@REDIFFMAIL.COM,
2132645,SARASWATI VIDYA MANDIR INTER COLLEGE,GOPAL DHAWAN,Senior Secondary,31/03/2025,"DEFENCE COLONY, JAJMAU ,208010","0512 ,24050165",gopaldhawansvmic@gmail.com,
2132772,SARASWATI VIDYA MANDIR PUBLIC SCHOOL (SVM PUBLIC SCHOOL),MRS. GARIMA UPADHYAY,Senior Secondary,31/03/2022,"CHIUTAHA, MANIRAM, JUNGLE KAURIYA ,273007",",0551-2108883,",svmmaniram@gmail.com,http://www.vidyamandir-india.in
2130112,SARASWATI VIDYA MANDIR UCHCHTAR,SHESHMANI MISHRA,Senior Secondary,31/03/2025,"GYAN KUNJ VIVIKANAND NAGAR SULTANPUR UTTAR PRADESH ,228001","5362 ,240615",slnsultanpur@gmail.com,
2131973,SARDAR BABA SINGH PUBLIC SCHOOL,Ankur Kumar Saxena,Secondary School,31/03/2023,"DASHMESH NAGAR, REHARIYA, PIPARIYA DHANI ,262804","5876 ,247616",anjani.gola@gmail.com,http://www.xyz.com
2132912,SARDAR PATEL ACADEMY PUBLIC SCHOOL,MRS. USHA SRIVASTAVA,Senior Secondary,31/03/2023,"S-2 RATANPUR EXTENSION PANKI ,208020",",05122262210",sardarpatel.academy17@gmail.com,www.spacademy.in
2133657,SARDAR PATEL CONVENT SCHOOL,MR. SHIV KUMAR MISHRA,Secondary School,31/03/2024,"VILLEGE AND POST SARSAINDA GURSARAI JHANSHI U.P. ,284202",",0510",spcssarsenda@gmail.com,http://www.spc.com
2132338,SARDAR PATEL GURUKUL ACADEMY,MRS. MEENA SINGH,Secondary School,31/03/2024,"RUDHAI, AIR FORCE STATION ROAD, BAKSHI KA TALAB ,226007","0522 ,6393716742",spgabktlko@gmail.com,http://www.spgalucknow.com
2132783,SARDAR PATEL SCHOOL,MR. RUPENDRA KUMAR GUPTA,Senior Secondary,31/03/2022,"RAMEDI DANDA, HAMIRPUR, UP. ,210301",",9453076052,",sardarpatelschool2014@gmail.com,http://www.sardarpatel.ez-school.com
2131066,SARLA INTERNATIONAL ACADEMY,MR. PAVAN KUMAR PAL,Senior Secondary,31/03/2024,"NEAR PLASTIC COMPLEX, VILLAGE PIPRA RAM KISHAN, POST OFFICE MANJHARIA VIKRAM, DIST. BASTI ,272002","5542 ,9335022197,",sia54532@gmail.com,http://www.sarlainternationalacademy.edu.in
2133353,SARLA INTERNATIONAL ACADEMY,MR. IGANCE TOPPO,Senior Secondary,31/03/2023,"VILL & POST – BHEEMAPAR, NAUGARH, SIDDHARTH NAGAR 272207 ,272207",",8299473127",sarlainternationalnaugarh@gmail.com,http://www.sarlainternationalacademy.com
2132418,SAROJ  ROYAL  ACADEMY,MR. SANTOSH KUMAR GUPTA,Senior Secondary,31/03/2022,"HEETA KA PURA CHAURAHA,RASRA, BALLIA ,221712","5491 ,919792827444",sarojroyal.rasra@gmail.com,http://www.sarojroyalacademy.in
2131061,SARVODAY PULIC SCHOOL,RAM ASHIS UPADHYAY,Senior Secondary,31/03/2024,"GHATH TAPPA HARBANHPUR AZAMGARH ,270001","5462 ,260970",rpysps8800@gmail.com,http://www.xyz.com
2130753,SARVODAYA ROSE BUDS PUBLIC SCHOOL,A N Pandey,Senior Secondary,31/03/2026,"RPF COLONY MALEGODAM ROAD ODWAR MUGHAL SARAI CHANDAULI UP ,232101","5412 ,000000",srbmgs@rediffmail.com,
2132101,SATYA NARAYAN SINGH NATIONAL SCHOOL,MR. SUDHANSHU SINGH,Senior Secondary,31/03/2026,"GAUR MIRZAMURAD VARANASI ,221307","0542 ,0542-2637688,",pravinsns25@gmail.com,http://www.snsnationalschool.in
2133061,SATYAM CHILDREN ACADEMY,MRS. USHA PANDEY,Senior Secondary,31/03/2024,"VILL. & PO. SAHID GAON, CHANDAULI, U.P. ,232105",",09918634100",ashishvidyarthiskd@gmail.com,http://www.satyamchildreanacademy.com
2132321,SATYAS THE ARYAN SCHOOL,CHANDRA BHOOSHAN,Senior Secondary,31/03/2026,"BALRAMPUR ROAD IKAUNA ,271845","5252 ,208543",chandrabhooshan18@yahoo.com,
2131751,SAVITRI PUBLIC SCHOOL,KUSUM UPADHYAY,Senior Secondary,31/03/2020,"BURADIH,GULAHARIYA BAZAR,GAKHPUR-273013 ,273013","0551 ,7318403115",savitri_school@yahoo.com,http://www.savitrips.co.in
2131254,SAVITRI PUBLIC SCHOOL PARTAWAL MAHARAJGANJ,JAYA PANDEY,Senior Secondary,31/03/2026,"SAVITRI PUBLIC SCHOOL PARTAWAL MAHARAJGANJ ,273301","0551 ,7318403114",savitri_school@yahoo.com,
2133525,SAVITRI VIDYA VIHAR,Mr. JITENDRA KUMAR PANDEY,Senior Secondary,31/03/2023,"BHANPUR, BASTI ,272194",",9984060101",savitri.vidya.basti@gmail.com,http://www.savitrividyavihar.com
2120054,SAVITRIBAI PHULE RAJKIYA ASHRAM PADDHATI VIDYALAYA,.,Senior Secondary,31/03/2025,"KOILAHA, KAUSHAMBI UP ,",",",,
2132535,SBT PUBLIC SCHOOL BISHUNPURA BAKHARA GAURI BAZAR DEORIA 274202,MRS. SHIVA TRIPATHI,Senior Secondary,31/03/2022,"BAKHARA ,274202","5568 ,05568288022,",sbt.school@yahoo.in,http://www.sbtschool.com
2132332,SCHOLAR ACADEMY,MRS. ROLY SRIVASTAVA,Senior Secondary,31/03/2023,"KHUJHAULI, MOHANLAL GANJ ,226001","0522 ,9455802383",scholaracademy22012@gmail.com,http://www.scholaracademy.in
2132964,SCHOLAR MISSION SCHOOL,DR. REETA SAXENA,Senior Secondary,31/03/2023,"BAIKUNTHPUR BITHOOR ROAD KANPUR ,208017",",05122790004",rsaxena26m@yahoo.com,www.scholarmissionschool.com
2132753,SCHOLARS ACADEMY GHAZIPUR,MR. VIJAY NARAYAN TIWARI,Senior Secondary,31/03/2022,"MIRANPUR, GHAZIPUR ,233002","0548 ,9415280793",scholarsacademyghazipur@gmail.com,http://www.scholarsacademyghazipur.org
2131819,SCHOLARS ACADEMY SCHOOL,GULSHAN SINGH,Secondary School,31/03/2022,"VILL / POST - BACHCHHAON, VARANASI-221010 U.P. ,221010","0542 ,6528358",scholarsacademyschool7@gmail.com,
2131676,SCHOLARS ACADEMY.,BISWAJIT MOHANTY,Senior Secondary,31/03/2023,"SOUTH BYPASS ROAD,MATHURA NAGAR , ANAND NAGAR , MAHRAJ GANJ-UP ,273155","5522 ,223786",bbmohanty777@gmail.com,
2132311,SCHOLARS DALE ACADEMY,DR. SMT. RICHA SINGH,Senior Secondary,31/03/2026,"VILL. & PO.- JAMUHAI, JAUNPUR ,222001","91 ,9598428939,",sdacademyjnp3@gmail.com,http://www.scholarsdale.in
2132920,SCHOLARS NEST SCHOOL,Mrs.Preeti Saxena,Secondary School,31/03/2025,"PLOT NO.-1,TIKAIT RAI,LDA COLONY, DIST-LUCKNOW, UP-226 003 ,226003","91 ,0522-6555003",scholarsnestschool@rediffmail.com,
2133403,SCHOLARS PUBLIC SCHOOL BALUA UDAIPUR VARANASI,MR. SANTOSH KUMAR BHARDWAJ,Secondary School,31/03/2023,"VILLAGE BALUA POST UDAIPUR ,221101",",9554581555",ops18052014@gmail.com,http://www.scholarspublicschool.co.in
2132754,SCHOLARS SENIOR SECONDARY SCHOOL,MRS. SAPNA KEJRIWAL,Senior Secondary,31/03/2023,"NEAR SBI RAGHAV NAGAR,DEORIA (U.P.) ,274001",",05568-220273",scholer.deo@gmail.com,http://www.scholarsssdeoria.org
2133296,SCHOLARS WORLD SCHOOL,MR. SUMANT KUMAR,Secondary School,31/03/2022,"NAURANGABAD, NEAR DURGA MANDIR ,262701",",9793551500",shiraz@erocon.in,http://scholarsworldschool.net/
2133676,SCION INTERNATIONAL SCHOOL,MR. RAMA SHANKAR SINGH,Senior Secondary,31/03/2024,"SHARDHA DHAM,GOLA, CHOLAPUR,VARANASI ,221101",",9415618287",scioninternationalschoolvns@gmail.com,http://www.scionschool.com
2133111,SD PANDEY MEMORIAL INTER COLLEGE,MR.VAIBHAV VANTOO,Senior Secondary,31/03/2026,"DEEGHA KANTA SALON RAEBARELI ,229305",",9648504000",sdpcbse@gmail.com,
2132160,SEMSTAR GLOBAL SCHOOL,Mrs.CYNTHIA DCRUZE,Senior Secondary,31/03/2025,"56/2 COD ROAD NEAR FCI NAINI KARCHANA, ALLAHABAD, UTTAR PRADESH 211008 ,211008",",8887363412",semstarglobalschool@gmail.com,http://www.semstarglobalschool.org
2133684,SETH ANAND RAM JAIPURIA SCHOOL,MRS. JAYA SINGH,Senior Secondary,31/03/2024,"CHAK BABURA, ALIMABAD, NAINI, PYAGRAJ 211008 ,211008",",9415283976",contact.prayagraj@gmail.com,www.jaipuriyapyagraj.com
2133612,SETH ANANDRAM JAIPURIA SCHOOL,MRS. ANJALI BAJPAI,Secondary School,31/03/2024,"HUSSAIN NAGAR PADARI ROAD UNNAO ,209801",",9336447557",thejaipuriaunnao@gmail.com,http://www.jaipuriaunnao.in/
2133479,SETH ANANDRAM JAIPURIA SCHOOL,MR. MR ATAL DWIVEDI,Senior Secondary,31/03/2023,"PHAPHUND ROAD,DIBIYAPUR AURAIYA ,206247",",9690070444",gsis.dibiyapur@gmail.com,www.gyansthaliinternationalschool.com
2132980,SETH ANANDRAM JAIPURIA SCHOOL,MRS. POONAM KOCHITTY,Senior Secondary,31/03/2023,"SECTOR-D, POCKET-3, ANSAL SUSHANT GOLF CITY, SHAHEED PATH, LUCKNOW ,226030",",9721081098",principallko@jaipuria.edu.in,http://www.jaipuria.edu.in/lucknowschool/
2133576,SETH ANANDRAM JAIPURIA SCHOOL TARNA,MRS. SHWETA TIWARI,Senior Secondary,31/03/2024,"VYAS BAGH, AIRPORT ROAD, HARAHUA 221105 ,221105",",9838077513",info.jaipuria@gmail.com,www.jaipuriaschoolvaranasi.com
2132808,SETH ANANDRAM JAIPURIYA SCHOOL,MR. SHASHANK TRIVEDI,Senior Secondary,31/03/2022,"MAUZA CHANDAUKHI,PARGANA SUMMERPUR, HAMIRPUR TO SAGAR MARG, KUCHHECHHA, HAMIRPUR ,210301","0512 ,9695447778,",tjshamirpur@gmail.com,http://www.jaipuriahmp.com
2131900,SETH CHHOTEYLAL ACADEMY,ASIYA BUSHRA,Senior Secondary,31/03/2023,"AUNDERA ROAD, RATH, DISTRICT- HAMIRPUR (U.P.) ,210431","5280 ,222211",principal.scarath@gmail.com,
2133557,SETH M R JAIPURIA SCHOOL,MRS. SHIKHA TRIPATHI,Secondary School,31/03/2024,"ON MAIN ROAD TOWARDS FAIZABAD, 2 KM FROM PARAG DAIRY, FAIZABAD ROAD, GONDA(U.P) ,271123",",05260276329",principal.gonda@jaipuriaschools.ac.in,www.jaipuriaschoolgonda.in
2132965,SETH M R JAIPURIA SCHOOL,MR. ANIL KUMAR MB,Senior Secondary,31/03/2023,"BEHIND GOVT POLYTECHNIC COLLEGE LUCKNOW HIGHWAY SAHADATGANJ ,224002",",05278236042",principal.faizabad@jaipuriaschools.ac.in,http://www.jaipuriaschoolfaizabad.in/
2132564,SETH M R JAIPURIA SCHOOL,MRS. BHARTI MANKANI,Senior Secondary,31/03/2023,"LUCKNOW-FAIZABAD ROAD,SURSUNDA ,RASAULI DISTRICT BARABANKI ,225001","0524 ,05248223755",director.barabanki@jaipuriaschools.ac.in,www.jaipuriaschoolbarabanki.in
2132458,SETH M R JAIPURIA SCHOOL BANSAL CAMPUS,MRS.MONICA TEWARI,Senior Secondary,31/03/2026,"NH24 BEHIND SEWA HOSPITAL SITAPUR ROAD LUCKNOW ,226201","0522 ,0522 6592254-55,",principal.sprlucknow@jaipuriaschools.ac.in,http://www.jaipuriabansal.com
2133273,SETH M R JAIPURIA SCHOOL KANPUR ROAD CAMPUS,MRS. POONAM GAUTAM,Secondary School,31/03/2022,"PANDIT KHEDA, OPPOSITE KANSHI RAM TOWNSHIP, ALINAGAR, SUNEHRA, KRISHNA NAGAR, KANPUR ROAD ,226005",",09119900141",gprpjskrc@gmail.com,http://www.jaipuriaschoolkanpurroad.in/
2133623,SETH M R JAIPURIA SCHOOL KURSI ROAD CAMPUS,MRS. TUHINA SRIVASTAVA,Secondary School,31/03/2024,"KHASRA NO. 171, PAIKARAMAU KURSI ROAD ,226021",",05222341747",director.kursiroadlko@jaipuriaschools.ac.in,www.jaipuriaschoolkursiroadlko.in
2133324,SETH M R JAIPURIA SCHOOL LAKHIMPUR KHERI,MRS. BINDU SHARMA,Secondary School,31/03/2023,"LRP ROAD RAJAPUR, LAKHIMPUR KHERI, UTTAR PRADESH-262701. ,262701",",05872263941",principal.lakhimpur@jaipuriaschools.ac.in,http://www.jaipuriaschoollakhimpur.in
2130727,SETH M R JAIPURIA SCHOOLS BANARAS,MRS. SUDHA SINGH,Senior Secondary,31/03/2026,"AIRPORT ROAD, VILL -SISWA, BABATPUR VARANASI U.P. ,221006","0542 ,7518021818",info.babatpur@jaipuriaschools.ac.in,www.jaipuriaschoolsbanaras.in/babatpur
2133658,SETH M. R. JAIPURIA SCHOOL,MRS. DR. PARAMJIT KAUR,Secondary School,31/03/2024,"SUNDARPUR PATTI,PRATAPGARH,U.P.-230127 ,230127",",9919270000",sethmrjaipuriapbh.ms@gmail.com,http://www.jaipuriaschoolpratapgarh.in
2133447,SETH M. R. JAIPURIA SCHOOL,DR. NEERU TYAGI,Secondary School,31/03/2024,"SUKHSWALIA, VIKASH KHAND- PADRAUNA, KUSHINAGAR - ,274304",",7379944444",info.padrauna@gmail.com,http://www.jaipuriaschoolpadrauna.in/
2132989,"SETH M. R. JAIPURIA SCHOOL, HARDOI",MR. BINOD KUMAR TIWARI,Senior Secondary,31/03/2024,"NAYAGAON, MUBARAKPUR, LUCKNOW ROAD, HARDOI ,241001",",7753975444",info.hardoi@jaipuriaschools.ac.in,www.jaipuriaschoolhardoi.in
2133540,SETH M.R JAIPURIA SCHOOL,MR. SHANTIMOY DUTTA,Senior Secondary,31/03/2023,"IN FRONT OF GOVINDAM HOTEL, KANPUR ROAD, RAGAULI, INDUSTRIAL AREA- 285001 ,285001",",9044330786",info.orai@jaipuriaschools.ac.in,www.jaipuriaschoolorai.in
2133523,SETH M.R. JAIPURIA SCHOOL,MR. SHIBU MATHEW K,Senior Secondary,31/03/2024,"VILLAGE ITRAURA, PILKHINI POST- MALWAN ,212664",",7800382280",sethjaipuria2020@gmail.com,WWWJAIPURIASCHOOLFATEHPUR.IN
2133661,SETH M.R. JAIPURIA SCHOOL,MRS. RASHMI PATTNAIK,Secondary School,31/03/2024,"MAHABIR CAMPUS, MAHESUA, ALLAHABAD ROAD,NEAR PEEPERPUR RAILWAY STATION,SULTANPUR ,228001",",9161699908",principal.sultanpur@jaipuriaschools.ac.in,www.jaipuriaschoolsultanpur.in
2133210,"SETH M.R. JAIPURIA SCHOOL, BAHRAICH",MRS. HEMLATA TIWARI,Senior Secondary,31/03/2024,"JAIN CAMPUS,RAHWA CHAURAHA,6TH K.M BHINGA ROAD, BAHRAICH(UP) BAHRAICH UTTAR PRADESH,BAHRAICH , 271801 ,271801",",9415121078",principal.bahraich@jaipuriaschools.ac.in,http://www.jaipuriaschoolbahraich.in
2132807,"SETH M.R. JAIPURIA SCHOOL, GOEL CAMPUS",MRS. RINA PATHAK,Senior Secondary,31/03/2022,"GOEL CAMPUS, FAIZABAD ROAD, NEAR INDIRA CANAL ,226028",",8874205481",principal.gcfr@jaipuriaschools.ac.in,http://www.jaipuriaschoolgoelcampus.in/
2132620,"SETH M.R. JAIPURIA SCHOOLS, BANARAS PARAO MUGAL SARAI ROAD, DANDI,",MR. ASHISH SAXENA,Senior Secondary,31/03/2022,"CHANDAULI DIST, UTTAR PRADESH-232101 ,232101","5412 ,7080400881,",info.banaras@jaipuriaschools.ac.in,http://www.jaipuriaschoolsbanaras.in/
2131547,SEVEN HILLS,MRS. RASHMI YADAV,Senior Secondary,31/03/2024,"BEHIND GURU NANAK COLD STORAGE,PAKKA BAGH ETAWAH ,206001","5688 ,05688215554",dubeysaurabh.etw@gmail.com,www.sevenhillsetawah.com
2132696,SGM INTERNATIONAL SCHOOL,Mr.SANDEEP KUMAR PATHAK,Senior Secondary,31/03/2022,"PLOT NO - 198, C - BLOCK, INDIRA NAGAR, KALYANPUR, KANPUR ,208026","080 ,0512 2570505",sgminternationalschool@gmail.com,http://www.sgminternational.edu.in
2130381,SHAH FAIZ MEM. PUBLIC SCHOOL,MRS. TASNEEM KAUSAR,Senior Secondary,31/03/2024,"MIANPURA GHAZIPUR UTTAR PRADESH ,233001","0548 ,05482220375",shahfaiz.1985@rediffmail.com,http://www.shahfaizschool.com
2132480,SHAHANA INTERNATIONAL SCHOOL,MR. ABU HORIARA,Senior Secondary,31/03/2023,"FARIDABAD(DALHANPUR) PO.-ITI SIDDIQPUR, SHAHGANJ ROAD, JAUNPUR ,222003",",9452558655",shahanaintrernationalschool@gmail.com,http://www.shahanaschool.in
2132780,SHAKUN VIDYA NIKETAN,MRS. SHAKUNTALA MISHRA,Senior Secondary,31/03/2022,"DEVRAKH, NAINI, ALLAHABAD ,211009",",0532-2695096,",shakunvidyaniketan@gmail.com,http://www.shakunvidyaniketan.org
2133185,SHAKUNTALA DEVI ENGLISH MEDIUM SCHOOL,MISS TANYA GUPTA,Senior Secondary,31/03/2024,"SHAKUNTALA DEVI EDUCATIONAL SOCIETY KAMPIL ROAD, KAIMGANJ FARRUKHABAD. U.P. ,209502",",05690230018",principalsdbic@gmail.com,
2130946,SHAKUNTLA CENTRAL ACADEMY,VIJAY SHANKAR DUBEY,Senior Secondary,31/03/2025,"CIVIL LINES, JAUNPUR, UTTAR PRADESH ,222001","5452 ,261703",shakuntala.central129@rediffmail.com,
2133466,SHAKUNTLAM ACADEMY,MR. VIBHUTI SHANKER MISHRA,Secondary School,31/03/2023,"KHOKHIPUR, ALIGANJ, SULTANPUR, U.P.-227805 ,227805",",05362241631",shakuntlamacademy.sln@gmail.com,http://www.shakuntlamacademy.com
2133495,SHAKUNTLAM INTERNATIONAL SCHOOL,MRS. VARSHA SINGH,Senior Secondary,31/03/2023,"BAH ROAD, UDI MOD, ETAWAH, UTTAR PRADESH 206131 ,206131",",07333848258",principalsisudi@gmail.com,http://www.sisetawah.in
2133510,SHAMBHU  NATH DUBEY CONVENT SCHOOL,MRS. ANJU DUBEY,Secondary School,31/03/2023,"DAKAHI, LAMBHUA, SULTANPUR ,222302",",9450215564",snconventlbh2012@gmail.com,http://www.sndcslbh.in
2131444,SHAMS NATIONAL SCHOOL,VED PRAKASH SRIVASTAVA,Senior Secondary,31/03/2023,"DHAWA SHARIF POST BANJARIPUR ,233001","0548 ,2901585",vpsrivastava69@gmail.com,http://www.shamsdhawa.com
2133520,SHAMSHER BAHADUR SINGH INTERNATIONAL SCHOOL,MRS. SAROJ MAURYA,Senior Secondary,31/03/2024,"KHAJURI, SHAHGANJ, ,231215",",8303289268",sbsintlschoolkhajuri@gmail.com,http://www.sbsinternationalschool.com
2131271,SHANDILYA PUBLIC SCHOOL,DEVI PRASAD SHUKLA,Senior Secondary,31/03/2023,"GAYTRI NAGAR COLONY, RAMNA GARWAGHAT ROAD ,221005","0542 ,2227717",dpshuklaihs@rediffmail.com,http://www.xyz.com
2132887,SHANKARLAL PUBLIC SCHOOL,Mrs.MANJU ANAND,Secondary School,31/03/2025,"VILL JASRA ,212107",",7080820955",spsjasra2015@gmail.com,
2133595,SHANKARLAL PUBLIC SCHOOL,MRS. ANKITA KESARWANI,Senior Secondary,31/03/2024,"KANDI ROAD, SAHSON, PRAYAGRAJ ,221507",",9839077527",slpssahson@hotmail.com,www.slpsschool.in
2131439,SHANTI DHAM SCHOOL,Fredrick A,Senior Secondary,31/03/2024,"KARWI ROAD, ATARRA ,210201","5192 ,211143",freadya52@yahoo.com,
2133123,SHANTI PUBLIC SCHOOL,MRS.  NEELAM SHARMA,Senior Secondary,31/03/2024,"GRAM-NAGARIYA,SARAWA,TEH- BHARTHANA,DISTT- ETAWAH ,206242",",05680",shantipublicschool16@gmail.com,http://www.sps.com
2132460,SHANTI PUBLIC SCHOOL,Kamlesh Pandey,Secondary School,31/03/2024,"SARAI DEVRAI KATRA GULAB SINGH PRATAPGARH ,230402","5342 ,9005188012",kamleshpandey123@gmail.com,
2130729,SHARADA PUBLIC SCHOOL,PRAVEEN KUMAR KANDPAL,Senior Secondary,31/03/2026,"BAUDH PARIPATH TULSIPUR ROAD BALRAM PUR UP ,271201","5263 ,234123",pkandpal734@gmail.com,
2132584,SHARDA INTERNATIONAL SCHOOL,MR. UDAY KUMAR SINGH,Senior Secondary,31/03/2023,"VILL & POST - SUITHAKALA, SHAHGANJ, JAUNPUR, U.P. ,222305","0 ,9956590000",sisjnpibsingh@gmail.com,http://www.shardajnp.com
2132864,SHARDA VIDHYA PUBLIC SCHOOL,Mr.SURENDRA PRASAD TIWARI,Secondary School,31/03/2025,"VILL- RAJPUR, MANGARI ,221202",",05422622009",sharda.vps@gmail.com,
2133570,SHEAT PUBLIC SCHOOL,MRS. PRIYA SINGH,Senior Secondary,31/03/2024,"VILL- HARIBALLAMPUR, PO- LAMAHI, VARANASI ,221003",",9415228161",info@sheatpublicschool.com,http://www.sheatpublicschool.com
2130768,SHEERWOOD COLLEGE,PREETI KHATTRI,Senior Secondary,31/03/2026,"DILDAR NAGAR KHATI BABA JHANSI UP ,284003","0510 ,7510090074",preeti_bassi@yahoo.com,
2132436,SHEETALA CHILDREN SCHOOL,MR. CHANDRA DHAR TIWARI,Senior Secondary,31/03/2026,"HARPALPUR, PO.-LOHTA, VARANASI ,221107","0542 ,9415293793",rajantiwariflux@gmail.com,http://www.scsvaranasi.com
2132494,SHEETLA PRASAD TRIPATHI PUBLIC SCHOOL,MR. BRIJENDRA KUMAR PANDEY,Senior Secondary,31/03/2023,"WARD NO-1, BHAUNTER, TOWN AREA-AJHUWA ,212217",",9415614540",sptripathipubsch1967@gmail.com,http://www.sptpschool.org
2133098,SHEMFORD  FUTURISTIC SCHOOL,MR. A K TIWARI,Senior Secondary,31/03/2023,"MAUHARIYA ROAD, GORABARIK, SULTANPUR ,228001",",7234826675",sultanpurshemford@gmail.com,http://www.sultanpurshemford.co.in
2132974,SHEMFORD FUTURISTIC K 12 SCHOOL,MRS. ARPITA GUPTA,Senior Secondary,31/03/2023,"BHAGAUTIPUR AURAIYA ,206122",",9258761501",dev.shemford@gmail.com,http://www.shemfordauraiya.org
2133222,SHEMFORD FUTURISTIC SCHOOL,MR. VAIBHAV VANTOO,Senior Secondary,31/03/2024,"VILLAGE: PAKARI, USKA ROAD ,272207",",055544288888",siddharthnagar@shemford.com,shemfordsiddharthnagar.com
2131750,SHEMFORD FUTURISTIC SCHOOL,MRS. NEENA SHARMA,Senior Secondary,31/03/2024,"VIDYA NAGAR, PALI PAHARI SHIVPURI ROAD, JHANSI ,284003","0510 ,05102480264,",scshemford.jhansi@gmail.com,http://www.sfsjhansi.org
2131823,SHEMFORD SCHOOL,SUPARNA SINHA,Senior Secondary,31/03/2024,"NATWA ROAD, DISTT MIRZAPUR, UTTAR PRADESH ,231001","5442 ,221697",principal@mirzapur-shemford.com,http://www.shemford.com/school-admission-mirzapur
2132318,SHEMUSHI VIDYAPEETH,MR. MANISH SINGH,Senior Secondary,31/03/2026,"REOTI, BALIA, U.P. ,277209","5498 ,7704000413",abhishektiwari31@yahoo.co.in,http://www.shemushi.edu.in
2132297,SHIBLI NATIONAL NURSERY SCHOOL,MISS FATMA ZAHRA,Senior Secondary,31/03/2026,"VILL. & POST - AMILO, SATHIYAOWN ,276404","91 ,09198327094,",shibliamilo@gmail.com,http://www.snnsamilo.in
2133410,"SHITALMAU MONTESSORI SCHOOL, AJHARA, LALGANJ, PRATAPGARH, UP",MR. CHATURTH PRAKASH MISRA,Secondary School,31/03/2023,"VILL-AJHARA, POST-LALGANJ AJHARA DISTT-PRATAPGARH, UP PIN-230132 ,230132",",05341255618",smslalganjpbh@gmail.com,www.smslalganjpbh.in
2132261,SHIV BRAT SINGH CHILDREN ACADEMY,Mr. RUDRA PRATAP SINGH,Senior Secondary,31/03/2026,"VILLAGE ARGUPUR KALAN, BELWAI RAILWAY CROSSING ,222101","0545 ,9415652116",sbs.academic@gmail.com,http://www.sbsca.in
2130908,SHIV GANAGA VIDYA MANDIR,RAJENDRA PRASAD PANDEY,Senior Secondary,31/03/2022,"PHAPPPHAMAU, TESHIL SORAON, DISTT ALLAHABAD, UTTAR PRADESH ,211001","0532 ,2447039",rajendrapandeysir@gmail.com,http://www.mgps.in
2132314,SHIV MAHESH PUBLIC SCHOOL,PRATIBHA MISHRA,Secondary School,31/03/2024,"SHIV MAHESH PUBLIC SCHOOL, AMETHI ROAD, MUNSHIGANJ ,227412","0536 ,8255509",pratibhamishra795@gmail.com,
2132268,SHIV SHAKTI PUBLIC SCHOOL,MR. SHASHINDRA SHARMA,Senior Secondary,31/03/2022,"VILL-NEWADA, PO- LAWA, GHAZIPUR, U.P. ,233303","0548 ,9415209326",sspublicschoolgzp@gmail.com,http://www.sspsnewadagzp.in
2132953,SHIVA PUBLIC SCHOOL,MISS SUDHA PATHAK,Senior Secondary,31/03/2023,"VILL. - JAMODEEP, POST - TILOI, DIST - AMETHI (CH. SHAHUJI MAHARAJ NAGAR), U.P. ,229309","05352 ,9918300393",spsamethi2017@gmail.com,http://www.shivapublictiloiamethi.com
2131970,SHIVALIK INTERNATIONAL SCHOOL,Rashmi Pattnaik,Secondary School,31/03/2023,"SECTOR-F, LDA COLONY KANPUR ROAD LUCKNOW ,226012","0522 ,2433888",sjbb.rashmi@gmail.com,http://shivalikinternationalschool.com/
2131935,SHIVANI PUBLIC SCHOOL,ANUPMA DOGRA,Senior Secondary,31/03/2025,"VIDYAVATI DEVI NAGAR, SECTOR-O, KANPUR ROAD SCHEME ,226012","91 ,8090055559",principalspslko@gmail.com,http://www.spslucknow.in
2133711,SHIVLOK SHRINET PUBLIC SCHOOL,MR. AJAY KUMAR SINGH,Senior Secondary,31/03/2024,"VILLAGE-KAPSAUR POST- PADARI DISRT-MIRZAPUR U.P ,231304",",9473705341",ssgaurimzp@gmail.com,www.sspsgauri.in
2131667,SHREE ADITYA NARAYAN SINGH PUBLIC SCHOOL,MR. SANTOSH KUMAR SINGH,Senior Secondary,31/03/2024,"DHARSAUNA CHOLAPUR VARANASI ,221101","0542 ,05422612147",shreeanspscholapur@gmail.com,www.shreeanspublicschool.com
2133149,SHREE DHUNNU SINGH KIDS INTERNATIONAL PUBLIC SCHOOL,MRS. SANJEET GAUR,Senior Secondary,31/03/2024,"HARBANSH CHOWK, KARIYAJHALA MOD, JHINJHAK, KANPUR DEHAT U.P. ,209302",",9519015603",sdskidsips@gmail.com,http://www.sdskidsinternational.in
2130989,SHREE DUTT MEMORIAL PUBLIC SCHOOL OF SCIENCE AND COMMERCE,MADHURI SINGH,Senior Secondary,31/03/2024,"GAYATRI NAGAR,UTRAULA ROAD,MANKAPUR,GONDA ,271302","5265 ,234001",singhu66@yahoo.com,
2133057,SHREE JEE INTERNATIONAL SCHOOL,MRS. MUNNI BEGUM,Senior Secondary,31/03/2024,"REHUTIYA,CHITRAKOOT, UTTAR PRADESH-210205 ,210205",",9794731100",shreejeeintschool@gmail.com,www.shreejeeschool.in
2133062,SHREE RAM EDUCATIONAL INSTITUTE,DR.MANORAMA SHUKLA,Secondary School,31/03/2026,"SHREE RAM EDUCATIONAL INSTITUTE ,JAGTAPUR,BANGARMAU,DISST, UNNAO,UTTAR PRADESH ,209869",",9198562985",drmshukla19@gmail.com,
2131166,SHRI BAL KRISHNA PUBLIC VIDYALAYA,SANTOSH KUMAR YADAV,Senior Secondary,31/03/2025,"VILL. SACHUI (SHERPUR), POST SACHUI ,276129","0547 ,2338107",santoshsachuicbse@gmail.com,http://www.xyz.com
2133592,SHRI BHAGOUTI PRASAD MEMORIAL ENGLISH HIGHER SECONDARY SCHOOL,MRS. MAMTA DWIVEDI,Secondary School,31/03/2024,"RAM NAGAR, GONDA BAHRAICH MARG, DISTT- BARABAKI, U.P.-225205 ,225205",",9833272515",sbpmehssbarabanki.2020@gmail.com,www.sbpmehssbarabanki.co.in
2132204,SHRI BHUVNESH BHUSHAN SHARMA SMRITI VIDYAPEETH,Gaurav Bhushan Sharma,Senior Secondary,31/03/2026,"SHUBHLA BUILDING ,206122","5683 ,244678",principal@bbsvidyapeeth.com,
