Affiliation Number,Name,Head/Principal Name,Status,Affiliated unto,Address,Phone no.,Email,Website
2132011,HEERA LAL PATEL INTERNATIONAL SCHOOL,MRS. KAVITA KHANNA,Senior Secondary,31/03/2025,"PLOT NO. S-1 JARAULI PHASE-2 KANPUR ,208027","0512 ,8840907574",hlpinternationalschool@gmail.com,http://www.hlpis.co.in
2132649,HEERA LAL YADAV PUBLIC SCHOOL,MRS. SUNITA YADAV,Senior Secondary,31/03/2022,"VILLAGE AND POST BENTI, SAROJINI NAGAR ,226401","0522 ,09793000300,",hlyps.cbse@gmail.com,http://www.hlyps.in
2133572,HEISENBERG INTERNATIONAL SCHOOL,MRS. RICHA SINGH,Secondary School,31/03/2024,"HEISENBERG INTERNATIONAL SCHOOL EIDGAH ROAD MARIAHU JAUNPUR-222161 UP, INDIA ,222161",",7233933409",heisenbergmariahu@gmail.com,http://www.heisenbergschool.com
2133663,HERALDS ENGLISH MEDIUM SCHOOL,MISS BINDU GEORGE,Secondary School,31/03/2024,"CHANDRA ROAD, AMBABAI,JHANSI- ,284419",",8545000808",hgnschooljhansi@gmail.com,
2131957,HERITAGE ACADEMY,Mr.Shankh Dhar Shukla,Senior Secondary,31/03/2025,"BARDAR(RAMPUR MALAULI) POST-MISHRAULIYA DISTT. GORAKHPUR ,273401",",9335506197",hacademygkp@gmail.com,http://www.hagkporg.in
2132083,HERITAGE INTERNATIONAL PUBLIC SCHOOL,MRS. PUNAM GUPTA,Senior Secondary,31/03/2025,"SAPAHA ROAD, POST-KASIA ,274402","000 ,000000000",hipsrpkasia@gmail.com,www.hipskasia.edu.in
2131277,HERITAGE INTERNATIONAL SCHOOL,RUPAM  SRIVASTAVA,Senior Secondary,31/03/2022,"OPP.ALIMCO NARAMAU KANPUR ,208016","0512 ,9389770050",principal.hisknp@gmail.com,
2133159,HERITAGE WORLD SCHOOL,MRS. REENA PUNDHIR,Secondary School,31/03/2022,"NH-2, DAFI - MUGHALSARAI BYPASS, GAURI, NIYAMTABAD, CHANDAULI ,232101",",7800286666",hws.cbse@gmail.com,http://www.heritageworldschool.com
2130233,HERMAN GMEINER SCHOOL,PAUL PV,Senior Secondary,31/03/2023,"CHAUBEYPUR VARANASI UTTAR PRADESH ,221104","0542 ,2615466",principal.varanasihgs@soscvindia.org,
2130837,HIND ANGLES PUBLIC SCHOOL,ARTI  TIWARI,Senior Secondary,31/03/2022,"HAMIRPUR ROAD RATH UTTAR PRADESH ,210431","5280 ,9839472598",ainu_din@yahoo.com,http://www.hapsrath.org
2130368,HIRA PUBLIC SCHOOL,MOHD MUJEEB KHAN,Senior Secondary,31/03/2024,"HANSWAR, FAIZABAD (AMBEDKAR NAGAR) UTTAR PRADESH ,224143","0527 ,3283030",mkhanmujeeb@gmail.com,
2132785,HMFA MEMORIAL SCHOOL,Mohd Athar Kalam,Secondary School,31/03/2025,"KARARI BHADAILY ,221503","01663 ,05323015231",hmfams2132785@gmail.com,http://www.hmfamiet.com
2131313,HOLI ANGELS PUBLIC SCHOOL,MRS. JYOTSANA SRIVASTAVA,Senior Secondary,31/03/2026,"C. C. ROAD, NEAR SUGAR MILL ,274001","5568 ,05568213544",holyangelsdeo@gmail.com,http://www.holyangelsps.org
2130696,HOLI POINT ACADEMY,PRADEEP CHANDRA PANDEY,Senior Secondary,31/03/2026,"SEEHPUR BHARTHANA ETAWAH UP ,206242","5680 ,225598",holypointacademy@gmail.com,
2131914,HOLY CHILD ACADEMY,NEELAM SINGH,Senior Secondary,31/03/2025,"RUHATTA, UMARPUR, JAUNPUR ,222002","5452 ,265285",hcajaunpur@gmail.com,www.hcajaunpur.com
2133084,HOLY CHILD PUBLIC SCHOOL,Mr.ASHOK KUMAR,Senior Secondary,31/03/2026,"PRASADPUR SOARON ,212502",",7233019603",souravyadav86@gmail.com,
2132790,HOLY CROSS ENGLISH SCHOOL,Mr.RAM AWADH CHAUBEY,Secondary School,31/03/2025,"SARVARNAGAR, DEOKALI, GHAZIPUR ,233306",",8738957787",hcesdeokali123@gmail.com,
2131582,HOLY DIVINE PD. SHAYAM SUNDER MEMORIAL CONVENT SCHOOL,SANTOSH KUMAR PADHI,Secondary School,31/03/2025,"KANCHANPUR,BALWARGANJ TAHASIL,MACHALI SAHAR ,222201","5454 ,275461",me2santoshmishra79@gmail.com,
2131514,HOPE DYSON MEMORIAL SCHOOL,N Dyson,Secondary School,31/03/2025,"NEAR WATER TANK POST BASHARATPUR ,273004","0551 ,2505050",n_dyson@rediffmail.com,
2132664,HOPE TOWN INTERNATIONAL SCHOOL,Mrs.Pooja Lalchandani,Secondary School,31/03/2025,"PARGHAI MANDHANA ,209217",",9307960744",lifecoach.jauhari@gmail.com,http://www.hopetown.com
2132905,I.D.J.P. PUBLIC SCHOOL,Mr.Shyam Narayan Tiwari,Secondary School,31/03/2025,"VILLAGE SARAI DHANETHI, POORE SHIV BAKSH PANDEY, POST ANJRAULI, FAIZABAD ,224164",",9721018888",idjppublicschool@gmail.com,http://www.idjppublicschool.com
2133340,I.V.S CENTRAL ACADEMY,MR. AMAR SINGH,Secondary School,31/03/2023,"KATWARUPUR HANUMANGANJ ALLAHABAD (U.P)221505 ,221505",",9613581274",ivscentrelacedemy123@gmail.com,
2130720,IMPERIAL PUBLIC SCHOOL,Dr Sucheta Hundoo,Senior Secondary,31/03/2023,"SRIKRISHNA PLAZA ASSI VARANASI UP ,126116","0542 ,2312955",suchetahundoo@yahoo.com,imperialpublicschool.com
2132316,IMPULSE INTERNATIONAL SCHOOL,MR. SAURABH SHUKLA,Senior Secondary,31/03/2024,"VILLAGE PARSAPUR, P.O. NAWABGANJ, DISTRICT- GONDA, U.P. ,271303","7081 ,9839115462,",impulse.internationalschool@gmail.com,http://www.impulseinternationalschool.com
2132743,INCREDIBLE PUBLIC SCHOOL,MR. JAY PRAKASH TIWARI,Senior Secondary,31/03/2022,"VILL + POST- LILKAR SIKANDERPUR, DISTT. BALLIA ,277303","99 ,9455841274,",incredibleschool2011@gmail.com,http://www.ips.edu.in
2133142,INDIAN PUBLIC SCHOOL,MRS. CHANDAN MISHRA,Secondary School,31/03/2022,"VILL-GULAURI BUJURG POST-HARIBANSHPUR BLOCK-DUBAULLIYA ,272131",",8765675515",indianpublicschool2012@gmail.com,
2132835,INDIRAPURAM PUBLIC SCHOOL,MR. MADHUP MISHRA,Senior Secondary,31/03/2022,"NEAR NANDINI NAGAR MAHAVIDYALAYA,TURKAULI,NAWABGANJ ,271303","0091 ,9838202487",IPS.AYODHYA@GMAIL.COM,http://www.ipsayodhya.com
2131434,INDRA PRASTH ACADEMY,SANJAY KITCHNER,Senior Secondary,31/03/2022,"NEW CHURCH ROAD BABINA CANTT, DISTRICT JHANSI (U.P) ,284401","510 ,2741316",sanjaykitchner@gmail.com,
2133664,INDRARAJ MEMORIAL ACADEMY,MR. AMBRISH KUMAR MISHRA,Secondary School,31/03/2024,"ORWARA BASTI ,272002",",9838244863",indrarajmemorialacademy@gmail.com,http://www.indrarajmemorialacademy.com
2133450,INDUS INTERNATIONAL ACADEMY,MRS. NIHARIKA CHATURVEDI,Secondary School,31/03/2023,"PURSENI, NH 24-B, RAEBARELI ROAD, MOHANLALGANJ, LUCKNOW-226301 ,226301",",7607555743",info@globaledu.org.in,http://www.indusacademy.in
2133380,INDUS VALLEY PUBLIC SCHOOL,MRS. RACHNA TANDON,Secondary School,31/03/2023,"SC-002, ELDECO CITY,IIM ROAD ,226013",",7317007071",ivpslucknow@gmail.com,http://www.indusvalleylucknow.in
2132588,"INDUS VALLEY PUBLIC SCHOOL, RATH",MRS. SARIKA KUTE PATIL,Senior Secondary,31/03/2022,"73, KUMHARIYA,ORAI ROAD, ,210431","5280 ,9792393777,",cmd@ivpsgroup.com,http://www.indusvalleyrath.com
2133406,INFANT JESUS SCHOOL,MR. ALA RAMESH,Secondary School,31/03/2023,"MODKHURD CHIRGAON ,284301",",0510",Infantjesuschg@gmail.com,http://www.infantjesusschool.edu
2132408,INNOVATIVE MINDS ACADEMY,MR. RADHEY SHYAM PANDEYA,Senior Secondary,31/03/2026,"KURAWAN, PRABHAT NAGAR, RAEBARELI ROAD, SOHAWAL, MASODHA, FAIZABAD(AMBEDKAR NAGAR) UTTAR PRADESH ,224001","5278 ,9415144984",jbadayboarding@gmail.com,http://www.jbadb.weebly.com
2132985,INTELLIGENT PUBLIC SCHOOL,MRS. FAUZIYA PARVEEN QURAISHEE,Secondary School,31/03/2021,"VILL AND POST LACHHIYA, FAZILNAGAR ,274401",",9918473073",ipslachhiya77777@gmail.com,
2130317,INTERNATIONAL CENTRE ENGLISH SCHOOL,RATNA RASTOGI ,Senior Secondary,31/03/2022,"B S PARK ARYA NAGAR KANPUR UTTAR PRADESH ,208012","0512 ,70800581",ices.kanpur@gmail.com,
2133155,INTERNATIONAL DELHI PUBLIC SCHOOL,MRS. JAYATI,Senior Secondary,31/03/2024,"NEAR SBI BANK,KUSHMI BAZAR,GORAKHPUR ,273002",",7234000700",idpsgkp@gmail.com,http://www.idpsgkp.com/
2130474,INTERNATIONAL HINDU SCHOOL,K L DIXHIT,Senior Secondary,31/03/2023,"N 1/30/31 NAGAWA VARANASI UTTAR PRADESH ,221005","0542 ,2366743",principal.ihsvaranasi@rediffmail.com,http://www.ihsvaranasi.in
2132275,IPNS CENTRAL PUBLIC SCHOOL,MRS. P BHANUMATI,Senior Secondary,31/03/2022,"VILL-BAIRAHANA (DHAUKALGANJ), POST- AKORHA ,221201","91 ,9415622431,",ipnscps2016@gmail.com,http://www.ipnscps.org
2131047,IQRA MODEL SCHOOL,REYAZ AHMED KHAN,Secondary School,31/03/2022,"VILLAGE & P.O.- BARA DIST. - GHAZIPUR (U.P) ,232325","5497 ,264234",rzkhan725@gmail.com,http://www.muslimwelfareducationaltrust.com
2130603,IQRA PUB SCHOOL,MR. SHAKEEL AHMAD,Senior Secondary,31/03/2023,"IDGAH ROAD MUNDIYAR PHOOLPUR AZAMGARH UTTAR PRADESH ,276304","05460 ,230159",iqra230159@gmail.com,www.ipsazamgarh.in
2132947,ISHAN PUBLIC SCHOOL,Mr. VINEET DUA,Secondary School,31/03/2021,"VILLAGE SHUKULPUR POST SANGIPUR TAHSHIL LALGANJ DISTRICT PRATAPGARH UTTAR PRADESH 230139 ,230139",",7897340010",ipssangipur@gmail.com,http://www.ishanpublicschool.co.in/
2133370,J C INTERNATIONAL PUBLIC SCHOOL,MR. PRAMOD KUMAR SINGH,Senior Secondary,31/03/2023,"GAYATRI NAGAR, KUNRAGHAT GORAKHPUR ,273008",",9415123262",jcipsedu@gmail.com,http://www.jcips.in/
2131685,J D EDUCATION CENTRE,DR MANJU SINGH,Senior Secondary,31/03/2024,"PLOT NO-1, ARAZI NO-527, ARRA, NEAR GALLA MANDI, NAUBASTA, KANPUR, UP-21 ,208021","0512 ,2255210",principaljdec@gmail.com,
2132720,J D S INTER NATIONAL SCHOOL,MR. ANIL KUMAR SINGH,Senior Secondary,31/03/2023,"JATPURA BHATPARRANI DEORIA ,274702",",8381962468,",jdsinternationalschool@gmail.com,http://www.JDSDEORIA.COM
2132112,J D S INTERNATIONAL SCHOOL,MR. S.N. SINGH,Senior Secondary,31/03/2026,"BALUCHAHA ROAD PADRAUNA KUSHINAGAR DISTRICT 274304 ,274304","91 ,07786857783",jdsinternational8@gmail.com,http://www.jdsinternationalschool.org
2131706,J D S PUBLIC SCHOOL,VANDANA SINGH,Senior Secondary,31/03/2024,"PANCHO SHIVALA VILLAGE: KOIRIPUR KHURD POST: RASULPUR ,221204","0542 ,2624057",vandana712singh@gmail.com,http://www.jdspublicschool.in
2133291,J DAWN WASCO SCHOOL,MR.  SANTOSH KUMAR YADAV,Senior Secondary,31/03/2024,"VILL- KHOJAPUR, PO- CHAKINAMI, AZAMGARH ,276206",",9198040300",jdawnwasco2011@gmail.com,www.jdwschool.com
2133156,J P INTERNATIONAL SCHOOL,MRS. NISHA KIRAN UPADHYAY,Senior Secondary,31/03/2024,"SUJANGANJ JAUNPUR ,222201",",8858621010",principal.jpis@gmail.com,http://www.jpis.co.in
2133122,J S PUBLIC SCHOOL,MR. DHARMENDRA SINGH,Senior Secondary,31/03/2024,"KHARAWAN (SADHOGANJ) VARANASI ,221201",",8795000401",jspublicschoolvaranasi@gmail.com,www.jspublicschoolvaranasi.com
2132726,J S PUBLIC SCHOOL,DR. RAJNEESH RAGHAV,Senior Secondary,31/03/2022,"VILL. KASIMPUR, POST PACHOKHAR ,232101","0 ,08127043333",rajaneeshsingh@gmail.com,www.jspublicschool.org
2133626,J. K. B. PUBLIC SCHOOL,MR. AMIT SINGH KUSHWAHA,Senior Secondary,31/03/2024,"NOORUDDINPURA, BUDDHAPURAM, NEW SABJI MANDI, GHAZIPUR, U.P. ,233001",",9450724134",jkbpsg@gmail.com,http://www.jkbps.in
2132627,J. P. EDUCATION ACADEMY,MR. AMARENDRA SINGH,Senior Secondary,31/03/2022,"VILLAGE UNCHA, PARGANA TALGRAM, TIRWA ROAD, NEAR POWER HOUSE, GURSAHAIGANJ, KANNAUJ ,209722",",9838653719,",jpeducationacademyghj@gmail.com,http://www.jpeducationacademy.com
2131912,J. P. S. PUBLIC SCHOOL,MEENA SINGH ,Senior Secondary,31/03/2025,"NEW RANA NAGAR, POLICE CHAWANI, KANPUR ROAD, RAEBARELI ,229001","0535 ,2213695",meenasinghjps@gmail.com,http://www.jpspublicschool.com
2130083,J.B ACADEMY,MS RASHMEE BHATIA,Senior Secondary,31/03/2025,"VISHNUPURI GADDOPUR MAJHAWAN PO FAIZABAD UTTAR PRADESH ,224001","5278 ,9838414000",p.jba@jbnss.in,http://www.jbnss.org
2132234,J.K MITTAL ACADEMY,MR.KRISHNA GOPAL GUPTA,Senior Secondary,31/03/2026,"BHATVALIYA CHAHURAHA,DEORIA ,274001","91 ,05568-230586,",jkmittalacademy@gmail.com,http://www.jkmittalacademy.com
2132950,J.N.U.MEMORIAL ACADEMY,MR. S.K.PANDEY,Senior Secondary,31/03/2024,"KAULAHI HAISSER BAZAR SANT KABIR NAGAR ,272165",",9450360842",skpandey.jnum@gmail.com,www.jnum.com
2133476,J.P. MEMORIAL GLOBAL SCHOOL,MR. MANOJ KUMAR SRIVASTAVA,Secondary School,31/03/2023,"BEHANDARKALAN, KASHIMPUR, SANDILA, HARDOI ,241201",",8400460063",jpmgschool@gmail.com,
2131159,J.P.EDUCATION ACADMY,Dr. Salil K Srivastava,Senior Secondary,31/03/2025,"NATHMALPUR, GREEN CITY ROAD GORAKHPUR (U.P.) ,273001","0551 ,2250118",jpea_salil@yahoo.com,
2133118,J.P.S. CENTRAL ACADEMY,MR. ABHIJEET KUMAR,Senior Secondary,31/03/2024,"J.P.S. CENTRAL ACADEMY,JUNGLE GAURI NO.1,JHANGHA,KHORABAR. ,273202",",9621327070",jpscentral2565@gmail.com,http://jpscentralacademy.com/
2131438,J.S.G.S PUBLIC SCHOOL,RAM MILAN YADAV,Senior Secondary,31/03/2025,"VILL- TISHUHI, POST- MARIHAN ,231001","5442 ,284286",jsgspublicschool@gmail.com,
2132308,J.S.M. PUBLIC SCHOOL,ARCHANA YADAV,Secondary School,31/03/2024,"KAMALGANJ FATEHGARH DIST. FARRUKHABAD U.P. ,209724","0569 ,2290609",jsmpublicschoolprincipal@gmail.com,http://www.jsmpublicschool.com
2130126,JAGAT TARAN GOLDEN JUBILEE SCHOOL,INDRANI GUPTA,Senior Secondary,31/03/2023,"32B HAMILTON ROAD GEORGE TOWN ALLAHABAD UTTAR PRADESH ,211002","0532 ,2468802",jtgjs@rediffmail.com,
2131008,JAGRAN PUBLIC SCHOOL,Nirendra Kumar Dwivedi,Senior Secondary,31/03/2024,"VIRAJ KHAND, GOMTINAGAR, LUCKNOW - 226010 ,226010","0522 ,3247119",nirendra_dwivedi@rediffmail.com,
2132518,JAGRAN PUBLIC SCHOOL,MR. ANAND.R.PAL,Senior Secondary,31/03/2022,"NEAR PANDIA CHAURAHA,BANSI ROAD,BASTI ,272002","5542 ,9415024627",jpsbasti2@gmail.com,http://www.jpsbasti.com
2131094,JAGRAN PUBLIC SCHOOL KANNAUJ,DR. SANJAY SHUKLA,Senior Secondary,31/03/2025,"OPP. UPT G.T. ROAD MAKRAND NAGAR ,209726","5694 ,9795636316",jagranpublicschool.kannauj@gmail.com,jagranpublicschoolkannauj.co.in
2132574,"JAGRAN PUBLIC SCHOOL, VARANASI",MR. DHAVALA VENKATA SOMESWARA RAO,Senior Secondary,31/03/2022,"G.T. ROAD, DAREKHU ,221313","0542 ,05422632115,",principal.jpsv@gmail.com,http://www.jpsvaranasi.com
2133473,JAGROSHAN PUBLIC SCHOOL,MR. CHHEDI PANDEY,Secondary School,31/03/2024,"JUNGLE HARPUR, BHATHAT, GORAKHPUR ,273306",",9794924514",info.jagroshan@gmail.com,www.jogroshanpublicschool.com
2130791,JAI ACADEMY,VAISHALI MISHRA,Senior Secondary,31/03/2026,"SHIV PURI ROAD JHANSI UP ,284419","0510 ,9506030428",vaishalimishra1112@gmail.com,
2132171,JAI GURUDEO RAJ PUBLIC SCHOOL,Mahendra Singh Yadav,Senior Secondary,31/03/2022,"DILIYA, TALWAL ,233001","0548 ,2230019",savinash865@gmail.com,
2132982,JAI NARAYAN VIDYA MANDIR,Mr.SANTRAM DWIVEDI,Senior Secondary,31/03/2021,"75-A,VIKAS NAGAR ,208024",",0512-2585054",jainarayanschool@rediffmail.com,http://www.jnvmic.in
2120058,JAI PRAKASH NARAYAN SARVODAYA BALIKA VIDYALAYA,.,Senior Secondary,31/03/2021,"RAM NAGAR, CHANDANCHAUKI KHERI, UP ,",",",,
2120062,JAI PRAKASH NARAYAN SARVODAYA VIDYALAYA,.,Senior Secondary,31/03/2019,"VILLAGE & PSOT KATKUINYAKLA, SIRSIYA, SHRAUASTI, U.P-271840 ,","0276 ,224855",sudhirhadkesdb@gmail.com,
2120061,JAI PRAKASH NARAYAN SARVODAYA VIDYALAYA,.,Senior Secondary,31/03/2022,"NEOTINY, JANPAD, UNNAO, UTTAR PRADESH ,","0276 ,224855",sudhirhadkesdb@gmail.com,
2120067,JAI PRAKASH NARAYAN SARVODAYA VIDYALAYA,.,Senior Secondary,31/03/2020,"BALIKA VIDYALAYA, BHAIYAPURWA BHINGA, SHRAWASTI. UTTAR PRADESH ,","0526 ,224227",atsvishambharpur@gmail.com,
2120064,JAI PRAKASH NARAYAN SARVODAYA VIDYALAYA,.,Senior Secondary,14/11/2017,"SURVAL SAHANI, ALLAHABAD, UTTAR PRADESH ,","0276 ,224855",sudhirhadkesdb@gmail.com,
2120069,JAI PRAKASH NARAYAN SARVODAYA VIDYALAYA,.,Senior Secondary,31/03/2021,"JAIL ROAD NEAR VIKAS BHAWAN, GONDA UP ,",",",,
2120059,JAI PRAKASH NARAYAN SARVODAYA VIDYALAYA BELAPERSUA KHERI,.,Senior Secondary,31/03/2021,"UTTAR PRADESH ,",",09457283271",rrpsraipur@gmail.com,
2120056,JAI PRAKASH NARAYAN SARVODAYA VIDYALAYA MUSEPUR,.,Senior Secondary,31/03/2023,"AZAMGARH, UP-276001 ,",",",,
2120057,"JAI PRAKASH NARAYAN SARVODAYA VIDYALAYA SEKHUIKALA, BALRAMPUR",.,Senior Secondary,31/03/2021,"UTTAR PRADESH -271201 ,",",06122383973",ssq111@rediff.com,
2120060,"JAI PRAKASH NARAYAN SARVODAYA VIDYALAYA, CHHAUCHH,",.,Senior Secondary,31/03/2024,"LAKHIMPUR, KHERI, UTTAR PRADESH ,","0172 ,2676020",gmhs.43@gmail.com,
2131625,JAI PUBLIC SCHOOL,DILEEP MISHRA,Senior Secondary,31/03/2023,"ALLAUDDINPUR, POST-KORAUTA SADAR ,221107","0542 ,2255044",schooljaipublic@gmail.com,
2133428,JAI VIDYA CENTER OF EXCELLENCE,MRS. DAMYANTI MISHRA,Secondary School,31/03/2023,"JAI VIDYA CENTER OF EXCELLENCE , VILL-KHETUI ,LUCKNOW RD,HARDOI(U.P)-241001 ,241001",",9415157921",jvcoehardoi@gmail.com,jaividyacoehardoi.in
2131407,JAIDEEP PUBLIC SCHOOL,Kuldeep shukla,Secondary School,31/03/2025,"VILLAGE - HARSHINGPUR, POST - TILTHI ,312213","5442 ,220556",kshukla.jps@gmail.com,
2133085,JAISH PUBLIC SCHOOL,Mrs Preeti Tiwari,Senior Secondary,31/03/2024,"KESHAVPUR,ANJANSHAHEED,AZAMGARH ,276125",",8400608810",jpsazamgarh@gmail.com,www.jpsazamgarh.in
2131843,JAMUNA MALTI GURUKULAM PUBLIC SCHOOL,MUNISH SHARMA,Senior Secondary,31/03/2024,"KALAKANKAR,PARGANA MANIKPUR, KUNDA, PRATAPGARH ,229408","5341 ,245217",munishsharma047@gmail.com,http://www.xyz.com
2132738,JAMUNA RAM MEMORIAL SCHOOL,MR. ABRI KUMAR BAGHEL,Senior Secondary,31/03/2022,"MANPUR, CHITBARA GAON ,221317","000 ,9415248984",jrmsprincipal2016@gmail.com,http://www.jrmemorialschool.com
2140031,JAWAHAR NAVODAYA VIDAYALAYA,MUKHTAR ALAM,Senior Secondary,31/03/2024,"STS CAMPUS POLICE LINE GHAZIPUR UTTAR PRADESH ,233001","0548 ,2221251",ma786pri@gmail.com,
2140065,JAWAHAR NAVODAYA VIDAYALAYA,MANJU LATA,Senior Secondary,31/03/2030,"RATH DISTT HAMMIRPUR UP ,210431","5280 ,223242",jnvhammirpur@gmail.com,
2140067,JAWAHAR NAVODAYA VIDAYALAYA,R B VERMA,Senior Secondary,31/03/2022,"BPO SIJHOULI, DISTT AMBEDKER NAGAR UP ,224235","5271 ,216611",rbverma24@gmail.com,
2140017,JAWAHAR NAVODAYA VIDYALAYA,SANJAY SHUKLA,Senior Secondary,31/03/2023,"MEJA KHAS DISTT ALLAHBAD UTTAR PRADESH ,212302","0532 ,000000",SANJAYJNV@YAHOO.CO.IN,
2140013,JAWAHAR NAVODAYA VIDYALAYA,RAJNATH SINGH YADAV,Senior Secondary,31/03/2022,"SARSAUL DISTT KANPUR NAGAR UTTAR PRADESH ,209402","91 ,8004939638",rajnath.singhyadav12@gmail.com,
2140015,JAWAHAR NAVODAYA VIDYALAYA,T LAXMI RAJAM,Senior Secondary,31/03/2023,"PEPPE GANJ JANGLE AGAHI AGAHI GANJ GORAKHPUR UTTAR PRADESH ,273165","0551 ,2762224",tlrajamthall06@gmail.com,
2140012,JAWAHAR NAVODAYA VIDYALAYA,HARIHAR  NATH  PANDEY,Senior Secondary,31/03/2025,"JIYANPUR (AZAMGARH) UTTAR PRADESH ,276138","0546 ,62314464",,
2140069,JAWAHAR NAVODAYA VIDYALAYA,MRS. NIRUPAMA SINGH,Senior Secondary,31/03/2022,"MEHRA PURWA DISTT DEORIA PIN 274001 ,274001",",9415489206",jnvdeoria@gmail.com,https://www.navodaya.gov.in/nvs/nvs-school/DEORIA/
2140010,JAWAHAR NAVODAYA VIDYALAYA,DR  PREM SHANKAR MISHRA,Senior Secondary,31/03/2025,"DAILWARA POST DAILWARA DISTT LALITPUR UTTAR PRADESH ,284403","5176 ,285604",teachprem.2008@rediffmail.com,
2140008,JAWAHAR NAVODAYA VIDYALAYA,PREM PRAKASH SHARMA,Senior Secondary,31/03/2023,"KIRTANPUR P.O. TANDWA BASANTPUR BAHRAICH UTTAR PRADESH ,271801","5251 ,227320",PREM21PRAKASH05@GMIAL.COM,
2140020,JAWAHAR NAVODAYA VIDYALAYA,SARITA,Senior Secondary,31/03/2023,"DEVARIA GONDA MANKAPUR COURT MANKAPUR DISTT GONDA UTTAR PRADESH ,271302","5265 ,293224",sarita051261@gmail.com,
2140011,JAWAHAR NAVODAYA VIDYALAYA,MANOJ KUMAR PANDEY,Senior Secondary,31/03/2019,"GAURIGANJ SULTANPUR UTTAR PRADESH ,227409","5368 ,244135",mkpandey.principal@gmail.com,eastkhasihills.jawaharnavodayavidyalaya.in
2140022,JAWAHAR NAVODAYA VIDYALAYA,RAJENDRA KASAR,Senior Secondary,31/03/2024,"RAJEEV PURAM UNNAO UTTAR PRADESH ,241504","5144 ,234057",rrkasarunnao@gmail.com,
2140042,JAWAHAR NAVODAYA VIDYALAYA,YOGENDRA BHAKTA,Senior Secondary,31/03/2026,"NAGIL JALALPUR DISTT KANPUR DEHAT UTTAR PRADESH ,209311","0511 ,211137",bhakta.yogendra@gmail.com,
2140024,JAWAHAR NAVODAYA VIDYALAYA,RAM KUMAR MISHRA,Senior Secondary,31/03/2030,"BAHADURPUR RUDRA NAGAR (BASTI) DT. UTTAR RADESH ,272151","0554 ,208333",rkmlko720@gmail.com,
2140025,JAWAHAR NAVODAYA VIDYALAYA,DR R K PANDEY,Senior Secondary,31/03/2023,"SINHACHAWAR BALLIA UTTAR PRADESH ,221701","5498 ,253059",rkpjnv@gmail.com,
2140027,JAWAHAR NAVODAYA VIDYALAYA,KISUN BIHARI SINGH YADAV,Senior Secondary,31/03/2025,"GYANPUR (BHADOHI) DISTT BHADOHI (SANT RAVIDAS NAGAR) UTTAR PRADESH ,221304","5414 ,250375",kbs12659@rediffmail.com,
2140030,JAWAHAR NAVODAYA VIDYALAYA,RAM NIVAS RAM,Senior Secondary,31/03/2021,"MAHUAR KASARA DISTT MAU UTTAR PRADESH ,275102","0547 ,2275254",jnvmauup@gmail.com,
2140014,JAWAHAR NAVODAYA VIDYALAYA,DR AMAR NATH RAI,Senior Secondary,31/03/2023,"BAWAN BUJURG,BALLA,RAEBARELI, UTTAR PRADESH ,229306","0535 ,2635530",amarnathrai8@gmail.com,
2140028,JAWAHAR NAVODAYA VIDYALAYA,TEJ SAGAR,Senior Secondary,31/03/2025,"AT MILKI RASULPUR DISTT KHUSHI NAGAR UTTAR PRADESH ,274304","0556 ,4240554",principal@jnvkushinagar.org,
2140007,JAWAHAR NAVODAYA VIDYALAYA,VIPIN PRAKASH GUPTA,Senior Secondary,31/03/2025,"ROHILLA FARRUKHABAD MAUGATE UTTAR PRADESH ,206451","5692 ,262016",vpguptanvs@gmail.com,
2140056,JAWAHAR NAVODAYA VIDYALAYA,Sh vimal  kumar mishra,Secondary School,31/03/2022,"GANESH RICE MILL TANDA ROAD AJHUWA KAUSHAMBI UP ,792110","5331 ,212100",o_tripathi@yahoo.com,
2140068,JAWAHAR NAVODAYA VIDYALAYA,RAB BAHAL MAURYA,Secondary School,31/03/2023,"SAMHAR PURA, BHINGA, SHRAWASTI, UP ,271831","5250 ,293087",rbmaurya1960@gmail.com,
2140023,JAWAHAR NAVODAYA VIDYALAYA,RAJENDRA KUMAR CHAUDHARY,Senior Secondary,31/03/2023,"JAIL ROAD SITAPUR KHAIRABAD UP-261 131 ,261131","5862 ,252608",asdn1989@gmail.com,
2140006,JAWAHAR NAVODAYA VIDYALAYA,SAHAB SINGH,Senior Secondary,31/03/2023,"PATEHARA KALAN P O KUBARI PATEHARA MIRZAPUR UTTAR PRADESH ,231309","5442 ,237602",sahabsinghvp@gmail.com,
2140063,JAWAHAR NAVODAYA VIDYALAYA,SURENDRA PRASAD ,Senior Secondary,31/03/2022,"ANAUGI GURSAHAI GANJ DISTT KANNAUJ UP ,209722","5694 ,272601",prasadsurendra18@yahoo.co.in,
2140004,JAWAHAR NAVODAYA VIDYALAYA,PRAVEEN KUMAR SAXENA,Senior Secondary,31/03/2024,"MARIAHU DISTT.JAUNPUR UTTAR PRADESH ,222161","0545 ,233330",PKSAXENA.213@GMAIL.COM,
2140032,JAWAHAR NAVODAYA VIDYALAYA,SUMAN LATA DWIVEDI,Secondary School,31/03/2021,"PIHANI HARDOI DISTT UTTAR PRADESH ,241406","5853 ,262438",dwivedisuman187@gmail.com,
2140035,JAWAHAR NAVODAYA VIDYALAYA,ARCHANA SINGH,Senior Secondary,31/03/2024,"SONIKPUR POST TRIVEDIGANJ DISTT BARABANKI UTTAR PRADESH ,225126","5244 ,294148",jnvbbk@gmail.com,
2140036,JAWAHAR NAVODAYA VIDYALAYA,SADHANA SHUKLA,Senior Secondary,31/03/2025,"BASANTPUR BANSI SIDDHARTHA NAGAR UTTAR PRADESH ,272153","5545 ,214665",jnvsiddharth@gmail.com,
2140037,JAWAHAR NAVODAYA VIDYALAYA,A K PANDEY,Senior Secondary,31/03/2021,"CIVIL LINES ETAWAH UTTAR PRADESH ,206001","5688 ,322521",akpandeynvs@rediffmail.com,
2140038,JAWAHAR NAVODAYA VIDYALAYA,SHAWANA SIDDIQUI,Senior Secondary,31/03/2025,"MAHOBA DISTT MAHOBA UTTAR PRADESH ,210427","5281 ,254897",shawanasamishasha12159@gmail.com,
2140043,JAWAHAR NAVODAYA VIDYALAYA,R K SEJWAR,Senior Secondary,31/03/2022,"AI DISTT JALAUN UTTAR PRADESH ,285001","5162 ,238821",jnvoraijalaun@gmail.com,
2140044,JAWAHAR NAVODAYA VIDYALAYA,SHRI KANT PANDEY,Senior Secondary,31/03/2025,"SARKANDI BINDAKI, FATEHPUR UTTAR PRADESH ,212635","5181 ,291352",jnvfatehpur123@gmail.com,
2140005,JAWAHAR NAVODAYA VIDYALAYA,K K KATIYAR,Senior Secondary,31/03/2024,"BARUASAGAR DISTT. JHANSI UTTAR PRADESH ,284201","0510 ,2735326",katiyar_kaushal@yahoo.com,
2140052,JAWAHAR NAVODAYA VIDYALAYA,ANITA KUMARI,Senior Secondary,31/03/2022,"MITAULI LAKHIMPUR KHERI UTTAR PRADESH ,262727","5875 ,287666",anitakumari2668@gmail.com,http://www.jnvkaraikal.go
2140053,JAWAHAR NAVODAYA VIDYALAYA,T N TRIPATHI,Senior Secondary,31/03/2026,"MANIKPUR DISTT CHITRAKOOT UTTAR PRADESH ,210208","5194 ,222388",tntastrologer@gmail.com,
2140050,JAWAHAR NAVODAYA VIDYALAYA,GOPAL KANT MISHRA,Senior Secondary,31/03/2023,"GHOOGHULPUR POST DEVARIYA DISTT BALARAMPUR UTTAR PRADESH ,271201","5263 ,241059",gkmishrajnv@gmail.com,
2140055,JAWAHAR NAVODAYA VIDYALAYA,MURLIDHAR SAXENA,Senior Secondary,31/03/2025,"GRAM-TAIYYAPUR, POST SAHAYAL, VIA DIBIYAPUR, AURAIYA,UTTAR PRADESH ,206244","5683 ,9412770530",msaxenajnv@gmail.com,
2140057,JAWAHAR NAVODAYA VIDYALAYA,S  P  Tripathi,Senior Secondary,31/03/2023,"GAJOKHAR VARANASI UP ,221206","0542 ,2629371",jnvvaranasi@gmail.com,www.jnvvaranasi.org.in
2140058,JAWAHAR NAVODAYA VIDYALAYA,ANSUMAN SINGH,Senior Secondary,31/03/2023,"AT BAIRATH, P O RAMGARH DISTT CHANDAULI UP ,232107","091 ,249503",singhanshuman68@gmail.com,
2140059,JAWAHAR NAVODAYA VIDYALAYA,SHRI PRAKAS DUBEY,Secondary School,31/03/2023,"VILL JAGDISHPUR GAURA PO HARIHARPUR DISTT SANT KABIR NAGAR UP ,272164","5547 ,252737",drdubesp@rediffmail.com,
2140061,JAWAHAR NAVODAYA VIDYALAYA,SHASHI AGRAWAL,Senior Secondary,31/03/2022,"VILL. DUREDI DISTT. BANDA, UP ,210001","0 ,9415474298",shashiagrawal1964@gmail.com,
2140062,JAWAHAR NAVODAYA VIDYALAYA,Mr Vijai Kumar Bajpai,Senior Secondary,31/03/2024,"PIPERSAND LUCKNOW UTTAR PRADESH ,160101","0522 ,2998789",guptajcprinci@gmail.com,
2140064,JAWAHAR NAVODAYA VIDYALAYA,NEELAM SHRIVASTAV,Senior Secondary,31/03/2025,"ROBERTGANJ SONEBHADRA UTTAR PRADESH ,231216","5444 ,5208671",jnvsnvb@gmail.com,
2140003,JAWAHAR NAVODAYA VIDYALAYA,HAKIMULLAH SIDDIQUE,Senior Secondary,31/03/2023,"DABHASEMAR P O DISTT FAIZABAD UTTAR PRADESH ,224133","5278 ,245656",hsiddique.1960@gmail.com,
2140054,JAWAHAR NAVODAYA VIDYALAYA,JANARDAN UPADHYAY,Secondary School,31/03/2025,"DHANEWA DHANEI MAHARAJGANJ UP ,273303","5523 ,222992",jnv.maharajganj@gmail.com,
2140070,JAWAHAR NAVODAYA VIDYALAYA NO.2,MR. SANT SINGH,Senior Secondary,31/03/2022,"VILL.HARDAURPUR, BLOCK:ALIYA, POST OFFICE: BAMBHOURA, DT. SITAPUR-261 141, UP ,261141",",9415533249",jnvsitapur2@gmail.com,www.jnvsitapur2.org
2140045,JAWAHAR NAVODYA VIDYALAYA,NIRUPAMA SINGH,Senior Secondary,31/03/2023,"NARAINPUR POST SARAIANADEV DISTT PRATAP GARH UTTAR PRADESH ,230144","5342 ,258202",jnvpbh.7500@gmail.com,
2120002,JAY PRAKASH NARAYAN SARVODAYA VIDYALAYA,SANTOSH KUMAR SRIVASTAV,Senior Secondary,31/03/2021,"MOHAAN ROAD, LUCKNOW, UTTAR PRADESH ,226017","0522 ,8052261792",mjrp00123@gmail.com,
2132244,JAYOTRI ACADEMY,MR.YOGENDRA NATH MISHRA,Senior Secondary,31/03/2026,"JAYOTRI ACADEMY (NEAR JAI DHARM KANTA), SATI MANDIR, BIDHUNA ROAD, BHARTHANA ,206242","5680 ,8650332851",jayotriacademy2015@gmail.com,http://www.jayotriacademy.com
2133086,JAYPEE CONVENT SCHOOL,MRS. DR. SUNAINA,Secondary School,31/03/2026,"LUCKNOW-KANPUR NATIONAL HIGHWAY, ASHAKHERA DISTRICT UNNAO (UP) ,209859",",919559611000",jcs_2017@rediffmail.com,http://wwwjaypeeconventschool.com
2131447,JAYPEE INTERNATIONAL SCHOOL,MR. AKHILESH KUMAR,Senior Secondary,31/03/2024,"DHAURERA, AURIA, PINCODE-206122 ,206122","91 ,05683-2444486,",jaypeeinternational@rediffmail.com,http://www.jaypeeauraiya.in
